tunecache.tsv
tunecache	0.5.0	cpu_arch=x86_64,gpu_arch=sm_20	# Last updated Tue May 10 01:24:51 2016

volume	name	aux	block.x	block.y	block.z	grid.x	grid.y	grid.z	shared_bytes	comment
1048576	N4quda10PackSpinorIddLi4ELi3ENS_11FloatNOrderIdLi4ELi3ELi2EEENS_21SpaceSpinorColorOrderIdLi4ELi3EEENS_13PreserveBasisIddLi4ELi3EEEEE	out_stride=1048576,in_stride=1048576	32	1	1	32768	1	1	6336	# 0.00 Gflop/s, 47.22 GB/s, tuned Fri Jan  4 17:38:43 2013
1048576	N4quda10PackSpinorIddLi4ELi3ENS_21SpaceSpinorColorOrderIdLi4ELi3EEENS_11FloatNOrderIdLi4ELi3ELi2EEENS_13PreserveBasisIddLi4ELi3EEEEE	out_stride=1048576,in_stride=1048576	32	1	1	32768	1	1	6336	# 0.00 Gflop/s, 21.46 GB/s, tuned Fri Jan  4 17:47:32 2013
10x10x10x20	N4quda15TwistGamma5CudaI6float4EE	192	1	1	1	1	1	5462	6336	# 0.00 Gflop/s, 21.46 GB/s, tuned Fri Jan  4 17:47:32 2013
10x10x10x20	N4quda15TwistGamma5CudaI7double2EE	384	1	1	1	1	1	4097	6336	# 0.00 Gflop/s, 21.46 GB/s, tuned Fri Jan  4 17:47:32 2013
10x10x10x20	N4quda16WilsonDslashCudaI6float4S1_EE	type=interior,comm=0000,ghost=0000,reconstruct=12	96	1	1	105	1	1	3277	# 111.43 Gflop/s, 0.00 GB/s, tuned Fri Apr 12 16:35:56 2013
10x10x10x20	N4quda16WilsonDslashCudaI7double2S1_EE	type=interior,comm=0000,ghost=0000,reconstruct=12	32	1	1	313	1	1	2341	# 45.98 Gflop/s, 0.00 GB/s, tuned Fri Apr 12 16:35:53 2013
10x10x10x20	N4quda16WilsonDslashCudaI7double2S1_EE	type=interior,comm=0000,ghost=0000,reconstruct=12,Xpay	32	1	1	313	1	1	2341	# 42.22 Gflop/s, 0.00 GB/s, tuned Fri Apr 12 16:35:53 2013
10x10x10x20	N4quda17TwistedDslashCudaI6float4S1_EE	type=interior,comm=0000,ghost=0000,reconstruct=12	384	1	1	27	1	1	2049	# 115.38 Gflop/s, 0.00 GB/s, tuned Fri Apr 12 16:35:56 2013
10x10x10x20	N4quda17TwistedDslashCudaI6float4S1_EE	type=interior,comm=0000,ghost=0000,reconstruct=12,Xpay	384	1	1	27	1	1	4097	# 109.45 Gflop/s, 0.00 GB/s, tuned Fri Apr 12 16:35:56 2013
10x10x10x20	N4quda17TwistedDslashCudaI7double2S1_EE	type=interior,comm=0000,ghost=0000,reconstruct=12	64	1	1	157	1	1	4097	# 45.60 Gflop/s, 0.00 GB/s, tuned Fri Apr 12 16:35:54 2013
10x10x10x20	N4quda17TwistedDslashCudaI7double2S1_EE	type=interior,comm=0000,ghost=0000,reconstruct=12,Xpay	32	1	1	313	1	1	2341	# 43.47 Gflop/s, 0.00 GB/s, tuned Fri Apr 12 16:35:54 2013
12x12x12x12	N4quda11axpyCGNorm2I7double26float26float4EE	stride=20736,prec=4	256	1	1	42	1	1	4096	# 33.75 Gflop/s, 67.50 GB/s, tuned Wed Feb  6 16:27:14 2013
12x12x12x12	N4quda14PackFaceWilsonI6float4EE	dim=1,stride=20736,prec=4	64	1	1	54	1	1	2731	# 0.91 Gflop/s, 21.75 GB/s, tuned Wed Feb  6 16:27:11 2013
12x12x12x12	N4quda14PackFaceWilsonI6float4EE	dim=2,stride=20736,prec=4	128	1	1	27	1	1	5462	# 0.92 Gflop/s, 22.00 GB/s, tuned Wed Feb  6 16:27:11 2013
12x12x12x12	N4quda14PackFaceWilsonI7double2EE	dim=1,stride=20736,prec=8	96	1	1	36	1	1	0	# 0.73 Gflop/s, 34.95 GB/s, tuned Wed Feb  6 16:27:05 2013
12x12x12x12	N4quda14PackFaceWilsonI7double2EE	dim=2,stride=20736,prec=8	96	1	1	36	1	1	0	# 0.82 Gflop/s, 39.22 GB/s, tuned Wed Feb  6 16:27:05 2013
12x12x12x12	N4quda22HeavyQuarkResidualNormI7double37double2S2_EE	stride=20736,prec=8	256	1	1	69	1	1	6144	# 16.74 Gflop/s, 66.94 GB/s, tuned Wed Feb  6 16:27:25 2013
12x12x12x12	N4quda3DotId6float26float4EE	stride=20736,prec=4	96	1	1	77	1	1	768	# 13.82 Gflop/s, 55.27 GB/s, tuned Wed Feb  6 16:27:13 2013
12x12x12x12	N4quda3xpyI7double2S1_EE	stride=20736,prec=8	992	1	1	254	1	1	0	# 3.78 Gflop/s, 90.75 GB/s, tuned Wed Feb  6 16:27:18 2013
12x12x12x12	N4quda4axpyI6float26float4EE	stride=20736,prec=4	64	1	1	112	1	1	0	# 13.57 Gflop/s, 81.42 GB/s, tuned Wed Feb  6 16:27:16 2013
12x12x12x12	N4quda4xpayI6float26float4EE	stride=20736,prec=4	64	1	1	112	1	1	0	# 13.70 Gflop/s, 82.18 GB/s, tuned Wed Feb  6 16:27:12 2013
12x12x12x12	N4quda4xpayI7double2S1_EE	stride=20736,prec=8	1024	1	1	255	1	1	0	# 7.73 Gflop/s, 92.73 GB/s, tuned Wed Feb  6 16:27:06 2013
12x12x12x12	N4quda5Norm2Id7double2S1_EE	stride=20736,prec=8	224	1	1	51	1	1	1792	# 14.19 Gflop/s, 56.76 GB/s, tuned Wed Feb  6 16:27:07 2013
12x12x12x12	N4quda8axpyZpbxI6float26float4EE	stride=20736,prec=4	32	1	1	94	1	1	0	# 34.85 Gflop/s, 87.13 GB/s, tuned Wed Feb  6 16:27:15 2013
12x12x12x12	N4quda8xmyNorm2Id7double2S1_EE	stride=20736,prec=8	64	1	1	112	1	1	512	# 10.41 Gflop/s, 83.26 GB/s, tuned Wed Feb  6 16:27:10 2013
12x12x12x12	copyKernel	stride=20736,out_prec=4,in_prec=8	512	1	1	95	1	1	0	# 0.00 Gflop/s, 80.62 GB/s, tuned Wed Feb  6 16:27:11 2013
12x12x12x12	copyKernel	stride=20736,out_prec=8,in_prec=4	512	1	1	59	1	1	0	# 0.00 Gflop/s, 76.96 GB/s, tuned Wed Feb  6 16:27:16 2013
12x12x12x48	N4quda11axpyCGNorm2I7double26float26float4EE	stride=82944,prec=4	352	1	1	12	1	1	5632	# 42.57 Gflop/s, 85.15 GB/s, tuned Fri Feb 22 15:46:43 2013
12x12x12x48	N4quda14PackFaceWilsonI6float4EE	dim=1,stride=82944,prec=4	192	1	1	72	1	1	5462	# 1.53 Gflop/s, 36.68 GB/s, tuned Fri Feb 22 15:46:33 2013
12x12x12x48	N4quda14PackFaceWilsonI6float4EE	dim=2,stride=82944,prec=4	416	1	1	34	1	1	0	# 1.64 Gflop/s, 39.45 GB/s, tuned Fri Feb 22 15:46:33 2013
12x12x12x48	N4quda14PackFaceWilsonI7double2EE	dim=1,stride=82944,prec=8	192	1	1	72	1	1	0	# 1.04 Gflop/s, 49.73 GB/s, tuned Fri Feb 22 15:46:15 2013
12x12x12x48	N4quda14PackFaceWilsonI7double2EE	dim=2,stride=82944,prec=8	384	1	1	36	1	1	4097	# 1.17 Gflop/s, 56.12 GB/s, tuned Fri Feb 22 15:46:15 2013
12x12x12x48	N4quda22HeavyQuarkResidualNormI7double37double2S2_EE	stride=82944,prec=8	192	1	1	83	1	1	4608	# 20.74 Gflop/s, 82.96 GB/s, tuned Fri Feb 22 15:47:37 2013
12x12x12x48	N4quda3DotId6float26float4EE	stride=82944,prec=4	64	1	1	111	1	1	512	# 19.53 Gflop/s, 78.11 GB/s, tuned Fri Feb 22 15:46:39 2013
12x12x12x48	N4quda3xpyI7double2S1_EE	stride=82944,prec=8	32	1	1	112	1	1	0	# 3.93 Gflop/s, 94.42 GB/s, tuned Fri Feb 22 15:46:58 2013
12x12x12x48	N4quda4axpyI6float26float4EE	stride=82944,prec=4	928	1	1	204	1	1	0	# 15.29 Gflop/s, 91.73 GB/s, tuned Fri Feb 22 15:46:50 2013
12x12x12x48	N4quda4xpayI6float26float4EE	stride=82944,prec=4	896	1	1	152	1	1	0	# 15.54 Gflop/s, 93.22 GB/s, tuned Fri Feb 22 15:46:37 2013
12x12x12x48	N4quda4xpayI7double2S1_EE	stride=82944,prec=8	832	1	1	11	1	1	0	# 7.95 Gflop/s, 95.34 GB/s, tuned Fri Feb 22 15:46:22 2013
12x12x12x48	N4quda5Norm2Id7double2S1_EE	stride=82944,prec=8	384	1	1	83	1	1	3072	# 20.37 Gflop/s, 81.49 GB/s, tuned Fri Feb 22 15:46:24 2013
12x12x12x48	N4quda8axpyZpbxI6float26float4EE	stride=82944,prec=4	32	1	1	79	1	1	0	# 37.19 Gflop/s, 92.98 GB/s, tuned Fri Feb 22 15:46:47 2013
12x12x12x48	N4quda8xmyNorm2Id7double2S1_EE	stride=82944,prec=8	416	1	1	10	1	1	3328	# 11.76 Gflop/s, 94.09 GB/s, tuned Fri Feb 22 15:46:31 2013
12x12x12x48	copyKernel	stride=82944,out_prec=4,in_prec=8	512	1	1	172	1	1	0	# 0.00 Gflop/s, 92.17 GB/s, tuned Fri Feb 22 15:46:33 2013
12x12x12x48	copyKernel	stride=82944,out_prec=8,in_prec=4	544	1	1	126	1	1	0	# 0.00 Gflop/s, 86.22 GB/s, tuned Fri Feb 22 15:46:53 2013
12x12x24x24	N4quda11axpyCGNorm2I7double26float26float4EE	stride=82944,prec=4	480	1	1	10	1	1	7680	# 45.28 Gflop/s, 90.55 GB/s, tuned Wed Feb  6 15:07:40 2013
12x12x24x24	N4quda14PackFaceWilsonI6float4EE	dim=1,stride=82944,prec=4	64	1	1	216	1	1	3277	# 1.89 Gflop/s, 45.31 GB/s, tuned Wed Feb  6 15:07:32 2013
12x12x24x24	N4quda14PackFaceWilsonI7double2EE	dim=1,stride=82944,prec=8	256	1	1	54	1	1	8193	# 1.21 Gflop/s, 58.30 GB/s, tuned Wed Feb  6 15:07:17 2013
12x12x24x24	N4quda22HeavyQuarkResidualNormI7double37double2S2_EE	stride=82944,prec=8	288	1	1	137	1	1	6912	# 21.50 Gflop/s, 86.01 GB/s, tuned Wed Feb  6 15:07:56 2013
12x12x24x24	N4quda3DotId6float26float4EE	stride=82944,prec=4	64	1	1	96	1	1	512	# 20.54 Gflop/s, 82.15 GB/s, tuned Wed Feb  6 15:07:38 2013
12x12x24x24	N4quda3xpyI7double2S1_EE	stride=82944,prec=8	800	1	1	10	1	1	0	# 4.08 Gflop/s, 97.89 GB/s, tuned Wed Feb  6 15:07:54 2013
12x12x24x24	N4quda4axpyI6float26float4EE	stride=82944,prec=4	1024	1	1	246	1	1	0	# 15.84 Gflop/s, 95.06 GB/s, tuned Wed Feb  6 15:07:47 2013
12x12x24x24	N4quda4xpayI6float26float4EE	stride=82944,prec=4	64	1	1	112	1	1	0	# 16.14 Gflop/s, 96.86 GB/s, tuned Wed Feb  6 15:07:35 2013
12x12x24x24	N4quda4xpayI7double2S1_EE	stride=82944,prec=8	800	1	1	11	1	1	0	# 8.20 Gflop/s, 98.42 GB/s, tuned Wed Feb  6 15:07:23 2013
12x12x24x24	N4quda5Norm2Id7double2S1_EE	stride=82944,prec=8	128	1	1	97	1	1	1024	# 21.32 Gflop/s, 85.29 GB/s, tuned Wed Feb  6 15:07:25 2013
12x12x24x24	N4quda8axpyZpbxI6float26float4EE	stride=82944,prec=4	320	1	1	8	1	1	0	# 38.43 Gflop/s, 96.08 GB/s, tuned Wed Feb  6 15:07:44 2013
12x12x24x24	N4quda8xmyNorm2Id7double2S1_EE	stride=82944,prec=8	736	1	1	11	1	1	5888	# 12.00 Gflop/s, 95.99 GB/s, tuned Wed Feb  6 15:07:31 2013
12x12x24x24	copyKernel	stride=82944,out_prec=4,in_prec=8	544	1	1	175	1	1	0	# 0.00 Gflop/s, 90.11 GB/s, tuned Wed Feb  6 15:07:32 2013
12x12x24x24	copyKernel	stride=82944,out_prec=8,in_prec=4	512	1	1	190	1	1	0	# 0.00 Gflop/s, 88.07 GB/s, tuned Wed Feb  6 15:07:49 2013
12x12x24x48	N4quda11axpyCGNorm2I7double26float26float4EE	stride=165888,prec=4	544	1	1	11	1	1	8704	# 48.03 Gflop/s, 96.06 GB/s, tuned Wed Feb  6 14:51:06 2013
12x12x24x48	N4quda14PackFaceWilsonI6float4EE	dim=1,stride=165888,prec=4	64	1	1	432	1	1	3277	# 2.38 Gflop/s, 57.07 GB/s, tuned Wed Feb  6 14:50:52 2013
12x12x24x48	N4quda14PackFaceWilsonI7double2EE	dim=1,stride=165888,prec=8	256	1	1	108	1	1	8193	# 1.40 Gflop/s, 67.25 GB/s, tuned Wed Feb  6 14:50:21 2013
12x12x24x48	N4quda22HeavyQuarkResidualNormI7double37double2S2_EE	stride=165888,prec=8	384	1	1	14	1	1	9216	# 22.42 Gflop/s, 89.69 GB/s, tuned Wed Feb  6 14:51:37 2013
12x12x24x48	N4quda3DotId6float26float4EE	stride=165888,prec=4	64	1	1	112	1	1	512	# 22.63 Gflop/s, 90.53 GB/s, tuned Wed Feb  6 14:51:01 2013
12x12x24x48	N4quda3xpyI7double2S1_EE	stride=165888,prec=8	32	1	1	112	1	1	0	# 4.11 Gflop/s, 98.53 GB/s, tuned Wed Feb  6 14:51:32 2013
12x12x24x48	N4quda4axpyI6float26float4EE	stride=165888,prec=4	448	1	1	11	1	1	0	# 16.30 Gflop/s, 97.77 GB/s, tuned Wed Feb  6 14:51:19 2013
12x12x24x48	N4quda4xpayI6float26float4EE	stride=165888,prec=4	864	1	1	11	1	1	0	# 16.45 Gflop/s, 98.68 GB/s, tuned Wed Feb  6 14:50:57 2013
12x12x24x48	N4quda4xpayI7double2S1_EE	stride=165888,prec=8	832	1	1	11	1	1	0	# 8.21 Gflop/s, 98.55 GB/s, tuned Wed Feb  6 14:50:33 2013
12x12x24x48	N4quda5Norm2Id7double2S1_EE	stride=165888,prec=8	192	1	1	98	1	1	1536	# 23.03 Gflop/s, 92.10 GB/s, tuned Wed Feb  6 14:50:37 2013
12x12x24x48	N4quda8axpyZpbxI6float26float4EE	stride=165888,prec=4	160	1	1	16	1	1	0	# 39.05 Gflop/s, 97.63 GB/s, tuned Wed Feb  6 14:51:14 2013
12x12x24x48	N4quda8xmyNorm2Id7double2S1_EE	stride=165888,prec=8	736	1	1	10	1	1	5888	# 12.07 Gflop/s, 96.59 GB/s, tuned Wed Feb  6 14:50:48 2013
12x12x24x48	copyKernel	stride=165888,out_prec=4,in_prec=8	608	1	1	256	1	1	0	# 0.00 Gflop/s, 91.15 GB/s, tuned Wed Feb  6 14:50:51 2013
12x12x24x48	copyKernel	stride=165888,out_prec=8,in_prec=4	896	1	1	239	1	1	0	# 0.00 Gflop/s, 89.53 GB/s, tuned Wed Feb  6 14:51:23 2013
12x24x12x12	N4quda11axpyCGNorm2I7double26float26float4EE	stride=41472,prec=4	64	1	1	112	1	1	1024	# 40.85 Gflop/s, 81.69 GB/s, tuned Fri Jan  4 18:45:00 2013
12x24x12x12	N4quda14PackFaceWilsonI6float4EE	dim=2,stride=41472,prec=4	64	1	1	108	1	1	0	# 1.63 Gflop/s, 39.12 GB/s, tuned Fri Jan  4 18:44:56 2013
12x24x12x12	N4quda14PackFaceWilsonI7double2EE	dim=2,stride=41472,prec=8	64	1	1	108	1	1	0	# 1.11 Gflop/s, 53.26 GB/s, tuned Fri Jan  4 18:44:47 2013
12x24x12x12	N4quda22HeavyQuarkResidualNormI7double37double2S2_EE	stride=41472,prec=8	288	1	1	130	1	1	6912	# 19.68 Gflop/s, 78.71 GB/s, tuned Fri Jan  4 18:45:12 2013
12x24x12x12	N4quda3DotId6float26float4EE	stride=41472,prec=4	64	1	1	97	1	1	512	# 17.78 Gflop/s, 71.14 GB/s, tuned Fri Jan  4 18:44:58 2013
12x24x12x12	N4quda3xpyI7double2S1_EE	stride=41472,prec=8	64	1	1	112	1	1	0	# 4.05 Gflop/s, 97.28 GB/s, tuned Fri Jan  4 18:45:07 2013
12x24x12x12	N4quda4axpyI6float26float4EE	stride=41472,prec=4	64	1	1	112	1	1	0	# 15.26 Gflop/s, 91.55 GB/s, tuned Fri Jan  4 18:45:03 2013
12x24x12x12	N4quda4xpayI6float26float4EE	stride=41472,prec=4	992	1	1	251	1	1	0	# 15.31 Gflop/s, 91.84 GB/s, tuned Fri Jan  4 18:44:57 2013
12x24x12x12	N4quda4xpayI7double2S1_EE	stride=41472,prec=8	576	1	1	11	1	1	0	# 8.07 Gflop/s, 96.87 GB/s, tuned Fri Jan  4 18:44:51 2013
12x24x12x12	N4quda5Norm2Id7double2S1_EE	stride=41472,prec=8	128	1	1	95	1	1	1024	# 18.59 Gflop/s, 74.34 GB/s, tuned Fri Jan  4 18:44:49 2013
12x24x12x12	N4quda8axpyZpbxI6float26float4EE	stride=41472,prec=4	32	1	1	79	1	1	0	# 37.53 Gflop/s, 93.81 GB/s, tuned Fri Jan  4 18:45:02 2013
12x24x12x12	N4quda8xmyNorm2Id7double2S1_EE	stride=41472,prec=8	64	1	1	65	1	1	512	# 11.53 Gflop/s, 92.25 GB/s, tuned Fri Jan  4 18:44:55 2013
12x24x12x12	copyKernel	stride=41472,out_prec=4,in_prec=8	512	1	1	216	1	1	0	# 0.00 Gflop/s, 86.94 GB/s, tuned Fri Jan  4 18:44:56 2013
12x24x12x12	copyKernel	stride=41472,out_prec=8,in_prec=4	512	1	1	170	1	1	0	# 0.00 Gflop/s, 85.08 GB/s, tuned Fri Jan  4 18:45:05 2013
12x24x12x24	N4quda11axpyCGNorm2I7double26float26float4EE	stride=82944,prec=4	416	1	1	13	1	1	6656	# 45.58 Gflop/s, 91.16 GB/s, tuned Wed Feb  6 15:03:07 2013
12x24x12x24	N4quda14PackFaceWilsonI6float4EE	dim=2,stride=82944,prec=4	544	1	1	26	1	1	8193	# 2.09 Gflop/s, 50.17 GB/s, tuned Wed Feb  6 15:03:00 2013
12x24x12x24	N4quda14PackFaceWilsonI7double2EE	dim=2,stride=82944,prec=8	256	1	1	54	1	1	8193	# 1.42 Gflop/s, 68.14 GB/s, tuned Wed Feb  6 15:02:44 2013
12x24x12x24	N4quda22HeavyQuarkResidualNormI7double37double2S2_EE	stride=82944,prec=8	320	1	1	246	1	1	7680	# 21.48 Gflop/s, 85.90 GB/s, tuned Wed Feb  6 15:03:23 2013
12x24x12x24	N4quda3DotId6float26float4EE	stride=82944,prec=4	64	1	1	112	1	1	512	# 20.70 Gflop/s, 82.81 GB/s, tuned Wed Feb  6 15:03:05 2013
12x24x12x24	N4quda3xpyI7double2S1_EE	stride=82944,prec=8	864	1	1	10	1	1	0	# 4.07 Gflop/s, 97.63 GB/s, tuned Wed Feb  6 15:03:21 2013
12x24x12x24	N4quda4axpyI6float26float4EE	stride=82944,prec=4	576	1	1	11	1	1	0	# 15.88 Gflop/s, 95.28 GB/s, tuned Wed Feb  6 15:03:14 2013
12x24x12x24	N4quda4xpayI6float26float4EE	stride=82944,prec=4	448	1	1	11	1	1	0	# 16.06 Gflop/s, 96.38 GB/s, tuned Wed Feb  6 15:03:03 2013
12x24x12x24	N4quda4xpayI7double2S1_EE	stride=82944,prec=8	800	1	1	11	1	1	0	# 8.24 Gflop/s, 98.83 GB/s, tuned Wed Feb  6 15:02:50 2013
12x24x12x24	N4quda5Norm2Id7double2S1_EE	stride=82944,prec=8	256	1	1	70	1	1	2048	# 21.13 Gflop/s, 84.52 GB/s, tuned Wed Feb  6 15:02:52 2013
12x24x12x24	N4quda8axpyZpbxI6float26float4EE	stride=82944,prec=4	384	1	1	8	1	1	0	# 38.52 Gflop/s, 96.30 GB/s, tuned Wed Feb  6 15:03:11 2013
12x24x12x24	N4quda8xmyNorm2Id7double2S1_EE	stride=82944,prec=8	704	1	1	11	1	1	5632	# 12.01 Gflop/s, 96.06 GB/s, tuned Wed Feb  6 15:02:58 2013
12x24x12x24	copyKernel	stride=82944,out_prec=4,in_prec=8	416	1	1	240	1	1	0	# 0.00 Gflop/s, 90.10 GB/s, tuned Wed Feb  6 15:03:00 2013
12x24x12x24	copyKernel	stride=82944,out_prec=8,in_prec=4	608	1	1	228	1	1	0	# 0.00 Gflop/s, 88.20 GB/s, tuned Wed Feb  6 15:03:16 2013
12x24x12x48	N4quda11axpyCGNorm2I7double26float26float4EE	stride=165888,prec=4	512	1	1	10	1	1	8192	# 48.14 Gflop/s, 96.28 GB/s, tuned Tue Feb  5 18:48:28 2013
12x24x12x48	N4quda14PackFaceWilsonI6float4EE	dim=2,stride=165888,prec=4	64	1	1	432	1	1	2731	# 2.76 Gflop/s, 66.14 GB/s, tuned Tue Feb  5 18:48:14 2013
12x24x12x48	N4quda14PackFaceWilsonI7double2EE	dim=2,stride=165888,prec=8	288	1	1	96	1	1	2049	# 1.64 Gflop/s, 78.67 GB/s, tuned Tue Feb  5 18:47:44 2013
12x24x12x48	N4quda22HeavyQuarkResidualNormI7double37double2S2_EE	stride=165888,prec=8	352	1	1	14	1	1	8448	# 22.52 Gflop/s, 90.07 GB/s, tuned Tue Feb  5 18:49:18 2013
12x24x12x48	N4quda3DotId6float26float4EE	stride=165888,prec=4	64	1	1	112	1	1	512	# 22.66 Gflop/s, 90.65 GB/s, tuned Tue Feb  5 18:48:23 2013
12x24x12x48	N4quda3xpyI7double2S1_EE	stride=165888,prec=8	800	1	1	10	1	1	0	# 4.10 Gflop/s, 98.50 GB/s, tuned Tue Feb  5 18:48:55 2013
12x24x12x48	N4quda4axpyI6float26float4EE	stride=165888,prec=4	448	1	1	9	1	1	0	# 16.37 Gflop/s, 98.21 GB/s, tuned Tue Feb  5 18:48:41 2013
12x24x12x48	N4quda4xpayI6float26float4EE	stride=165888,prec=4	416	1	1	10	1	1	0	# 16.44 Gflop/s, 98.65 GB/s, tuned Tue Feb  5 18:48:20 2013
12x24x12x48	N4quda4xpayI7double2S1_EE	stride=165888,prec=8	32	1	1	112	1	1	0	# 8.23 Gflop/s, 98.75 GB/s, tuned Tue Feb  5 18:47:55 2013
12x24x12x48	N4quda5Norm2Id7double2S1_EE	stride=165888,prec=8	480	1	1	28	1	1	3840	# 23.01 Gflop/s, 92.05 GB/s, tuned Tue Feb  5 18:47:59 2013
12x24x12x48	N4quda8axpyZpbxI6float26float4EE	stride=165888,prec=4	192	1	1	16	1	1	0	# 38.90 Gflop/s, 97.24 GB/s, tuned Tue Feb  5 18:48:36 2013
12x24x12x48	N4quda8xmyNorm2Id7double2S1_EE	stride=165888,prec=8	32	1	1	112	1	1	512	# 12.14 Gflop/s, 97.09 GB/s, tuned Tue Feb  5 18:48:11 2013
12x24x12x48	copyKernel	stride=165888,out_prec=4,in_prec=8	544	1	1	253	1	1	0	# 0.00 Gflop/s, 91.75 GB/s, tuned Tue Feb  5 18:48:14 2013
12x24x12x48	copyKernel	stride=165888,out_prec=8,in_prec=4	800	1	1	228	1	1	0	# 0.00 Gflop/s, 89.91 GB/s, tuned Tue Feb  5 18:48:45 2013
12x24x24x12	N4quda11axpyCGNorm2I7double26float26float4EE	stride=82944,prec=4	544	1	1	11	1	1	8704	# 45.63 Gflop/s, 91.26 GB/s, tuned Fri Jan  4 18:04:10 2013
12x24x24x12	N4quda11axpyCGNorm2I7double2S1_S1_EE	stride=82944,prec=8	608	1	1	12	1	1	9728	# 24.45 Gflop/s, 97.82 GB/s, tuned Mon Apr 18 20:48:19 2016
12x24x24x12	N4quda22HeavyQuarkResidualNormI7double37double2S2_EE	stride=82944,prec=8	288	1	1	137	1	1	6912	# 21.75 Gflop/s, 86.98 GB/s, tuned Fri Jan  4 18:04:30 2013
12x24x24x12	N4quda3DotId6float26float4EE	stride=82944,prec=4	64	1	1	112	1	1	512	# 20.89 Gflop/s, 83.56 GB/s, tuned Fri Jan  4 18:04:07 2013
12x24x24x12	N4quda3DotId7double2S1_EE	stride=82944,prec=8	608	1	1	14	1	1	4864	# 11.46 Gflop/s, 91.68 GB/s, tuned Mon Apr 18 20:48:14 2016
12x24x24x12	N4quda3xpyI7double2S1_EE	stride=82944,prec=8	32	1	1	112	1	1	0	# 4.10 Gflop/s, 98.29 GB/s, tuned Fri Jan  4 18:04:23 2013
12x24x24x12	N4quda4axpyI6float26float4EE	stride=82944,prec=4	1024	1	1	247	1	1	0	# 15.92 Gflop/s, 95.53 GB/s, tuned Fri Jan  4 18:04:16 2013
12x24x24x12	N4quda4axpyI7double2S1_EE	stride=82944,prec=8	864	1	1	12	1	1	0	# 8.32 Gflop/s, 99.87 GB/s, tuned Mon Apr 18 20:48:31 2016
12x24x24x12	N4quda4xpayI6float26float4EE	stride=82944,prec=4	640	1	1	9	1	1	0	# 15.97 Gflop/s, 95.84 GB/s, tuned Fri Jan  4 18:04:05 2013
12x24x24x12	N4quda4xpayI7double2S1_EE	stride=82944,prec=8	416	1	1	10	1	1	0	# 8.23 Gflop/s, 98.74 GB/s, tuned Fri Jan  4 18:03:54 2013
12x24x24x12	N4quda5Norm2Id7double2S1_EE	stride=82944,prec=8	128	1	1	96	1	1	1024	# 21.48 Gflop/s, 85.92 GB/s, tuned Fri Jan  4 18:03:49 2013
12x24x24x12	N4quda8axpyZpbxI6float26float4EE	stride=82944,prec=4	192	1	1	16	1	1	0	# 38.78 Gflop/s, 96.94 GB/s, tuned Fri Jan  4 18:04:14 2013
12x24x24x12	N4quda8axpyZpbxI7double2S1_EE	stride=82944,prec=8	320	1	1	8	1	1	0	# 19.78 Gflop/s, 98.89 GB/s, tuned Mon Apr 18 20:48:27 2016
12x24x24x12	N4quda8xmyNorm2Id7double2S1_EE	stride=82944,prec=8	448	1	1	9	1	1	3584	# 11.95 Gflop/s, 95.61 GB/s, tuned Fri Jan  4 18:04:00 2013
12x24x24x12	copyKernel	stride=82944,out_prec=4,in_prec=8	384	1	1	208	1	1	0	# 0.00 Gflop/s, 90.64 GB/s, tuned Fri Jan  4 18:04:02 2013
12x24x24x12	copyKernel	stride=82944,out_prec=8,in_prec=4	640	1	1	143	1	1	0	# 0.00 Gflop/s, 88.77 GB/s, tuned Fri Jan  4 18:04:18 2013
12x24x24x24	N4quda11axpyCGNorm2I7double26float26float4EE	stride=165888,prec=4	512	1	1	11	1	1	8192	# 48.53 Gflop/s, 97.05 GB/s, tuned Fri Jan  4 18:00:26 2013
12x24x24x24	N4quda11axpyCGNorm2I7double2S1_S1_EE	stride=165888,prec=8	800	1	1	11	1	1	12800	# 24.23 Gflop/s, 96.92 GB/s, tuned Fri Feb 15 10:46:49 2013
12x24x24x24	N4quda22HeavyQuarkResidualNormI7double37double2S2_EE	stride=165888,prec=8	384	1	1	14	1	1	9216	# 22.58 Gflop/s, 90.32 GB/s, tuned Fri Jan  4 18:01:04 2013
12x24x24x24	N4quda2axI7double2S1_EE	stride=165888,prec=8	928	1	1	7	1	1	0	# 6.20 Gflop/s, 99.25 GB/s, tuned Thu Jan 31 10:14:25 2013
12x24x24x24	N4quda3DotId6float26float4EE	stride=165888,prec=4	96	1	1	112	1	1	768	# 22.85 Gflop/s, 91.39 GB/s, tuned Fri Jan  4 18:00:21 2013
12x24x24x24	N4quda3DotId7double2S1_EE	stride=165888,prec=8	64	1	1	112	1	1	512	# 11.85 Gflop/s, 94.83 GB/s, tuned Fri Feb 15 10:46:40 2013
12x24x24x24	N4quda3xpyI7double2S1_EE	stride=165888,prec=8	32	1	1	111	1	1	0	# 4.13 Gflop/s, 99.11 GB/s, tuned Fri Jan  4 18:00:53 2013
12x24x24x24	N4quda4axpyI6float26float4EE	stride=165888,prec=4	416	1	1	10	1	1	0	# 16.38 Gflop/s, 98.31 GB/s, tuned Fri Jan  4 18:00:39 2013
12x24x24x24	N4quda4axpyI7double2S1_EE	stride=165888,prec=8	32	1	1	109	1	1	0	# 8.18 Gflop/s, 98.14 GB/s, tuned Fri Feb 15 10:47:15 2013
12x24x24x24	N4quda4xpayI6float26float4EE	stride=165888,prec=4	416	1	1	10	1	1	0	# 16.40 Gflop/s, 98.38 GB/s, tuned Fri Jan  4 18:00:18 2013
12x24x24x24	N4quda4xpayI7double2S1_EE	stride=165888,prec=8	32	1	1	109	1	1	0	# 8.24 Gflop/s, 98.86 GB/s, tuned Fri Jan  4 17:59:57 2013
12x24x24x24	N4quda5Norm2Id7double2S1_EE	stride=165888,prec=8	320	1	1	56	1	1	2560	# 23.20 Gflop/s, 92.80 GB/s, tuned Fri Jan  4 17:59:47 2013
12x24x24x24	N4quda8axpyZpbxI6float26float4EE	stride=165888,prec=4	384	1	1	8	1	1	0	# 39.55 Gflop/s, 98.87 GB/s, tuned Fri Jan  4 18:00:34 2013
12x24x24x24	N4quda8axpyZpbxI7double2S1_EE	stride=165888,prec=8	160	1	1	16	1	1	0	# 19.32 Gflop/s, 96.62 GB/s, tuned Fri Feb 15 10:47:05 2013
12x24x24x24	N4quda8xmyNorm2Id7double2S1_EE	stride=165888,prec=8	32	1	1	112	1	1	512	# 12.22 Gflop/s, 97.72 GB/s, tuned Fri Jan  4 18:00:09 2013
12x24x24x24	copyKernel	stride=165888,out_prec=4,in_prec=8	512	1	1	254	1	1	0	# 0.00 Gflop/s, 91.42 GB/s, tuned Fri Jan  4 18:00:12 2013
12x24x24x24	copyKernel	stride=165888,out_prec=8,in_prec=4	736	1	1	238	1	1	0	# 0.00 Gflop/s, 89.84 GB/s, tuned Fri Jan  4 18:00:43 2013
12x24x24x3	N4quda11axpyCGNorm2I7double26float26float4EE	stride=20736,prec=4	64	1	1	112	1	1	1024	# 33.92 Gflop/s, 67.84 GB/s, tuned Fri Jan  4 18:15:09 2013
12x24x24x3	N4quda22HeavyQuarkResidualNormI7double37double2S2_EE	stride=20736,prec=8	160	1	1	102	1	1	3840	# 17.00 Gflop/s, 67.99 GB/s, tuned Fri Jan  4 18:15:14 2013
12x24x24x3	N4quda3DotId6float26float4EE	stride=20736,prec=4	96	1	1	62	1	1	768	# 13.95 Gflop/s, 55.82 GB/s, tuned Fri Jan  4 18:15:07 2013
12x24x24x3	N4quda3xpyI7double2S1_EE	stride=20736,prec=8	64	1	1	112	1	1	0	# 3.86 Gflop/s, 92.62 GB/s, tuned Fri Jan  4 18:15:13 2013
12x24x24x3	N4quda4axpyI6float26float4EE	stride=20736,prec=4	64	1	1	110	1	1	0	# 13.61 Gflop/s, 81.67 GB/s, tuned Fri Jan  4 18:15:11 2013
12x24x24x3	N4quda4xpayI6float26float4EE	stride=20736,prec=4	64	1	1	111	1	1	0	# 13.76 Gflop/s, 82.58 GB/s, tuned Fri Jan  4 18:15:07 2013
12x24x24x3	N4quda4xpayI7double2S1_EE	stride=20736,prec=8	992	1	1	256	1	1	0	# 7.82 Gflop/s, 93.83 GB/s, tuned Fri Jan  4 18:15:03 2013
12x24x24x3	N4quda5Norm2Id7double2S1_EE	stride=20736,prec=8	160	1	1	78	1	1	1280	# 14.73 Gflop/s, 58.91 GB/s, tuned Fri Jan  4 18:15:02 2013
12x24x24x3	N4quda8axpyZpbxI6float26float4EE	stride=20736,prec=4	32	1	1	96	1	1	0	# 35.00 Gflop/s, 87.49 GB/s, tuned Fri Jan  4 18:15:10 2013
12x24x24x3	N4quda8xmyNorm2Id7double2S1_EE	stride=20736,prec=8	64	1	1	64	1	1	512	# 10.44 Gflop/s, 83.52 GB/s, tuned Fri Jan  4 18:15:05 2013
12x24x24x3	copyKernel	stride=20736,out_prec=4,in_prec=8	512	1	1	51	1	1	0	# 0.00 Gflop/s, 81.75 GB/s, tuned Fri Jan  4 18:15:06 2013
12x24x24x3	copyKernel	stride=20736,out_prec=8,in_prec=4	576	1	1	38	1	1	0	# 0.00 Gflop/s, 77.76 GB/s, tuned Fri Jan  4 18:15:11 2013
12x24x24x4	N4quda11axpyCGNorm2I7double26float26float4EE	stride=27648,prec=4	64	1	1	112	1	1	1024	# 37.06 Gflop/s, 74.12 GB/s, tuned Fri Jan  4 18:32:24 2013
12x24x24x4	N4quda22HeavyQuarkResidualNormI7double37double2S2_EE	stride=27648,prec=8	96	1	1	84	1	1	2304	# 18.37 Gflop/s, 73.50 GB/s, tuned Fri Jan  4 18:32:33 2013
12x24x24x4	N4quda3DotId6float26float4EE	stride=27648,prec=4	64	1	1	110	1	1	512	# 15.72 Gflop/s, 62.88 GB/s, tuned Fri Jan  4 18:32:23 2013
12x24x24x4	N4quda3xpyI7double2S1_EE	stride=27648,prec=8	1024	1	1	234	1	1	0	# 3.92 Gflop/s, 94.18 GB/s, tuned Fri Jan  4 18:32:29 2013
12x24x24x4	N4quda4axpyI6float26float4EE	stride=27648,prec=4	992	1	1	177	1	1	0	# 14.52 Gflop/s, 87.10 GB/s, tuned Fri Jan  4 18:32:26 2013
12x24x24x4	N4quda4xpayI6float26float4EE	stride=27648,prec=4	992	1	1	168	1	1	0	# 14.52 Gflop/s, 87.13 GB/s, tuned Fri Jan  4 18:32:22 2013
12x24x24x4	N4quda4xpayI7double2S1_EE	stride=27648,prec=8	64	1	1	65	1	1	0	# 7.92 Gflop/s, 95.06 GB/s, tuned Fri Jan  4 18:32:18 2013
12x24x24x4	N4quda5Norm2Id7double2S1_EE	stride=27648,prec=8	288	1	1	41	1	1	2304	# 16.39 Gflop/s, 65.54 GB/s, tuned Fri Jan  4 18:32:16 2013
12x24x24x4	N4quda8axpyZpbxI6float26float4EE	stride=27648,prec=4	32	1	1	91	1	1	0	# 36.11 Gflop/s, 90.27 GB/s, tuned Fri Jan  4 18:32:25 2013
12x24x24x4	N4quda8xmyNorm2Id7double2S1_EE	stride=27648,prec=8	64	1	1	112	1	1	512	# 11.00 Gflop/s, 88.04 GB/s, tuned Fri Jan  4 18:32:20 2013
12x24x24x4	copyKernel	stride=27648,out_prec=4,in_prec=8	512	1	1	149	1	1	0	# 0.00 Gflop/s, 84.44 GB/s, tuned Fri Jan  4 18:32:21 2013
12x24x24x4	copyKernel	stride=27648,out_prec=8,in_prec=4	480	1	1	118	1	1	0	# 0.00 Gflop/s, 81.75 GB/s, tuned Fri Jan  4 18:32:27 2013
12x24x24x48	N4quda11axpyCGNorm2I7double26float26float4EE	stride=331776,prec=4	576	1	1	11	1	1	9216	# 48.84 Gflop/s, 97.67 GB/s, tuned Thu Jan  3 12:22:38 2013
12x24x24x48	N4quda22HeavyQuarkResidualNormI7double37double2S2_EE	stride=331776,prec=8	192	1	1	167	1	1	4608	# 22.67 Gflop/s, 90.69 GB/s, tuned Thu Jan  3 12:23:42 2013
12x24x24x48	N4quda3DotId6float26float4EE	stride=331776,prec=4	64	1	1	112	1	1	512	# 23.65 Gflop/s, 94.61 GB/s, tuned Thu Jan  3 12:22:29 2013
12x24x24x48	N4quda3xpyI7double2S1_EE	stride=331776,prec=8	32	1	1	112	1	1	0	# 4.06 Gflop/s, 97.55 GB/s, tuned Thu Jan  3 12:23:31 2013
12x24x24x48	N4quda4axpyI6float26float4EE	stride=331776,prec=4	32	1	1	112	1	1	0	# 16.44 Gflop/s, 98.64 GB/s, tuned Thu Jan  3 12:23:03 2013
12x24x24x48	N4quda4xpayI6float26float4EE	stride=331776,prec=4	32	1	1	112	1	1	0	# 16.36 Gflop/s, 98.15 GB/s, tuned Thu Jan  3 12:22:22 2013
12x24x24x48	N4quda4xpayI7double2S1_EE	stride=331776,prec=8	32	1	1	108	1	1	0	# 8.07 Gflop/s, 96.83 GB/s, tuned Thu Jan  3 12:21:42 2013
12x24x24x48	N4quda5Norm2Id7double2S1_EE	stride=331776,prec=8	864	1	1	14	1	1	6912	# 24.14 Gflop/s, 96.58 GB/s, tuned Thu Jan  3 12:21:21 2013
12x24x24x48	N4quda8axpyZpbxI6float26float4EE	stride=331776,prec=4	288	1	1	8	1	1	0	# 38.86 Gflop/s, 97.15 GB/s, tuned Thu Jan  3 12:22:54 2013
12x24x24x48	N4quda8xmyNorm2Id7double2S1_EE	stride=331776,prec=8	448	1	1	10	1	1	3584	# 11.95 Gflop/s, 95.61 GB/s, tuned Thu Jan  3 12:22:05 2013
12x24x24x48	copyKernel	stride=331776,out_prec=4,in_prec=8	512	1	1	8	1	1	0	# 0.00 Gflop/s, 91.18 GB/s, tuned Thu Jan  3 12:22:11 2013
12x24x24x48	copyKernel	stride=331776,out_prec=8,in_prec=4	864	1	1	254	1	1	0	# 0.00 Gflop/s, 88.61 GB/s, tuned Thu Jan  3 12:23:12 2013
12x24x24x6	N4quda11axpyCGNorm2I7double26float26float4EE	stride=41472,prec=4	64	1	1	112	1	1	1024	# 41.28 Gflop/s, 82.56 GB/s, tuned Fri Jan  4 18:22:01 2013
12x24x24x6	N4quda22HeavyQuarkResidualNormI7double37double2S2_EE	stride=41472,prec=8	320	1	1	116	1	1	7680	# 19.71 Gflop/s, 78.84 GB/s, tuned Fri Jan  4 18:22:13 2013
12x24x24x6	N4quda3DotId6float26float4EE	stride=41472,prec=4	128	1	1	96	1	1	1024	# 17.89 Gflop/s, 71.54 GB/s, tuned Fri Jan  4 18:21:59 2013
12x24x24x6	N4quda3xpyI7double2S1_EE	stride=41472,prec=8	64	1	1	112	1	1	0	# 4.04 Gflop/s, 96.93 GB/s, tuned Fri Jan  4 18:22:08 2013
12x24x24x6	N4quda4axpyI6float26float4EE	stride=41472,prec=4	992	1	1	253	1	1	0	# 15.32 Gflop/s, 91.93 GB/s, tuned Fri Jan  4 18:22:04 2013
12x24x24x6	N4quda4xpayI6float26float4EE	stride=41472,prec=4	64	1	1	112	1	1	0	# 15.56 Gflop/s, 93.34 GB/s, tuned Fri Jan  4 18:21:58 2013
12x24x24x6	N4quda4xpayI7double2S1_EE	stride=41472,prec=8	64	1	1	112	1	1	0	# 8.09 Gflop/s, 97.02 GB/s, tuned Fri Jan  4 18:21:52 2013
12x24x24x6	N4quda5Norm2Id7double2S1_EE	stride=41472,prec=8	128	1	1	96	1	1	1024	# 18.68 Gflop/s, 74.70 GB/s, tuned Fri Jan  4 18:21:49 2013
12x24x24x6	N4quda8axpyZpbxI6float26float4EE	stride=41472,prec=4	1024	1	1	251	1	1	0	# 37.48 Gflop/s, 93.70 GB/s, tuned Fri Jan  4 18:22:03 2013
12x24x24x6	N4quda8xmyNorm2Id7double2S1_EE	stride=41472,prec=8	64	1	1	112	1	1	512	# 11.61 Gflop/s, 92.86 GB/s, tuned Fri Jan  4 18:21:55 2013
12x24x24x6	copyKernel	stride=41472,out_prec=4,in_prec=8	512	1	1	233	1	1	0	# 0.00 Gflop/s, 87.41 GB/s, tuned Fri Jan  4 18:21:56 2013
12x24x24x6	copyKernel	stride=41472,out_prec=8,in_prec=4	512	1	1	141	1	1	0	# 0.00 Gflop/s, 85.78 GB/s, tuned Fri Jan  4 18:22:05 2013
165888	N4quda10PackSpinorIddLi4ELi3ENS_11FloatNOrderIdLi4ELi3ELi2EEENS_21SpaceSpinorColorOrderIdLi4ELi3EEENS_13PreserveBasisIddLi4ELi3EEEEE	out_stride=165888,in_stride=165888	32	1	1	5184	1	1	6336	# 0.00 Gflop/s, 45.71 GB/s, tuned Fri Jan  4 17:59:41 2013
165888	N4quda10PackSpinorIddLi4ELi3ENS_21SpaceSpinorColorOrderIdLi4ELi3EEENS_11FloatNOrderIdLi4ELi3ELi2EEENS_13PreserveBasisIddLi4ELi3EEEEE	out_stride=165888,in_stride=165888	32	1	1	5184	1	1	6336	# 0.00 Gflop/s, 21.08 GB/s, tuned Fri Jan  4 18:01:04 2013
16x16x16x16	N4quda15TwistGamma5CudaI6float4EE	128	1	1	1	1	1	4097	0	# 0.00 Gflop/s, 21.08 GB/s, tuned Fri Jan  4 18:01:04 2013
16x16x16x16	N4quda15TwistGamma5CudaI6float4EE	160	1	1	1	1	1	0	0	# 0.00 Gflop/s, 21.08 GB/s, tuned Fri Jan  4 18:01:04 2013
16x16x16x16	N4quda15TwistGamma5CudaI6float4EE	192	1	1	1	1	1	5462	0	# 0.00 Gflop/s, 21.08 GB/s, tuned Fri Jan  4 18:01:04 2013
16x16x16x16	N4quda15TwistGamma5CudaI6float4EE	256	1	1	1	1	1	3277	0	# 0.00 Gflop/s, 21.08 GB/s, tuned Fri Jan  4 18:01:04 2013
16x16x16x16	N4quda15TwistGamma5CudaI6float4EE	288	1	1	1	1	1	8193	0	# 0.00 Gflop/s, 21.08 GB/s, tuned Fri Jan  4 18:01:04 2013
16x16x16x16	N4quda15TwistGamma5CudaI6float4EE	320	1	1	1	1	1	2731	0	# 0.00 Gflop/s, 21.08 GB/s, tuned Fri Jan  4 18:01:04 2013
16x16x16x16	N4quda15TwistGamma5CudaI6float4EE	384	1	1	1	1	1	8193	0	# 0.00 Gflop/s, 21.08 GB/s, tuned Fri Jan  4 18:01:04 2013
16x16x16x16	N4quda15TwistGamma5CudaI6float4EE	448	1	1	1	1	1	5462	0	# 0.00 Gflop/s, 21.08 GB/s, tuned Fri Jan  4 18:01:04 2013
16x16x16x16	N4quda15TwistGamma5CudaI6float4EE	480	1	1	1	1	1	4097	0	# 0.00 Gflop/s, 21.08 GB/s, tuned Fri Jan  4 18:01:04 2013
16x16x16x16	N4quda15TwistGamma5CudaI6float4EE	512	1	1	1	1	1	8193	0	# 0.00 Gflop/s, 21.08 GB/s, tuned Fri Jan  4 18:01:04 2013
16x16x16x16	N4quda15TwistGamma5CudaI6float4EE	544	1	1	1	1	1	2049	0	# 0.00 Gflop/s, 21.08 GB/s, tuned Fri Jan  4 18:01:04 2013
16x16x16x16	N4quda15TwistGamma5CudaI6float4EE	576	1	1	1	1	1	2731	0	# 0.00 Gflop/s, 21.08 GB/s, tuned Fri Jan  4 18:01:04 2013
16x16x16x16	N4quda15TwistGamma5CudaI6float4EE	608	1	1	1	1	1	2341	6336	# 0.00 Gflop/s, 21.08 GB/s, tuned Fri Jan  4 18:01:04 2013
16x16x16x16	N4quda15TwistGamma5CudaI6float4EE	96	1	1	1	1	1	3277	0	# 0.00 Gflop/s, 21.08 GB/s, tuned Fri Jan  4 18:01:04 2013
16x16x16x16	N4quda15TwistGamma5CudaI7double2EE		288	1	1	1	1	1	5462	# 5.52 Gflop/s, 0.00 GB/s, tuned Tue May 10 01:16:22 2016
16x16x16x16	N4quda15TwistGamma5CudaI7double2EE	192	1	1	1	1	1	0	0	# 0.00 Gflop/s, 21.08 GB/s, tuned Fri Jan  4 18:01:04 2013
16x16x16x16	N4quda15TwistGamma5CudaI7double2EE	224	1	1	1	1	1	2731	0	# 0.00 Gflop/s, 21.08 GB/s, tuned Fri Jan  4 18:01:04 2013
16x16x16x16	N4quda15TwistGamma5CudaI7double2EE	256	1	1	1	1	1	8193	0	# 0.00 Gflop/s, 21.08 GB/s, tuned Fri Jan  4 18:01:04 2013
16x16x16x16	N4quda15TwistGamma5CudaI7double2EE	288	1	1	1	1	1	2049	0	# 0.00 Gflop/s, 21.08 GB/s, tuned Fri Jan  4 18:01:04 2013
16x16x16x16	N4quda15TwistGamma5CudaI7double2EE	320	1	1	1	1	1	5462	0	# 0.00 Gflop/s, 21.08 GB/s, tuned Fri Jan  4 18:01:04 2013
16x16x16x16	N4quda15TwistGamma5CudaI7double2EE	384	1	1	1	1	1	0	0	# 0.00 Gflop/s, 21.08 GB/s, tuned Fri Jan  4 18:01:04 2013
16x16x16x16	N4quda15TwistGamma5CudaI7double2EE	416	1	1	1	1	1	4097	0	# 0.00 Gflop/s, 21.08 GB/s, tuned Fri Jan  4 18:01:04 2013
16x16x16x16	N4quda15TwistGamma5CudaI7double2EE	448	1	1	1	1	1	4097	6336	# 0.00 Gflop/s, 21.08 GB/s, tuned Fri Jan  4 18:01:04 2013
16x16x16x16	N4quda15TwistGamma5CudaI7double2EE	480	1	1	1	1	1	0	0	# 0.00 Gflop/s, 21.08 GB/s, tuned Fri Jan  4 18:01:04 2013
16x16x16x16	N4quda15TwistGamma5CudaI7double2EE	512	1	1	1	1	1	0	0	# 0.00 Gflop/s, 21.08 GB/s, tuned Fri Jan  4 18:01:04 2013
16x16x16x16	N4quda16WilsonDslashCudaI6float4S1_EE	type=exterior_t,comm=0001,reconstruct=12	352	1	1	12	1	1	2049	# 1428.84 Gflop/s, 0.00 GB/s, tuned Fri Apr 12 17:15:36 2013
16x16x16x16	N4quda16WilsonDslashCudaI6float4S1_EE	type=interior,comm=0001,ghost=0001,reconstruct=12	64	1	1	512	1	1	2731	# 136.49 Gflop/s, 0.00 GB/s, tuned Fri Apr 12 17:15:36 2013
16x16x16x16	N4quda16WilsonDslashCudaI7double2S1_EE	type=exterior_t,comm=0001,reconstruct=12	64	1	1	64	1	1	2341	# 905.34 Gflop/s, 0.00 GB/s, tuned Fri Apr 12 17:15:29 2013
16x16x16x16	N4quda16WilsonDslashCudaI7double2S1_EE	type=exterior_t,comm=0001,reconstruct=12,Xpay	64	1	1	64	1	1	0	# 763.40 Gflop/s, 0.00 GB/s, tuned Fri Apr 12 17:15:29 2013
16x16x16x16	N4quda16WilsonDslashCudaI7double2S1_EE	type=interior,comm=0001,ghost=0001,reconstruct=12	64	1	1	512	1	1	4097	# 55.32 Gflop/s, 0.00 GB/s, tuned Fri Apr 12 17:15:29 2013
16x16x16x16	N4quda16WilsonDslashCudaI7double2S1_EE	type=interior,comm=0001,ghost=0001,reconstruct=12,Xpay	64	1	1	512	1	1	4097	# 50.94 Gflop/s, 0.00 GB/s, tuned Fri Apr 12 17:15:29 2013
16x16x16x16	N4quda17TwistedDslashCudaI6float4S1_EE	type=exterior_t,comm=0001,reconstruct=12	320	1	1	13	1	1	0	# 1461.96 Gflop/s, 0.00 GB/s, tuned Fri Apr 12 17:15:36 2013
16x16x16x16	N4quda17TwistedDslashCudaI6float4S1_EE	type=exterior_t,comm=0001,reconstruct=12,Xpay	160	1	1	26	1	1	3277	# 1265.26 Gflop/s, 0.00 GB/s, tuned Fri Apr 12 17:15:36 2013
16x16x16x16	N4quda17TwistedDslashCudaI6float4S1_EE	type=interior,comm=0001,ghost=0001,reconstruct=12	96	1	1	342	1	1	4097	# 144.35 Gflop/s, 0.00 GB/s, tuned Fri Apr 12 17:15:36 2013
16x16x16x16	N4quda17TwistedDslashCudaI6float4S1_EE	type=interior,comm=0001,ghost=0001,reconstruct=12,Xpay	352	1	1	94	1	1	8193	# 131.37 Gflop/s, 0.00 GB/s, tuned Fri Apr 12 17:15:36 2013
16x16x16x16	N4quda17TwistedDslashCudaI7double2S1_EE	type=exterior_t,comm=0001,reconstruct=12	64	1	1	64	1	1	2049	# 956.01 Gflop/s, 0.00 GB/s, tuned Fri Apr 12 17:15:33 2013
16x16x16x16	N4quda17TwistedDslashCudaI7double2S1_EE	type=exterior_t,comm=0001,reconstruct=12,Xpay	160	1	1	26	1	1	2341	# 811.86 Gflop/s, 0.00 GB/s, tuned Fri Apr 12 17:15:33 2013
16x16x16x16	N4quda17TwistedDslashCudaI7double2S1_EE	type=interior,comm=0001,ghost=0001,reconstruct=12	32	1	1	1024	1	1	2731	# 55.08 Gflop/s, 0.00 GB/s, tuned Fri Apr 12 17:15:33 2013
16x16x16x16	N4quda17TwistedDslashCudaI7double2S1_EE	type=interior,comm=0001,ghost=0001,reconstruct=12,Xpay	64	1	1	512	1	1	4097	# 52.02 Gflop/s, 0.00 GB/s, tuned Fri Apr 12 17:15:33 2013
16x16x16x32	N4quda15TwistGamma5CudaI6float4EE	288	1	1	1	1	1	8193	4097	# 52.02 Gflop/s, 0.00 GB/s, tuned Fri Apr 12 17:15:33 2013
16x16x16x32	N4quda15TwistGamma5CudaI6float4EE	320	1	1	1	1	1	8193	0	# 52.02 Gflop/s, 0.00 GB/s, tuned Fri Apr 12 17:15:33 2013
16x16x16x32	N4quda15TwistGamma5CudaI6float4EE	448	1	1	1	1	1	0	4097	# 52.02 Gflop/s, 0.00 GB/s, tuned Fri Apr 12 17:15:33 2013
16x16x16x32	N4quda15TwistGamma5CudaI6float4EE	512	1	1	1	1	1	0	4097	# 52.02 Gflop/s, 0.00 GB/s, tuned Fri Apr 12 17:15:33 2013
16x16x16x32	N4quda15TwistGamma5CudaI6float4EE	544	1	1	1	1	1	5462	4097	# 52.02 Gflop/s, 0.00 GB/s, tuned Fri Apr 12 17:15:33 2013
16x16x16x32	N4quda15TwistGamma5CudaI6float4EE	576	1	1	1	1	1	5462	4097	# 52.02 Gflop/s, 0.00 GB/s, tuned Fri Apr 12 17:15:33 2013
16x16x16x32	N4quda15TwistGamma5CudaI6float4EE	640	1	1	1	1	1	4097	0	# 52.02 Gflop/s, 0.00 GB/s, tuned Fri Apr 12 17:15:33 2013
16x16x16x32	N4quda15TwistGamma5CudaI7double2EE	384	1	1	1	1	1	5462	0	# 52.02 Gflop/s, 0.00 GB/s, tuned Fri Apr 12 17:15:33 2013
16x16x16x32	N4quda15TwistGamma5CudaI7double2EE	416	1	1	1	1	1	5462	4097	# 52.02 Gflop/s, 0.00 GB/s, tuned Fri Apr 12 17:15:33 2013
16x16x16x32	N4quda15TwistGamma5CudaI7double2EE	448	1	1	1	1	1	2731	4097	# 52.02 Gflop/s, 0.00 GB/s, tuned Fri Apr 12 17:15:33 2013
16x16x16x32	N4quda15TwistGamma5CudaI7double2EE	480	1	1	1	1	1	4097	0	# 52.02 Gflop/s, 0.00 GB/s, tuned Fri Apr 12 17:15:33 2013
16x16x16x32	N4quda15TwistGamma5CudaI7double2EE	512	1	1	1	1	1	4097	4097	# 52.02 Gflop/s, 0.00 GB/s, tuned Fri Apr 12 17:15:33 2013
16x16x16x32	N4quda16WilsonDslashCudaI6float4S1_EE	type=interior,comm=0000,ghost=0000,reconstruct=12	64	1	1	1024	1	1	2731	# 146.18 Gflop/s, 0.00 GB/s, tuned Fri Apr 12 17:34:37 2013
16x16x16x32	N4quda16WilsonDslashCudaI6float4S1_EE	type=interior,comm=0000,ghost=0000,reconstruct=18	64	1	1	1024	1	1	3277	# 109.20 Gflop/s, 0.00 GB/s, tuned Wed Jan 28 22:10:00 2015
16x16x16x32	N4quda16WilsonDslashCudaI6float4S1_EE	type=interior,comm=0000,ghost=0000,reconstruct=8	192	1	1	342	1	1	2341	# 167.82 Gflop/s, 0.00 GB/s, tuned Wed Jan 28 22:23:23 2015
16x16x16x32	N4quda16WilsonDslashCudaI7double2S1_EE	type=interior,comm=0000,ghost=0000,reconstruct=12	64	1	1	1024	1	1	4097	# 58.03 Gflop/s, 0.00 GB/s, tuned Fri Apr 12 17:34:25 2013
16x16x16x32	N4quda16WilsonDslashCudaI7double2S1_EE	type=interior,comm=0000,ghost=0000,reconstruct=12,Xpay	64	1	1	1024	1	1	4097	# 51.44 Gflop/s, 0.00 GB/s, tuned Fri Apr 12 17:34:25 2013
16x16x16x32	N4quda16WilsonDslashCudaI7double2S1_EE	type=interior,comm=0000,ghost=0000,reconstruct=18	32	1	1	2048	1	1	2049	# 45.40 Gflop/s, 0.00 GB/s, tuned Wed Jan 28 22:09:58 2015
16x16x16x32	N4quda16WilsonDslashCudaI7double2S1_EE	type=interior,comm=0000,ghost=0000,reconstruct=18,Xpay	32	1	1	2048	1	1	2341	# 43.69 Gflop/s, 0.00 GB/s, tuned Wed Jan 28 22:09:58 2015
16x16x16x32	N4quda16WilsonDslashCudaI7double2S1_EE	type=interior,comm=0000,ghost=0000,reconstruct=8	32	1	1	2048	1	1	2049	# 34.22 Gflop/s, 0.00 GB/s, tuned Wed Jan 28 22:23:21 2015
16x16x16x32	N4quda16WilsonDslashCudaI7double2S1_EE	type=interior,comm=0000,ghost=0000,reconstruct=8,Xpay	32	1	1	2048	1	1	2049	# 31.15 Gflop/s, 0.00 GB/s, tuned Wed Jan 28 22:23:21 2015
16x16x16x32	N4quda17TwistedDslashCudaI6float4S1_EE	type=interior,comm=0000,ghost=0000,reconstruct=12	96	1	1	683	1	1	4097	# 154.08 Gflop/s, 0.00 GB/s, tuned Fri Apr 12 17:34:37 2013
16x16x16x32	N4quda17TwistedDslashCudaI6float4S1_EE	type=interior,comm=0000,ghost=0000,reconstruct=12,Xpay	64	1	1	1024	1	1	3277	# 138.26 Gflop/s, 0.00 GB/s, tuned Fri Apr 12 17:34:37 2013
16x16x16x32	N4quda17TwistedDslashCudaI6float4S1_EE	type=interior,comm=0000,ghost=0000,reconstruct=18	64	1	1	1024	1	1	3277	# 110.87 Gflop/s, 0.00 GB/s, tuned Wed Jan 28 22:09:59 2015
16x16x16x32	N4quda17TwistedDslashCudaI6float4S1_EE	type=interior,comm=0000,ghost=0000,reconstruct=18,Xpay	64	1	1	1024	1	1	3277	# 103.35 Gflop/s, 0.00 GB/s, tuned Wed Jan 28 22:09:59 2015
16x16x16x32	N4quda17TwistedDslashCudaI6float4S1_EE	type=interior,comm=0000,ghost=0000,reconstruct=8	64	1	1	1024	1	1	2731	# 171.10 Gflop/s, 0.00 GB/s, tuned Wed Jan 28 22:23:22 2015
16x16x16x32	N4quda17TwistedDslashCudaI6float4S1_EE	type=interior,comm=0000,ghost=0000,reconstruct=8,Xpay	64	1	1	1024	1	1	2731	# 154.89 Gflop/s, 0.00 GB/s, tuned Wed Jan 28 22:23:23 2015
16x16x16x32	N4quda17TwistedDslashCudaI7double2S1_EE	type=interior,comm=0000,ghost=0000,reconstruct=12	64	1	1	1024	1	1	4097	# 56.86 Gflop/s, 0.00 GB/s, tuned Fri Apr 12 17:34:31 2013
16x16x16x32	N4quda17TwistedDslashCudaI7double2S1_EE	type=interior,comm=0000,ghost=0000,reconstruct=12,Xpay	64	1	1	1024	1	1	4097	# 52.82 Gflop/s, 0.00 GB/s, tuned Fri Apr 12 17:34:31 2013
16x16x16x32	N4quda17TwistedDslashCudaI7double2S1_EE	type=interior,comm=0000,ghost=0000,reconstruct=18	32	1	1	2048	1	1	2341	# 47.32 Gflop/s, 0.00 GB/s, tuned Wed Jan 28 22:09:59 2015
16x16x16x32	N4quda17TwistedDslashCudaI7double2S1_EE	type=interior,comm=0000,ghost=0000,reconstruct=18,Xpay	32	1	1	2048	1	1	2341	# 43.75 Gflop/s, 0.00 GB/s, tuned Wed Jan 28 22:09:59 2015
16x16x16x32	N4quda17TwistedDslashCudaI7double2S1_EE	type=interior,comm=0000,ghost=0000,reconstruct=8	96	1	1	683	1	1	4097	# 33.07 Gflop/s, 0.00 GB/s, tuned Wed Jan 28 22:23:22 2015
16x16x16x32	N4quda17TwistedDslashCudaI7double2S1_EE	type=interior,comm=0000,ghost=0000,reconstruct=8,Xpay	32	1	1	2048	1	1	2049	# 32.77 Gflop/s, 0.00 GB/s, tuned Wed Jan 28 22:23:22 2015
16x16x16x8	N4quda15TwistGamma5CudaI6float4EE	608	1	1	1	1	1	3277	0	# 52.82 Gflop/s, 0.00 GB/s, tuned Fri Apr 12 17:34:31 2013
16x16x16x8	N4quda15TwistGamma5CudaI6float4EE	64	1	1	1	1	1	2731	0	# 52.82 Gflop/s, 0.00 GB/s, tuned Fri Apr 12 17:34:31 2013
16x16x16x8	N4quda15TwistGamma5CudaI7double2EE	288	1	1	1	1	1	3277	0	# 52.82 Gflop/s, 0.00 GB/s, tuned Fri Apr 12 17:34:31 2013
16x16x16x8	N4quda15TwistGamma5CudaI7double2EE	416	1	1	1	1	1	0	0	# 52.82 Gflop/s, 0.00 GB/s, tuned Fri Apr 12 17:34:31 2013
16x16x16x8	N4quda16WilsonDslashCudaI6float4S1_EE	type=exterior_t,comm=0001,reconstruct=12	64	1	1	64	1	1	2731	# 763.66 Gflop/s, 0.00 GB/s, tuned Wed Aug  6 17:34:21 2014
16x16x16x8	N4quda16WilsonDslashCudaI6float4S1_EE	type=interior,comm=0001,ghost=0001,reconstruct=12	160	1	1	103	1	1	5462	# 127.98 Gflop/s, 0.00 GB/s, tuned Wed Aug  6 17:34:21 2014
16x16x16x8	N4quda16WilsonDslashCudaI7double2S1_EE	type=exterior_t,comm=0001,reconstruct=12	64	1	1	64	1	1	2731	# 473.28 Gflop/s, 0.00 GB/s, tuned Wed Aug  6 17:34:16 2014
16x16x16x8	N4quda16WilsonDslashCudaI7double2S1_EE	type=exterior_t,comm=0001,reconstruct=12,Xpay	64	1	1	64	1	1	2731	# 393.49 Gflop/s, 0.00 GB/s, tuned Wed Aug  6 17:34:16 2014
16x16x16x8	N4quda16WilsonDslashCudaI7double2S1_EE	type=interior,comm=0001,ghost=0001,reconstruct=12	32	1	1	512	1	1	2341	# 50.51 Gflop/s, 0.00 GB/s, tuned Wed Aug  6 17:34:16 2014
16x16x16x8	N4quda16WilsonDslashCudaI7double2S1_EE	type=interior,comm=0001,ghost=0001,reconstruct=12,Xpay	64	1	1	256	1	1	4097	# 48.26 Gflop/s, 0.00 GB/s, tuned Wed Aug  6 17:34:16 2014
16x16x16x8	N4quda17TwistedDslashCudaI6float4S1_EE	type=exterior_t,comm=0001,reconstruct=12	160	1	1	26	1	1	5462	# 782.33 Gflop/s, 0.00 GB/s, tuned Wed Aug  6 17:34:20 2014
16x16x16x8	N4quda17TwistedDslashCudaI6float4S1_EE	type=exterior_t,comm=0001,reconstruct=12,Xpay	64	1	1	64	1	1	2341	# 700.48 Gflop/s, 0.00 GB/s, tuned Wed Aug  6 17:34:20 2014
16x16x16x8	N4quda17TwistedDslashCudaI6float4S1_EE	type=interior,comm=0001,ghost=0001,reconstruct=12	320	1	1	52	1	1	2731	# 133.77 Gflop/s, 0.00 GB/s, tuned Wed Aug  6 17:34:20 2014
16x16x16x8	N4quda17TwistedDslashCudaI6float4S1_EE	type=interior,comm=0001,ghost=0001,reconstruct=12,Xpay	64	1	1	256	1	1	2731	# 126.09 Gflop/s, 0.00 GB/s, tuned Wed Aug  6 17:34:20 2014
16x16x16x8	N4quda17TwistedDslashCudaI7double2S1_EE	type=exterior_t,comm=0001,reconstruct=12	160	1	1	26	1	1	2049	# 503.32 Gflop/s, 0.00 GB/s, tuned Wed Aug  6 17:34:18 2014
16x16x16x8	N4quda17TwistedDslashCudaI7double2S1_EE	type=exterior_t,comm=0001,reconstruct=12,Xpay	64	1	1	64	1	1	2341	# 428.48 Gflop/s, 0.00 GB/s, tuned Wed Aug  6 17:34:19 2014
16x16x16x8	N4quda17TwistedDslashCudaI7double2S1_EE	type=interior,comm=0001,ghost=0001,reconstruct=12	64	1	1	256	1	1	4097	# 50.98 Gflop/s, 0.00 GB/s, tuned Wed Aug  6 17:34:18 2014
16x16x16x8	N4quda17TwistedDslashCudaI7double2S1_EE	type=interior,comm=0001,ghost=0001,reconstruct=12,Xpay	64	1	1	256	1	1	4097	# 49.07 Gflop/s, 0.00 GB/s, tuned Wed Aug  6 17:34:19 2014
16x16x8x16	N4quda15TwistGamma5CudaI6float4EE	608	1	1	1	1	1	2731	0	# 49.07 Gflop/s, 0.00 GB/s, tuned Wed Aug  6 17:34:19 2014
16x16x8x16	N4quda15TwistGamma5CudaI6float4EE	640	1	1	1	1	1	5462	0	# 49.07 Gflop/s, 0.00 GB/s, tuned Wed Aug  6 17:34:19 2014
16x16x8x16	N4quda15TwistGamma5CudaI7double2EE	192	1	1	1	1	1	3277	0	# 49.07 Gflop/s, 0.00 GB/s, tuned Wed Aug  6 17:34:19 2014
16x16x8x16	N4quda15TwistGamma5CudaI7double2EE	416	1	1	1	1	1	8193	0	# 49.07 Gflop/s, 0.00 GB/s, tuned Wed Aug  6 17:34:19 2014
16x16x8x16	N4quda16WilsonDslashCudaI6float4S1_EE	type=exterior_t,comm=0011,reconstruct=12	160	1	1	13	1	1	5462	# 924.54 Gflop/s, 0.00 GB/s, tuned Sun Jun 28 20:35:37 2015
16x16x8x16	N4quda16WilsonDslashCudaI6float4S1_EE	type=exterior_z,comm=0011,reconstruct=12	64	1	1	64	1	1	2341	# 824.20 Gflop/s, 0.00 GB/s, tuned Sun Jun 28 20:35:37 2015
16x16x8x16	N4quda16WilsonDslashCudaI6float4S1_EE	type=interior,comm=0011,ghost=0011,reconstruct=12	64	1	1	256	1	1	2731	# 130.90 Gflop/s, 0.00 GB/s, tuned Sun Jun 28 20:35:37 2015
16x16x8x16	N4quda16WilsonDslashCudaI7double2S1_EE	type=exterior_t,comm=0011,reconstruct=12	160	1	1	13	1	1	8193	# 723.60 Gflop/s, 0.00 GB/s, tuned Sun Jun 28 20:35:33 2015
16x16x8x16	N4quda16WilsonDslashCudaI7double2S1_EE	type=exterior_t,comm=0011,reconstruct=12,Xpay	96	1	1	22	1	1	4097	# 594.08 Gflop/s, 0.00 GB/s, tuned Sun Jun 28 20:35:32 2015
16x16x8x16	N4quda16WilsonDslashCudaI7double2S1_EE	type=exterior_z,comm=0011,reconstruct=12	32	1	1	128	1	1	2731	# 466.74 Gflop/s, 0.00 GB/s, tuned Sun Jun 28 20:35:33 2015
16x16x8x16	N4quda16WilsonDslashCudaI7double2S1_EE	type=exterior_z,comm=0011,reconstruct=12,Xpay	160	1	1	26	1	1	2049	# 393.71 Gflop/s, 0.00 GB/s, tuned Sun Jun 28 20:35:32 2015
16x16x8x16	N4quda16WilsonDslashCudaI7double2S1_EE	type=interior,comm=0011,ghost=0011,reconstruct=12	64	1	1	256	1	1	4097	# 54.14 Gflop/s, 0.00 GB/s, tuned Sun Jun 28 20:35:33 2015
16x16x8x16	N4quda16WilsonDslashCudaI7double2S1_EE	type=interior,comm=0011,ghost=0011,reconstruct=12,Xpay	32	1	1	512	1	1	2341	# 52.16 Gflop/s, 0.00 GB/s, tuned Sun Jun 28 20:35:32 2015
16x16x8x16	N4quda17TwistedDslashCudaI6float4S1_EE	type=exterior_t,comm=0011,reconstruct=12	160	1	1	13	1	1	8193	# 934.08 Gflop/s, 0.00 GB/s, tuned Sun Jun 28 20:35:36 2015
16x16x8x16	N4quda17TwistedDslashCudaI6float4S1_EE	type=exterior_t,comm=0011,reconstruct=12,Xpay	160	1	1	13	1	1	4097	# 914.24 Gflop/s, 0.00 GB/s, tuned Sun Jun 28 20:35:37 2015
16x16x8x16	N4quda17TwistedDslashCudaI6float4S1_EE	type=exterior_z,comm=0011,reconstruct=12	352	1	1	12	1	1	2341	# 836.51 Gflop/s, 0.00 GB/s, tuned Sun Jun 28 20:35:37 2015
16x16x8x16	N4quda17TwistedDslashCudaI6float4S1_EE	type=exterior_z,comm=0011,reconstruct=12,Xpay	64	1	1	64	1	1	0	# 723.54 Gflop/s, 0.00 GB/s, tuned Sun Jun 28 20:35:37 2015
16x16x8x16	N4quda17TwistedDslashCudaI6float4S1_EE	type=interior,comm=0011,ghost=0011,reconstruct=12	64	1	1	256	1	1	2731	# 137.64 Gflop/s, 0.00 GB/s, tuned Sun Jun 28 20:35:36 2015
16x16x8x16	N4quda17TwistedDslashCudaI6float4S1_EE	type=interior,comm=0011,ghost=0011,reconstruct=12,Xpay	64	1	1	256	1	1	2731	# 133.44 Gflop/s, 0.00 GB/s, tuned Sun Jun 28 20:35:37 2015
16x16x8x16	N4quda17TwistedDslashCudaI7double2S1_EE	type=exterior_t,comm=0011,reconstruct=12	160	1	1	13	1	1	5462	# 726.51 Gflop/s, 0.00 GB/s, tuned Sun Jun 28 20:35:35 2015
16x16x8x16	N4quda17TwistedDslashCudaI7double2S1_EE	type=exterior_t,comm=0011,reconstruct=12,Xpay	160	1	1	13	1	1	5462	# 590.87 Gflop/s, 0.00 GB/s, tuned Sun Jun 28 20:35:35 2015
16x16x8x16	N4quda17TwistedDslashCudaI7double2S1_EE	type=exterior_z,comm=0011,reconstruct=12	64	1	1	64	1	1	2341	# 503.32 Gflop/s, 0.00 GB/s, tuned Sun Jun 28 20:35:35 2015
16x16x8x16	N4quda17TwistedDslashCudaI7double2S1_EE	type=exterior_z,comm=0011,reconstruct=12,Xpay	160	1	1	26	1	1	2731	# 412.63 Gflop/s, 0.00 GB/s, tuned Sun Jun 28 20:35:35 2015
16x16x8x16	N4quda17TwistedDslashCudaI7double2S1_EE	type=interior,comm=0011,ghost=0011,reconstruct=12	32	1	1	512	1	1	2341	# 54.32 Gflop/s, 0.00 GB/s, tuned Sun Jun 28 20:35:35 2015
16x16x8x16	N4quda17TwistedDslashCudaI7double2S1_EE	type=interior,comm=0011,ghost=0011,reconstruct=12,Xpay	32	1	1	512	1	1	2341	# 53.29 Gflop/s, 0.00 GB/s, tuned Sun Jun 28 20:35:35 2015
16x32x32x16	N4quda11axpyCGNorm2I7double2S1_S1_EE	stride=262144,prec=8	672	1	1	12	1	1	10752	# 24.91 Gflop/s, 99.63 GB/s, tuned Fri Apr 17 15:50:28 2015
16x32x32x16	N4quda22HeavyQuarkResidualNormI7double37double2S2_EE	stride=262144,prec=8	192	1	1	28	1	1	4608	# 23.17 Gflop/s, 92.68 GB/s, tuned Fri Apr 17 15:52:37 2015
16x32x32x16	N4quda3DotId7double2S1_EE	stride=262144,prec=8	512	1	1	14	1	1	4096	# 12.06 Gflop/s, 96.45 GB/s, tuned Fri Apr 17 15:50:13 2015
16x32x32x16	N4quda3xpyI7double2S1_EE	stride=262144,prec=8	32	1	1	110	1	1	0	# 4.11 Gflop/s, 98.53 GB/s, tuned Fri Apr 17 15:51:23 2015
16x32x32x16	N4quda4axpyI7double2S1_EE	stride=262144,prec=8	832	1	1	8	1	1	0	# 8.16 Gflop/s, 97.91 GB/s, tuned Fri Apr 17 15:51:08 2015
16x32x32x16	N4quda4xpayI7double2S1_EE	stride=262144,prec=8	864	1	1	12	1	1	0	# 8.18 Gflop/s, 98.15 GB/s, tuned Fri Apr 17 15:49:39 2015
16x32x32x16	N4quda5Norm2Id7double2S1_EE	stride=262144,prec=8	288	1	1	42	1	1	2304	# 23.98 Gflop/s, 95.90 GB/s, tuned Fri Apr 17 15:49:45 2015
16x32x32x16	N4quda8axpyZpbxI7double2S1_EE	stride=262144,prec=8	256	1	1	8	1	1	0	# 19.45 Gflop/s, 97.26 GB/s, tuned Fri Apr 17 15:50:53 2015
16x32x32x16	N4quda8xmyNorm2Id7double2S1_EE	stride=262144,prec=8	704	1	1	8	1	1	5632	# 12.16 Gflop/s, 97.27 GB/s, tuned Fri Apr 17 15:50:03 2015
16x32x32x32	N4quda11axpyCGNorm2I7double26float26float4EE	stride=524288,prec=4	608	1	1	11	1	1	9728	# 48.57 Gflop/s, 97.13 GB/s, tuned Fri Jan  4 19:03:08 2013
16x32x32x32	N4quda22HeavyQuarkResidualNormI7double37double2S2_EE	stride=524288,prec=8	384	1	1	28	1	1	9216	# 23.31 Gflop/s, 93.22 GB/s, tuned Fri Jan  4 19:05:16 2013
16x32x32x32	N4quda3DotId6float26float4EE	stride=524288,prec=4	128	1	1	96	1	1	1024	# 23.70 Gflop/s, 94.78 GB/s, tuned Fri Jan  4 19:02:53 2013
16x32x32x32	N4quda3xpyI7double2S1_EE	stride=524288,prec=8	384	1	1	9	1	1	0	# 3.98 Gflop/s, 95.43 GB/s, tuned Fri Jan  4 19:04:31 2013
16x32x32x32	N4quda4axpyI6float26float4EE	stride=524288,prec=4	768	1	1	9	1	1	0	# 16.00 Gflop/s, 96.03 GB/s, tuned Fri Jan  4 19:03:48 2013
16x32x32x32	N4quda4xpayI6float26float4EE	stride=524288,prec=4	32	1	1	112	1	1	0	# 16.12 Gflop/s, 96.72 GB/s, tuned Fri Jan  4 19:02:42 2013
16x32x32x32	N4quda4xpayI7double2S1_EE	stride=524288,prec=8	384	1	1	9	1	1	0	# 7.93 Gflop/s, 95.11 GB/s, tuned Fri Jan  4 19:01:38 2013
16x32x32x32	N4quda5Norm2Id7double2S1_EE	stride=524288,prec=8	800	1	1	14	1	1	6400	# 24.24 Gflop/s, 96.97 GB/s, tuned Fri Jan  4 19:01:04 2013
16x32x32x32	N4quda8axpyZpbxI6float26float4EE	stride=524288,prec=4	128	1	1	17	1	1	0	# 38.68 Gflop/s, 96.69 GB/s, tuned Fri Jan  4 19:03:33 2013
16x32x32x32	N4quda8xmyNorm2Id7double2S1_EE	stride=524288,prec=8	32	1	1	111	1	1	512	# 12.21 Gflop/s, 97.70 GB/s, tuned Fri Jan  4 19:02:15 2013
16x32x32x32	copyKernel	stride=524288,out_prec=4,in_prec=8	384	1	1	7	1	1	0	# 0.00 Gflop/s, 91.16 GB/s, tuned Fri Jan  4 19:02:25 2013
16x32x32x32	copyKernel	stride=524288,out_prec=8,in_prec=4	160	1	1	8	1	1	0	# 0.00 Gflop/s, 89.00 GB/s, tuned Fri Jan  4 19:04:01 2013
16x32x32x4	N4quda11axpyCGNorm2I7double26float26float4EE	stride=65536,prec=4	416	1	1	12	1	1	6656	# 43.97 Gflop/s, 87.94 GB/s, tuned Fri Jan  4 19:07:20 2013
16x32x32x4	N4quda22HeavyQuarkResidualNormI7double37double2S2_EE	stride=65536,prec=8	320	1	1	191	1	1	7680	# 21.24 Gflop/s, 84.96 GB/s, tuned Fri Jan  4 19:07:43 2013
16x32x32x4	N4quda3DotId6float26float4EE	stride=65536,prec=4	64	1	1	96	1	1	512	# 20.05 Gflop/s, 80.20 GB/s, tuned Fri Jan  4 19:07:18 2013
16x32x32x4	N4quda3xpyI7double2S1_EE	stride=65536,prec=8	32	1	1	111	1	1	0	# 4.07 Gflop/s, 97.77 GB/s, tuned Fri Jan  4 19:07:31 2013
16x32x32x4	N4quda4axpyI6float26float4EE	stride=65536,prec=4	1024	1	1	248	1	1	0	# 15.93 Gflop/s, 95.56 GB/s, tuned Fri Jan  4 19:07:25 2013
16x32x32x4	N4quda4xpayI6float26float4EE	stride=65536,prec=4	1024	1	1	204	1	1	0	# 15.94 Gflop/s, 95.61 GB/s, tuned Fri Jan  4 19:07:16 2013
16x32x32x4	N4quda4xpayI7double2S1_EE	stride=65536,prec=8	800	1	1	11	1	1	0	# 8.24 Gflop/s, 98.92 GB/s, tuned Fri Jan  4 19:07:08 2013
16x32x32x4	N4quda5Norm2Id7double2S1_EE	stride=65536,prec=8	192	1	1	98	1	1	1536	# 20.66 Gflop/s, 82.64 GB/s, tuned Fri Jan  4 19:07:03 2013
16x32x32x4	N4quda8axpyZpbxI6float26float4EE	stride=65536,prec=4	384	1	1	8	1	1	0	# 38.23 Gflop/s, 95.57 GB/s, tuned Fri Jan  4 19:07:23 2013
16x32x32x4	N4quda8xmyNorm2Id7double2S1_EE	stride=65536,prec=8	704	1	1	10	1	1	5632	# 11.84 Gflop/s, 94.73 GB/s, tuned Fri Jan  4 19:07:13 2013
16x32x32x4	copyKernel	stride=65536,out_prec=4,in_prec=8	512	1	1	243	1	1	0	# 0.00 Gflop/s, 90.37 GB/s, tuned Fri Jan  4 19:07:14 2013
16x32x32x4	copyKernel	stride=65536,out_prec=8,in_prec=4	512	1	1	160	1	1	0	# 0.00 Gflop/s, 87.85 GB/s, tuned Fri Jan  4 19:07:27 2013
16x32x32x64	N4quda11axpyCGNorm2I7double26float26float4EE	stride=1048576,prec=4	768	1	1	8	1	1	12288	# 48.15 Gflop/s, 96.30 GB/s, tuned Fri Jan  4 17:43:17 2013
16x32x32x64	N4quda22HeavyQuarkResidualNormI7double37double2S2_EE	stride=1048576,prec=8	384	1	1	96	1	1	9216	# 23.42 Gflop/s, 93.68 GB/s, tuned Fri Jan  4 17:47:32 2013
16x32x32x64	N4quda3DotId6float26float4EE	stride=1048576,prec=4	64	1	1	98	1	1	512	# 24.20 Gflop/s, 96.81 GB/s, tuned Fri Jan  4 17:42:48 2013
16x32x32x64	N4quda3xpyI7double2S1_EE	stride=1048576,prec=8	864	1	1	8	1	1	0	# 4.02 Gflop/s, 96.44 GB/s, tuned Fri Jan  4 17:46:03 2013
16x32x32x64	N4quda4axpyI6float26float4EE	stride=1048576,prec=4	32	1	1	110	1	1	0	# 16.08 Gflop/s, 96.50 GB/s, tuned Fri Jan  4 17:44:37 2013
16x32x32x64	N4quda4xpayI6float26float4EE	stride=1048576,prec=4	32	1	1	111	1	1	0	# 16.29 Gflop/s, 97.73 GB/s, tuned Fri Jan  4 17:42:27 2013
16x32x32x64	N4quda4xpayI7double2S1_EE	stride=1048576,prec=8	32	1	1	110	1	1	0	# 7.94 Gflop/s, 95.29 GB/s, tuned Fri Jan  4 17:40:20 2013
16x32x32x64	N4quda5Norm2Id7double2S1_EE	stride=1048576,prec=8	448	1	1	28	1	1	3584	# 24.61 Gflop/s, 98.44 GB/s, tuned Fri Jan  4 17:39:13 2013
16x32x32x64	N4quda8axpyZpbxI6float26float4EE	stride=1048576,prec=4	192	1	1	16	1	1	0	# 38.02 Gflop/s, 95.06 GB/s, tuned Fri Jan  4 17:44:07 2013
16x32x32x64	N4quda8xmyNorm2Id7double2S1_EE	stride=1048576,prec=8	704	1	1	12	1	1	5632	# 11.93 Gflop/s, 95.44 GB/s, tuned Fri Jan  4 17:41:34 2013
16x32x32x64	copyKernel	stride=1048576,out_prec=4,in_prec=8	512	1	1	8	1	1	0	# 0.00 Gflop/s, 92.33 GB/s, tuned Fri Jan  4 17:41:53 2013
16x32x32x64	copyKernel	stride=1048576,out_prec=8,in_prec=4	64	1	1	17	1	1	0	# 0.00 Gflop/s, 88.05 GB/s, tuned Fri Jan  4 17:45:03 2013
16x32x32x8	N4quda11axpyCGNorm2I7double26float26float4EE	stride=131072,prec=4	544	1	1	11	1	1	8704	# 47.67 Gflop/s, 95.34 GB/s, tuned Sat Feb 23 13:03:05 2013
16x32x32x8	N4quda11axpyCGNorm2I7double2S1_S1_EE	stride=131072,prec=8	512	1	1	12	1	1	8192	# 24.56 Gflop/s, 98.25 GB/s, tuned Wed May  1 10:22:05 2013
16x32x32x8	N4quda22HeavyQuarkResidualNormI7double37double2S2_EE	stride=131072,prec=8	32	1	1	112	1	1	1536	# 22.35 Gflop/s, 89.38 GB/s, tuned Sat Feb 23 13:03:54 2013
16x32x32x8	N4quda3DotId6float26float4EE	stride=131072,prec=4	64	1	1	112	1	1	512	# 22.30 Gflop/s, 89.21 GB/s, tuned Sat Feb 23 13:03:01 2013
16x32x32x8	N4quda3DotId7double2S1_EE	stride=131072,prec=8	512	1	1	14	1	1	4096	# 11.77 Gflop/s, 94.16 GB/s, tuned Wed May  1 10:21:57 2013
16x32x32x8	N4quda3xpyI7double2S1_EE	stride=131072,prec=8	32	1	1	112	1	1	0	# 4.14 Gflop/s, 99.39 GB/s, tuned Sat Feb 23 13:03:27 2013
16x32x32x8	N4quda4axpyI6float26float4EE	stride=131072,prec=4	672	1	1	9	1	1	0	# 16.10 Gflop/s, 96.62 GB/s, tuned Sat Feb 23 13:03:16 2013
16x32x32x8	N4quda4axpyI7double2S1_EE	stride=131072,prec=8	608	1	1	9	1	1	0	# 8.27 Gflop/s, 99.18 GB/s, tuned Wed May  1 10:22:25 2013
16x32x32x8	N4quda4xpayI6float26float4EE	stride=131072,prec=4	896	1	1	11	1	1	0	# 16.33 Gflop/s, 97.97 GB/s, tuned Sat Feb 23 13:02:59 2013
16x32x32x8	N4quda4xpayI7double2S1_EE	stride=131072,prec=8	32	1	1	111	1	1	0	# 8.20 Gflop/s, 98.44 GB/s, tuned Sat Feb 23 13:02:39 2013
16x32x32x8	N4quda5Norm2Id7double2S1_EE	stride=131072,prec=8	544	1	1	28	1	1	4352	# 22.58 Gflop/s, 90.32 GB/s, tuned Sat Feb 23 13:02:42 2013
16x32x32x8	N4quda8axpyZpbxI6float26float4EE	stride=131072,prec=4	384	1	1	8	1	1	0	# 38.83 Gflop/s, 97.09 GB/s, tuned Sat Feb 23 13:03:12 2013
16x32x32x8	N4quda8axpyZpbxI7double2S1_EE	stride=131072,prec=8	352	1	1	8	1	1	0	# 19.57 Gflop/s, 97.86 GB/s, tuned Wed May  1 10:22:18 2013
16x32x32x8	N4quda8xmyNorm2Id7double2S1_EE	stride=131072,prec=8	864	1	1	10	1	1	6912	# 12.09 Gflop/s, 96.74 GB/s, tuned Sat Feb 23 13:02:52 2013
16x32x32x8	copyKernel	stride=131072,out_prec=4,in_prec=8	512	1	1	221	1	1	0	# 0.00 Gflop/s, 90.92 GB/s, tuned Sat Feb 23 13:02:54 2013
16x32x32x8	copyKernel	stride=131072,out_prec=8,in_prec=4	736	1	1	187	1	1	0	# 0.00 Gflop/s, 88.92 GB/s, tuned Sat Feb 23 13:03:19 2013
20736	N4quda10PackSpinorIddLi4ELi3ENS_11FloatNOrderIdLi4ELi3ELi2EEENS_21SpaceSpinorColorOrderIdLi4ELi3EEENS_13PreserveBasisIddLi4ELi3EEEEE	out_stride=20736,in_stride=20736	64	1	1	324	1	1	12480	# 0.00 Gflop/s, 41.06 GB/s, tuned Fri Jan  4 18:15:00 2013
20736	N4quda10PackSpinorIddLi4ELi3ENS_21SpaceSpinorColorOrderIdLi4ELi3EEENS_11FloatNOrderIdLi4ELi3ELi2EEENS_13PreserveBasisIddLi4ELi3EEEEE	out_stride=20736,in_stride=20736	64	1	1	324	1	1	12480	# 0.00 Gflop/s, 19.69 GB/s, tuned Fri Jan  4 18:15:14 2013
24x12x12x12	N4quda15TwistGamma5CudaI6float4EE	512	1	1	1	1	1	0	12480	# 0.00 Gflop/s, 19.69 GB/s, tuned Fri Jan  4 18:15:14 2013
24x12x12x12	N4quda15TwistGamma5CudaI7double2EE	512	1	1	1	1	1	8193	12480	# 0.00 Gflop/s, 19.69 GB/s, tuned Fri Jan  4 18:15:14 2013
24x12x12x12	N4quda16WilsonDslashCudaI6float4S1_EE	type=exterior_t,comm=0111,reconstruct=8	64	1	1	54	1	1	0	# 980.92 Gflop/s, 0.00 GB/s, tuned Wed Feb  6 16:27:11 2013
24x12x12x12	N4quda16WilsonDslashCudaI6float4S1_EE	type=exterior_y,comm=0111,reconstruct=8	128	1	1	27	1	1	4097	# 926.72 Gflop/s, 0.00 GB/s, tuned Wed Feb  6 16:27:11 2013
24x12x12x12	N4quda16WilsonDslashCudaI6float4S1_EE	type=exterior_z,comm=0111,reconstruct=8	96	1	1	36	1	1	4097	# 956.78 Gflop/s, 0.00 GB/s, tuned Wed Feb  6 16:27:11 2013
24x12x12x12	N4quda16WilsonDslashCudaI6float4S1_EE	type=interior,comm=0111,ghost=0111,reconstruct=8	128	1	1	162	1	1	4097	# 152.61 Gflop/s, 0.00 GB/s, tuned Wed Feb  6 16:27:11 2013
24x12x12x12	N4quda16WilsonDslashCudaI7double2S1_EE	type=exterior_t,comm=0111,reconstruct=8	256	1	1	14	1	1	8193	# 566.84 Gflop/s, 0.00 GB/s, tuned Wed Feb  6 16:27:05 2013
24x12x12x12	N4quda16WilsonDslashCudaI7double2S1_EE	type=exterior_t,comm=0111,reconstruct=8,Xpay	256	1	1	14	1	1	8193	# 491.93 Gflop/s, 0.00 GB/s, tuned Wed Feb  6 16:27:05 2013
24x12x12x12	N4quda16WilsonDslashCudaI7double2S1_EE	type=exterior_y,comm=0111,reconstruct=8	96	1	1	36	1	1	2731	# 494.14 Gflop/s, 0.00 GB/s, tuned Wed Feb  6 16:27:05 2013
24x12x12x12	N4quda16WilsonDslashCudaI7double2S1_EE	type=exterior_y,comm=0111,reconstruct=8,Xpay	96	1	1	36	1	1	2731	# 423.94 Gflop/s, 0.00 GB/s, tuned Wed Feb  6 16:27:05 2013
24x12x12x12	N4quda16WilsonDslashCudaI7double2S1_EE	type=exterior_z,comm=0111,reconstruct=8	128	1	1	27	1	1	5462	# 556.15 Gflop/s, 0.00 GB/s, tuned Wed Feb  6 16:27:05 2013
24x12x12x12	N4quda16WilsonDslashCudaI7double2S1_EE	type=exterior_z,comm=0111,reconstruct=8,Xpay	128	1	1	27	1	1	5462	# 492.21 Gflop/s, 0.00 GB/s, tuned Wed Feb  6 16:27:05 2013
24x12x12x12	N4quda16WilsonDslashCudaI7double2S1_EE	type=interior,comm=0111,ghost=0111,reconstruct=8	32	1	1	648	1	1	2341	# 37.94 Gflop/s, 0.00 GB/s, tuned Wed Feb  6 16:27:05 2013
24x12x12x12	N4quda16WilsonDslashCudaI7double2S1_EE	type=interior,comm=0111,ghost=0111,reconstruct=8,Xpay	32	1	1	648	1	1	2341	# 36.77 Gflop/s, 0.00 GB/s, tuned Wed Feb  6 16:27:05 2013
24x12x12x12	N4quda17TwistedDslashCudaI6float4S1_EE	type=exterior_t,comm=0111,reconstruct=8	288	1	1	12	1	1	3277	# 955.53 Gflop/s, 0.00 GB/s, tuned Wed Feb  6 16:27:11 2013
24x12x12x12	N4quda17TwistedDslashCudaI6float4S1_EE	type=exterior_t,comm=0111,reconstruct=8,Xpay	96	1	1	36	1	1	4097	# 879.74 Gflop/s, 0.00 GB/s, tuned Wed Feb  6 16:27:11 2013
24x12x12x12	N4quda17TwistedDslashCudaI6float4S1_EE	type=exterior_y,comm=0111,reconstruct=8	256	1	1	14	1	1	8193	# 937.65 Gflop/s, 0.00 GB/s, tuned Wed Feb  6 16:27:11 2013
24x12x12x12	N4quda17TwistedDslashCudaI6float4S1_EE	type=exterior_y,comm=0111,reconstruct=8,Xpay	64	1	1	54	1	1	2341	# 770.42 Gflop/s, 0.00 GB/s, tuned Wed Feb  6 16:27:11 2013
24x12x12x12	N4quda17TwistedDslashCudaI6float4S1_EE	type=exterior_z,comm=0111,reconstruct=8	64	1	1	54	1	1	3277	# 978.33 Gflop/s, 0.00 GB/s, tuned Wed Feb  6 16:27:11 2013
24x12x12x12	N4quda17TwistedDslashCudaI6float4S1_EE	type=exterior_z,comm=0111,reconstruct=8,Xpay	96	1	1	36	1	1	3277	# 896.94 Gflop/s, 0.00 GB/s, tuned Wed Feb  6 16:27:11 2013
24x12x12x12	N4quda17TwistedDslashCudaI6float4S1_EE	type=interior,comm=0111,ghost=0111,reconstruct=8	128	1	1	162	1	1	4097	# 157.83 Gflop/s, 0.00 GB/s, tuned Wed Feb  6 16:27:11 2013
24x12x12x12	N4quda17TwistedDslashCudaI6float4S1_EE	type=interior,comm=0111,ghost=0111,reconstruct=8,Xpay	64	1	1	324	1	1	2341	# 147.97 Gflop/s, 0.00 GB/s, tuned Wed Feb  6 16:27:11 2013
24x12x12x12	N4quda17TwistedDslashCudaI7double2S1_EE	type=exterior_t,comm=0111,reconstruct=8	96	1	1	36	1	1	3277	# 564.47 Gflop/s, 0.00 GB/s, tuned Wed Feb  6 16:27:08 2013
24x12x12x12	N4quda17TwistedDslashCudaI7double2S1_EE	type=exterior_t,comm=0111,reconstruct=8,Xpay	128	1	1	27	1	1	4097	# 509.48 Gflop/s, 0.00 GB/s, tuned Wed Feb  6 16:27:08 2013
24x12x12x12	N4quda17TwistedDslashCudaI7double2S1_EE	type=exterior_y,comm=0111,reconstruct=8	96	1	1	36	1	1	3277	# 511.64 Gflop/s, 0.00 GB/s, tuned Wed Feb  6 16:27:08 2013
24x12x12x12	N4quda17TwistedDslashCudaI7double2S1_EE	type=exterior_y,comm=0111,reconstruct=8,Xpay	128	1	1	27	1	1	4097	# 433.43 Gflop/s, 0.00 GB/s, tuned Wed Feb  6 16:27:08 2013
24x12x12x12	N4quda17TwistedDslashCudaI7double2S1_EE	type=exterior_z,comm=0111,reconstruct=8	64	1	1	54	1	1	3277	# 580.07 Gflop/s, 0.00 GB/s, tuned Wed Feb  6 16:27:08 2013
24x12x12x12	N4quda17TwistedDslashCudaI7double2S1_EE	type=exterior_z,comm=0111,reconstruct=8,Xpay	96	1	1	36	1	1	2049	# 500.31 Gflop/s, 0.00 GB/s, tuned Wed Feb  6 16:27:08 2013
24x12x12x12	N4quda17TwistedDslashCudaI7double2S1_EE	type=interior,comm=0111,ghost=0111,reconstruct=8	32	1	1	648	1	1	2341	# 38.42 Gflop/s, 0.00 GB/s, tuned Wed Feb  6 16:27:08 2013
24x12x12x12	N4quda17TwistedDslashCudaI7double2S1_EE	type=interior,comm=0111,ghost=0111,reconstruct=8,Xpay	32	1	1	648	1	1	2341	# 37.93 Gflop/s, 0.00 GB/s, tuned Wed Feb  6 16:27:08 2013
24x12x12x48	N4quda15TwistGamma5CudaI6float4EE	288	1	1	1	1	1	2731	2341	# 37.93 Gflop/s, 0.00 GB/s, tuned Wed Feb  6 16:27:08 2013
24x12x12x48	N4quda15TwistGamma5CudaI7double2EE	384	1	1	1	1	1	2049	2341	# 37.93 Gflop/s, 0.00 GB/s, tuned Wed Feb  6 16:27:08 2013
24x12x12x48	N4quda16WilsonDslashCudaI6float4S1_EE	type=exterior_y,comm=0110,reconstruct=8	512	1	1	27	1	1	2341	# 1159.81 Gflop/s, 0.00 GB/s, tuned Fri Feb 22 15:46:34 2013
24x12x12x48	N4quda16WilsonDslashCudaI6float4S1_EE	type=exterior_z,comm=0110,reconstruct=8	480	1	1	29	1	1	2731	# 1349.68 Gflop/s, 0.00 GB/s, tuned Fri Feb 22 15:46:34 2013
24x12x12x48	N4quda16WilsonDslashCudaI6float4S1_EE	type=interior,comm=0110,ghost=0110,reconstruct=8	128	1	1	648	1	1	4097	# 165.85 Gflop/s, 0.00 GB/s, tuned Fri Feb 22 15:46:34 2013
24x12x12x48	N4quda16WilsonDslashCudaI7double2S1_EE	type=exterior_y,comm=0110,reconstruct=8	192	1	1	72	1	1	8193	# 612.72 Gflop/s, 0.00 GB/s, tuned Fri Feb 22 15:46:17 2013
24x12x12x48	N4quda16WilsonDslashCudaI7double2S1_EE	type=exterior_y,comm=0110,reconstruct=8,Xpay	256	1	1	54	1	1	8193	# 485.93 Gflop/s, 0.00 GB/s, tuned Fri Feb 22 15:46:16 2013
24x12x12x48	N4quda16WilsonDslashCudaI7double2S1_EE	type=exterior_z,comm=0110,reconstruct=8	96	1	1	144	1	1	5462	# 753.95 Gflop/s, 0.00 GB/s, tuned Fri Feb 22 15:46:16 2013
24x12x12x48	N4quda16WilsonDslashCudaI7double2S1_EE	type=exterior_z,comm=0110,reconstruct=8,Xpay	64	1	1	216	1	1	4097	# 549.75 Gflop/s, 0.00 GB/s, tuned Fri Feb 22 15:46:16 2013
24x12x12x48	N4quda16WilsonDslashCudaI7double2S1_EE	type=interior,comm=0110,ghost=0110,reconstruct=8	32	1	1	2592	1	1	2049	# 37.85 Gflop/s, 0.00 GB/s, tuned Fri Feb 22 15:46:16 2013
24x12x12x48	N4quda16WilsonDslashCudaI7double2S1_EE	type=interior,comm=0110,ghost=0110,reconstruct=8,Xpay	32	1	1	2592	1	1	2341	# 36.07 Gflop/s, 0.00 GB/s, tuned Fri Feb 22 15:46:16 2013
24x12x12x48	N4quda17TwistedDslashCudaI6float4S1_EE	type=exterior_y,comm=0110,reconstruct=8	96	1	1	144	1	1	5462	# 1186.86 Gflop/s, 0.00 GB/s, tuned Fri Feb 22 15:46:34 2013
24x12x12x48	N4quda17TwistedDslashCudaI6float4S1_EE	type=exterior_y,comm=0110,reconstruct=8,Xpay	512	1	1	27	1	1	8193	# 1015.29 Gflop/s, 0.00 GB/s, tuned Fri Feb 22 15:46:34 2013
24x12x12x48	N4quda17TwistedDslashCudaI6float4S1_EE	type=exterior_z,comm=0110,reconstruct=8	64	1	1	216	1	1	2341	# 1466.69 Gflop/s, 0.00 GB/s, tuned Fri Feb 22 15:46:33 2013
24x12x12x48	N4quda17TwistedDslashCudaI6float4S1_EE	type=exterior_z,comm=0110,reconstruct=8,Xpay	128	1	1	108	1	1	2341	# 1109.51 Gflop/s, 0.00 GB/s, tuned Fri Feb 22 15:46:34 2013
24x12x12x48	N4quda17TwistedDslashCudaI6float4S1_EE	type=interior,comm=0110,ghost=0110,reconstruct=8	192	1	1	432	1	1	2731	# 171.79 Gflop/s, 0.00 GB/s, tuned Fri Feb 22 15:46:33 2013
24x12x12x48	N4quda17TwistedDslashCudaI6float4S1_EE	type=interior,comm=0110,ghost=0110,reconstruct=8,Xpay	64	1	1	1296	1	1	2731	# 164.00 Gflop/s, 0.00 GB/s, tuned Fri Feb 22 15:46:34 2013
24x12x12x48	N4quda17TwistedDslashCudaI7double2S1_EE	type=exterior_y,comm=0110,reconstruct=8	32	1	1	432	1	1	2341	# 562.70 Gflop/s, 0.00 GB/s, tuned Fri Feb 22 15:46:25 2013
24x12x12x48	N4quda17TwistedDslashCudaI7double2S1_EE	type=exterior_y,comm=0110,reconstruct=8,Xpay	224	1	1	62	1	1	8193	# 503.05 Gflop/s, 0.00 GB/s, tuned Fri Feb 22 15:46:26 2013
24x12x12x48	N4quda17TwistedDslashCudaI7double2S1_EE	type=exterior_z,comm=0110,reconstruct=8	32	1	1	432	1	1	2341	# 666.92 Gflop/s, 0.00 GB/s, tuned Fri Feb 22 15:46:25 2013
24x12x12x48	N4quda17TwistedDslashCudaI7double2S1_EE	type=exterior_z,comm=0110,reconstruct=8,Xpay	256	1	1	54	1	1	8193	# 581.66 Gflop/s, 0.00 GB/s, tuned Fri Feb 22 15:46:26 2013
24x12x12x48	N4quda17TwistedDslashCudaI7double2S1_EE	type=interior,comm=0110,ghost=0110,reconstruct=8	32	1	1	2592	1	1	2341	# 38.02 Gflop/s, 0.00 GB/s, tuned Fri Feb 22 15:46:25 2013
24x12x12x48	N4quda17TwistedDslashCudaI7double2S1_EE	type=interior,comm=0110,ghost=0110,reconstruct=8,Xpay	32	1	1	2592	1	1	2341	# 37.93 Gflop/s, 0.00 GB/s, tuned Fri Feb 22 15:46:26 2013
24x12x24x24	N4quda15TwistGamma5CudaI6float4EE	384	1	1	1	1	1	5462	12480	# 0.00 Gflop/s, 19.69 GB/s, tuned Fri Jan  4 18:15:14 2013
24x12x24x24	N4quda15TwistGamma5CudaI7double2EE	512	1	1	1	1	1	5462	12480	# 0.00 Gflop/s, 19.69 GB/s, tuned Fri Jan  4 18:15:14 2013
24x12x24x24	N4quda16WilsonDslashCudaI6float4S1_EE	type=exterior_t,comm=0101,reconstruct=12	128	1	1	54	1	1	3277	# 2673.00 Gflop/s, 0.00 GB/s, tuned Wed Feb  6 15:07:33 2013
24x12x24x24	N4quda16WilsonDslashCudaI6float4S1_EE	type=exterior_y,comm=0101,reconstruct=12	64	1	1	216	1	1	5462	# 1400.51 Gflop/s, 0.00 GB/s, tuned Wed Feb  6 15:07:33 2013
24x12x24x24	N4quda16WilsonDslashCudaI6float4S1_EE	type=interior,comm=0101,ghost=0101,reconstruct=12	96	1	1	864	1	1	4097	# 146.62 Gflop/s, 0.00 GB/s, tuned Wed Feb  6 15:07:33 2013
24x12x24x24	N4quda16WilsonDslashCudaI7double2S1_EE	type=exterior_t,comm=0101,reconstruct=12	256	1	1	27	1	1	8193	# 1683.78 Gflop/s, 0.00 GB/s, tuned Wed Feb  6 15:07:18 2013
24x12x24x24	N4quda16WilsonDslashCudaI7double2S1_EE	type=exterior_t,comm=0101,reconstruct=12,Xpay	256	1	1	27	1	1	8193	# 1394.91 Gflop/s, 0.00 GB/s, tuned Wed Feb  6 15:07:17 2013
24x12x24x24	N4quda16WilsonDslashCudaI7double2S1_EE	type=exterior_y,comm=0101,reconstruct=12	96	1	1	144	1	1	5462	# 733.90 Gflop/s, 0.00 GB/s, tuned Wed Feb  6 15:07:18 2013
24x12x24x24	N4quda16WilsonDslashCudaI7double2S1_EE	type=exterior_y,comm=0101,reconstruct=12,Xpay	32	1	1	432	1	1	2341	# 587.26 Gflop/s, 0.00 GB/s, tuned Wed Feb  6 15:07:17 2013
24x12x24x24	N4quda16WilsonDslashCudaI7double2S1_EE	type=interior,comm=0101,ghost=0101,reconstruct=12	32	1	1	2592	1	1	2341	# 56.49 Gflop/s, 0.00 GB/s, tuned Wed Feb  6 15:07:18 2013
24x12x24x24	N4quda16WilsonDslashCudaI7double2S1_EE	type=interior,comm=0101,ghost=0101,reconstruct=12,Xpay	32	1	1	2592	1	1	2341	# 52.18 Gflop/s, 0.00 GB/s, tuned Wed Feb  6 15:07:17 2013
24x12x24x24	N4quda17TwistedDslashCudaI6float4S1_EE	type=exterior_t,comm=0101,reconstruct=12	128	1	1	54	1	1	2049	# 3039.65 Gflop/s, 0.00 GB/s, tuned Wed Feb  6 15:07:33 2013
24x12x24x24	N4quda17TwistedDslashCudaI6float4S1_EE	type=exterior_t,comm=0101,reconstruct=12,Xpay	256	1	1	27	1	1	5462	# 2543.50 Gflop/s, 0.00 GB/s, tuned Wed Feb  6 15:07:33 2013
24x12x24x24	N4quda17TwistedDslashCudaI6float4S1_EE	type=exterior_y,comm=0101,reconstruct=12	32	1	1	432	1	1	3277	# 1457.80 Gflop/s, 0.00 GB/s, tuned Wed Feb  6 15:07:33 2013
24x12x24x24	N4quda17TwistedDslashCudaI6float4S1_EE	type=exterior_y,comm=0101,reconstruct=12,Xpay	32	1	1	432	1	1	4097	# 1134.20 Gflop/s, 0.00 GB/s, tuned Wed Feb  6 15:07:33 2013
24x12x24x24	N4quda17TwistedDslashCudaI6float4S1_EE	type=interior,comm=0101,ghost=0101,reconstruct=12	96	1	1	864	1	1	4097	# 152.01 Gflop/s, 0.00 GB/s, tuned Wed Feb  6 15:07:33 2013
24x12x24x24	N4quda17TwistedDslashCudaI6float4S1_EE	type=interior,comm=0101,ghost=0101,reconstruct=12,Xpay	96	1	1	864	1	1	4097	# 139.84 Gflop/s, 0.00 GB/s, tuned Wed Feb  6 15:07:33 2013
24x12x24x24	N4quda17TwistedDslashCudaI7double2S1_EE	type=exterior_t,comm=0101,reconstruct=12	256	1	1	27	1	1	8193	# 1662.70 Gflop/s, 0.00 GB/s, tuned Wed Feb  6 15:07:25 2013
24x12x24x24	N4quda17TwistedDslashCudaI7double2S1_EE	type=exterior_t,comm=0101,reconstruct=12,Xpay	256	1	1	27	1	1	8193	# 1385.53 Gflop/s, 0.00 GB/s, tuned Wed Feb  6 15:07:26 2013
24x12x24x24	N4quda17TwistedDslashCudaI7double2S1_EE	type=exterior_y,comm=0101,reconstruct=12	32	1	1	432	1	1	2731	# 755.93 Gflop/s, 0.00 GB/s, tuned Wed Feb  6 15:07:25 2013
24x12x24x24	N4quda17TwistedDslashCudaI7double2S1_EE	type=exterior_y,comm=0101,reconstruct=12,Xpay	64	1	1	216	1	1	4097	# 614.89 Gflop/s, 0.00 GB/s, tuned Wed Feb  6 15:07:26 2013
24x12x24x24	N4quda17TwistedDslashCudaI7double2S1_EE	type=interior,comm=0101,ghost=0101,reconstruct=12	32	1	1	2592	1	1	2341	# 56.26 Gflop/s, 0.00 GB/s, tuned Wed Feb  6 15:07:25 2013
24x12x24x24	N4quda17TwistedDslashCudaI7double2S1_EE	type=interior,comm=0101,ghost=0101,reconstruct=12,Xpay	32	1	1	2592	1	1	2341	# 53.24 Gflop/s, 0.00 GB/s, tuned Wed Feb  6 15:07:26 2013
24x12x24x48	N4quda15TwistGamma5CudaI6float4EE	288	1	1	1	1	1	8193	12480	# 0.00 Gflop/s, 19.69 GB/s, tuned Fri Jan  4 18:15:14 2013
24x12x24x48	N4quda15TwistGamma5CudaI6float4EE	544	1	1	1	1	1	2049	12480	# 0.00 Gflop/s, 19.69 GB/s, tuned Fri Jan  4 18:15:14 2013
24x12x24x48	N4quda15TwistGamma5CudaI7double2EE	448	1	1	1	1	1	2049	12480	# 0.00 Gflop/s, 19.69 GB/s, tuned Fri Jan  4 18:15:14 2013
24x12x24x48	N4quda15TwistGamma5CudaI7double2EE	512	1	1	1	1	1	2731	12480	# 0.00 Gflop/s, 19.69 GB/s, tuned Fri Jan  4 18:15:14 2013
24x12x24x48	N4quda16WilsonDslashCudaI6float4S1_EE	type=exterior_y,comm=0100,reconstruct=12	32	1	1	864	1	1	3277	# 1638.62 Gflop/s, 0.00 GB/s, tuned Wed Feb  6 14:50:52 2013
24x12x24x48	N4quda16WilsonDslashCudaI6float4S1_EE	type=exterior_y,comm=0100,reconstruct=8	160	1	1	173	1	1	8193	# 1690.85 Gflop/s, 0.00 GB/s, tuned Thu Feb 21 16:41:26 2013
24x12x24x48	N4quda16WilsonDslashCudaI6float4S1_EE	type=interior,comm=0100,ghost=0100,reconstruct=12	96	1	1	1728	1	1	4097	# 148.45 Gflop/s, 0.00 GB/s, tuned Wed Feb  6 14:50:52 2013
24x12x24x48	N4quda16WilsonDslashCudaI6float4S1_EE	type=interior,comm=0100,ghost=0100,reconstruct=8	64	1	1	2592	1	1	2731	# 174.71 Gflop/s, 0.00 GB/s, tuned Thu Feb 21 16:41:26 2013
24x12x24x48	N4quda16WilsonDslashCudaI7double2S1_EE	type=exterior_y,comm=0100,reconstruct=12	64	1	1	432	1	1	5462	# 795.04 Gflop/s, 0.00 GB/s, tuned Wed Feb  6 14:50:23 2013
24x12x24x48	N4quda16WilsonDslashCudaI7double2S1_EE	type=exterior_y,comm=0100,reconstruct=12,Xpay	96	1	1	288	1	1	5462	# 633.13 Gflop/s, 0.00 GB/s, tuned Wed Feb  6 14:50:22 2013
24x12x24x48	N4quda16WilsonDslashCudaI7double2S1_EE	type=exterior_y,comm=0100,reconstruct=8	32	1	1	864	1	1	2731	# 753.87 Gflop/s, 0.00 GB/s, tuned Thu Feb 21 16:41:23 2013
24x12x24x48	N4quda16WilsonDslashCudaI7double2S1_EE	type=exterior_y,comm=0100,reconstruct=8,Xpay	64	1	1	432	1	1	4097	# 624.22 Gflop/s, 0.00 GB/s, tuned Thu Feb 21 16:41:22 2013
24x12x24x48	N4quda16WilsonDslashCudaI7double2S1_EE	type=interior,comm=0100,ghost=0100,reconstruct=12	32	1	1	5184	1	1	2341	# 56.81 Gflop/s, 0.00 GB/s, tuned Wed Feb  6 14:50:23 2013
24x12x24x48	N4quda16WilsonDslashCudaI7double2S1_EE	type=interior,comm=0100,ghost=0100,reconstruct=12,Xpay	32	1	1	5184	1	1	2341	# 51.89 Gflop/s, 0.00 GB/s, tuned Wed Feb  6 14:50:22 2013
24x12x24x48	N4quda16WilsonDslashCudaI7double2S1_EE	type=interior,comm=0100,ghost=0100,reconstruct=8	32	1	1	5184	1	1	2049	# 34.19 Gflop/s, 0.00 GB/s, tuned Thu Feb 21 16:41:23 2013
24x12x24x48	N4quda16WilsonDslashCudaI7double2S1_EE	type=interior,comm=0100,ghost=0100,reconstruct=8,Xpay	32	1	1	5184	1	1	2049	# 30.64 Gflop/s, 0.00 GB/s, tuned Thu Feb 21 16:41:22 2013
24x12x24x48	N4quda17TwistedDslashCudaI6float4S1_EE	type=exterior_y,comm=0100,reconstruct=12	32	1	1	864	1	1	3277	# 1698.71 Gflop/s, 0.00 GB/s, tuned Wed Feb  6 14:50:52 2013
24x12x24x48	N4quda17TwistedDslashCudaI6float4S1_EE	type=exterior_y,comm=0100,reconstruct=12,Xpay	32	1	1	864	1	1	4097	# 1308.71 Gflop/s, 0.00 GB/s, tuned Wed Feb  6 14:50:52 2013
24x12x24x48	N4quda17TwistedDslashCudaI6float4S1_EE	type=exterior_y,comm=0100,reconstruct=8	160	1	1	173	1	1	8193	# 1739.66 Gflop/s, 0.00 GB/s, tuned Thu Feb 21 16:41:26 2013
24x12x24x48	N4quda17TwistedDslashCudaI6float4S1_EE	type=exterior_y,comm=0100,reconstruct=8,Xpay	128	1	1	216	1	1	8193	# 1354.59 Gflop/s, 0.00 GB/s, tuned Thu Feb 21 16:41:26 2013
24x12x24x48	N4quda17TwistedDslashCudaI6float4S1_EE	type=interior,comm=0100,ghost=0100,reconstruct=12	96	1	1	1728	1	1	4097	# 152.56 Gflop/s, 0.00 GB/s, tuned Wed Feb  6 14:50:52 2013
24x12x24x48	N4quda17TwistedDslashCudaI6float4S1_EE	type=interior,comm=0100,ghost=0100,reconstruct=12,Xpay	96	1	1	1728	1	1	4097	# 142.11 Gflop/s, 0.00 GB/s, tuned Wed Feb  6 14:50:52 2013
24x12x24x48	N4quda17TwistedDslashCudaI6float4S1_EE	type=interior,comm=0100,ghost=0100,reconstruct=8	64	1	1	2592	1	1	2731	# 178.32 Gflop/s, 0.00 GB/s, tuned Thu Feb 21 16:41:26 2013
24x12x24x48	N4quda17TwistedDslashCudaI6float4S1_EE	type=interior,comm=0100,ghost=0100,reconstruct=8,Xpay	64	1	1	2592	1	1	2731	# 161.03 Gflop/s, 0.00 GB/s, tuned Thu Feb 21 16:41:26 2013
24x12x24x48	N4quda17TwistedDslashCudaI7double2S1_EE	type=exterior_y,comm=0100,reconstruct=12	96	1	1	288	1	1	5462	# 820.48 Gflop/s, 0.00 GB/s, tuned Wed Feb  6 14:50:38 2013
24x12x24x48	N4quda17TwistedDslashCudaI7double2S1_EE	type=exterior_y,comm=0100,reconstruct=12,Xpay	64	1	1	432	1	1	4097	# 661.85 Gflop/s, 0.00 GB/s, tuned Wed Feb  6 14:50:39 2013
24x12x24x48	N4quda17TwistedDslashCudaI7double2S1_EE	type=exterior_y,comm=0100,reconstruct=8	96	1	1	288	1	1	5462	# 772.44 Gflop/s, 0.00 GB/s, tuned Thu Feb 21 16:41:24 2013
24x12x24x48	N4quda17TwistedDslashCudaI7double2S1_EE	type=exterior_y,comm=0100,reconstruct=8,Xpay	96	1	1	288	1	1	5462	# 636.59 Gflop/s, 0.00 GB/s, tuned Thu Feb 21 16:41:25 2013
24x12x24x48	N4quda17TwistedDslashCudaI7double2S1_EE	type=interior,comm=0100,ghost=0100,reconstruct=12	32	1	1	5184	1	1	2341	# 56.46 Gflop/s, 0.00 GB/s, tuned Wed Feb  6 14:50:38 2013
24x12x24x48	N4quda17TwistedDslashCudaI7double2S1_EE	type=interior,comm=0100,ghost=0100,reconstruct=12,Xpay	32	1	1	5184	1	1	2341	# 53.16 Gflop/s, 0.00 GB/s, tuned Wed Feb  6 14:50:39 2013
24x12x24x48	N4quda17TwistedDslashCudaI7double2S1_EE	type=interior,comm=0100,ghost=0100,reconstruct=8	32	1	1	5184	1	1	2049	# 32.46 Gflop/s, 0.00 GB/s, tuned Thu Feb 21 16:41:24 2013
24x12x24x48	N4quda17TwistedDslashCudaI7double2S1_EE	type=interior,comm=0100,ghost=0100,reconstruct=8,Xpay	32	1	1	5184	1	1	2049	# 32.27 Gflop/s, 0.00 GB/s, tuned Thu Feb 21 16:41:25 2013
24x24x12x12	N4quda15TwistGamma5CudaI6float4EE	544	1	1	1	1	1	3277	12480	# 0.00 Gflop/s, 19.69 GB/s, tuned Fri Jan  4 18:15:14 2013
24x24x12x12	N4quda15TwistGamma5CudaI7double2EE	480	1	1	1	1	1	5462	12480	# 0.00 Gflop/s, 19.69 GB/s, tuned Fri Jan  4 18:15:14 2013
24x24x12x12	N4quda16WilsonDslashCudaI6float4S1_EE	type=exterior_t,comm=0011,reconstruct=12	128	1	1	54	1	1	3277	# 1331.30 Gflop/s, 0.00 GB/s, tuned Wed Feb  6 15:49:26 2013
24x24x12x12	N4quda16WilsonDslashCudaI6float4S1_EE	type=exterior_t,comm=0011,reconstruct=8	256	1	1	27	1	1	2049	# 1390.83 Gflop/s, 0.00 GB/s, tuned Fri Jan  4 18:44:56 2013
24x24x12x12	N4quda16WilsonDslashCudaI6float4S1_EE	type=exterior_z,comm=0011,reconstruct=12	512	1	1	14	1	1	0	# 1337.54 Gflop/s, 0.00 GB/s, tuned Wed Feb  6 15:49:26 2013
24x24x12x12	N4quda16WilsonDslashCudaI6float4S1_EE	type=exterior_z,comm=0011,reconstruct=8	256	1	1	27	1	1	5462	# 1427.98 Gflop/s, 0.00 GB/s, tuned Fri Jan  4 18:44:56 2013
24x24x12x12	N4quda16WilsonDslashCudaI6float4S1_EE	type=interior,comm=0011,ghost=0011,reconstruct=12	96	1	1	432	1	1	4097	# 139.96 Gflop/s, 0.00 GB/s, tuned Wed Feb  6 15:49:26 2013
24x24x12x12	N4quda16WilsonDslashCudaI6float4S1_EE	type=interior,comm=0011,ghost=0011,reconstruct=8	96	1	1	432	1	1	3277	# 163.60 Gflop/s, 0.00 GB/s, tuned Fri Jan  4 18:44:56 2013
24x24x12x12	N4quda16WilsonDslashCudaI7double2S1_EE	type=exterior_t,comm=0011,reconstruct=12	128	1	1	54	1	1	5462	# 833.68 Gflop/s, 0.00 GB/s, tuned Wed Feb  6 15:49:25 2013
24x24x12x12	N4quda16WilsonDslashCudaI7double2S1_EE	type=exterior_t,comm=0011,reconstruct=12,Xpay	256	1	1	27	1	1	8193	# 697.45 Gflop/s, 0.00 GB/s, tuned Wed Feb  6 15:49:25 2013
24x24x12x12	N4quda16WilsonDslashCudaI7double2S1_EE	type=exterior_t,comm=0011,reconstruct=8	64	1	1	108	1	1	3277	# 707.20 Gflop/s, 0.00 GB/s, tuned Fri Jan  4 18:44:49 2013
24x24x12x12	N4quda16WilsonDslashCudaI7double2S1_EE	type=exterior_t,comm=0011,reconstruct=8,Xpay	256	1	1	27	1	1	8193	# 594.74 Gflop/s, 0.00 GB/s, tuned Fri Jan  4 18:44:47 2013
24x24x12x12	N4quda16WilsonDslashCudaI7double2S1_EE	type=exterior_z,comm=0011,reconstruct=12	64	1	1	108	1	1	3277	# 779.37 Gflop/s, 0.00 GB/s, tuned Wed Feb  6 15:49:25 2013
24x24x12x12	N4quda16WilsonDslashCudaI7double2S1_EE	type=exterior_z,comm=0011,reconstruct=12,Xpay	64	1	1	108	1	1	3277	# 633.87 Gflop/s, 0.00 GB/s, tuned Wed Feb  6 15:49:25 2013
24x24x12x12	N4quda16WilsonDslashCudaI7double2S1_EE	type=exterior_z,comm=0011,reconstruct=8	64	1	1	108	1	1	3277	# 670.08 Gflop/s, 0.00 GB/s, tuned Fri Jan  4 18:44:49 2013
24x24x12x12	N4quda16WilsonDslashCudaI7double2S1_EE	type=exterior_z,comm=0011,reconstruct=8,Xpay	64	1	1	108	1	1	3277	# 565.53 Gflop/s, 0.00 GB/s, tuned Fri Jan  4 18:44:47 2013
24x24x12x12	N4quda16WilsonDslashCudaI7double2S1_EE	type=interior,comm=0011,ghost=0011,reconstruct=12	64	1	1	648	1	1	4097	# 56.94 Gflop/s, 0.00 GB/s, tuned Wed Feb  6 15:49:25 2013
24x24x12x12	N4quda16WilsonDslashCudaI7double2S1_EE	type=interior,comm=0011,ghost=0011,reconstruct=12,Xpay	32	1	1	1296	1	1	2341	# 53.09 Gflop/s, 0.00 GB/s, tuned Wed Feb  6 15:49:25 2013
24x24x12x12	N4quda16WilsonDslashCudaI7double2S1_EE	type=interior,comm=0011,ghost=0011,reconstruct=8	32	1	1	1296	1	1	2341	# 37.48 Gflop/s, 0.00 GB/s, tuned Fri Jan  4 18:44:49 2013
24x24x12x12	N4quda16WilsonDslashCudaI7double2S1_EE	type=interior,comm=0011,ghost=0011,reconstruct=8,Xpay	32	1	1	1296	1	1	2049	# 35.66 Gflop/s, 0.00 GB/s, tuned Fri Jan  4 18:44:47 2013
24x24x12x12	N4quda17TwistedDslashCudaI6float4S1_EE	type=exterior_t,comm=0011,reconstruct=12	128	1	1	54	1	1	2341	# 1498.37 Gflop/s, 0.00 GB/s, tuned Wed Feb  6 15:49:26 2013
24x24x12x12	N4quda17TwistedDslashCudaI6float4S1_EE	type=exterior_t,comm=0011,reconstruct=12,Xpay	512	1	1	14	1	1	2731	# 1266.48 Gflop/s, 0.00 GB/s, tuned Wed Feb  6 15:49:26 2013
24x24x12x12	N4quda17TwistedDslashCudaI6float4S1_EE	type=exterior_t,comm=0011,reconstruct=8	256	1	1	27	1	1	2049	# 1552.52 Gflop/s, 0.00 GB/s, tuned Fri Jan  4 18:44:56 2013
24x24x12x12	N4quda17TwistedDslashCudaI6float4S1_EE	type=exterior_t,comm=0011,reconstruct=8,Xpay	256	1	1	27	1	1	2731	# 1302.44 Gflop/s, 0.00 GB/s, tuned Fri Jan  4 18:44:56 2013
24x24x12x12	N4quda17TwistedDslashCudaI6float4S1_EE	type=exterior_z,comm=0011,reconstruct=12	128	1	1	54	1	1	2049	# 1498.37 Gflop/s, 0.00 GB/s, tuned Wed Feb  6 15:49:26 2013
24x24x12x12	N4quda17TwistedDslashCudaI6float4S1_EE	type=exterior_z,comm=0011,reconstruct=12,Xpay	512	1	1	14	1	1	8193	# 1220.17 Gflop/s, 0.00 GB/s, tuned Wed Feb  6 15:49:26 2013
24x24x12x12	N4quda17TwistedDslashCudaI6float4S1_EE	type=exterior_z,comm=0011,reconstruct=8	256	1	1	27	1	1	4097	# 1607.87 Gflop/s, 0.00 GB/s, tuned Fri Jan  4 18:44:56 2013
24x24x12x12	N4quda17TwistedDslashCudaI6float4S1_EE	type=exterior_z,comm=0011,reconstruct=8,Xpay	128	1	1	54	1	1	2341	# 1361.38 Gflop/s, 0.00 GB/s, tuned Fri Jan  4 18:44:56 2013
24x24x12x12	N4quda17TwistedDslashCudaI6float4S1_EE	type=interior,comm=0011,ghost=0011,reconstruct=12	96	1	1	432	1	1	4097	# 148.46 Gflop/s, 0.00 GB/s, tuned Wed Feb  6 15:49:26 2013
24x24x12x12	N4quda17TwistedDslashCudaI6float4S1_EE	type=interior,comm=0011,ghost=0011,reconstruct=12,Xpay	96	1	1	432	1	1	4097	# 138.62 Gflop/s, 0.00 GB/s, tuned Wed Feb  6 15:49:26 2013
24x24x12x12	N4quda17TwistedDslashCudaI6float4S1_EE	type=interior,comm=0011,ghost=0011,reconstruct=8	64	1	1	648	1	1	2341	# 169.20 Gflop/s, 0.00 GB/s, tuned Fri Jan  4 18:44:56 2013
24x24x12x12	N4quda17TwistedDslashCudaI6float4S1_EE	type=interior,comm=0011,ghost=0011,reconstruct=8,Xpay	64	1	1	648	1	1	2731	# 154.54 Gflop/s, 0.00 GB/s, tuned Fri Jan  4 18:44:56 2013
24x24x12x12	N4quda17TwistedDslashCudaI7double2S1_EE	type=exterior_t,comm=0011,reconstruct=12	256	1	1	27	1	1	8193	# 835.97 Gflop/s, 0.00 GB/s, tuned Wed Feb  6 15:49:25 2013
24x24x12x12	N4quda17TwistedDslashCudaI7double2S1_EE	type=exterior_t,comm=0011,reconstruct=12,Xpay	256	1	1	27	1	1	8193	# 700.17 Gflop/s, 0.00 GB/s, tuned Wed Feb  6 15:49:26 2013
24x24x12x12	N4quda17TwistedDslashCudaI7double2S1_EE	type=exterior_t,comm=0011,reconstruct=8	256	1	1	27	1	1	8193	# 695.73 Gflop/s, 0.00 GB/s, tuned Fri Jan  4 18:44:52 2013
24x24x12x12	N4quda17TwistedDslashCudaI7double2S1_EE	type=exterior_t,comm=0011,reconstruct=8,Xpay	256	1	1	27	1	1	8193	# 613.96 Gflop/s, 0.00 GB/s, tuned Fri Jan  4 18:44:52 2013
24x24x12x12	N4quda17TwistedDslashCudaI7double2S1_EE	type=exterior_z,comm=0011,reconstruct=12	32	1	1	216	1	1	2341	# 787.10 Gflop/s, 0.00 GB/s, tuned Wed Feb  6 15:49:25 2013
24x24x12x12	N4quda17TwistedDslashCudaI7double2S1_EE	type=exterior_z,comm=0011,reconstruct=12,Xpay	64	1	1	108	1	1	3277	# 630.20 Gflop/s, 0.00 GB/s, tuned Wed Feb  6 15:49:26 2013
24x24x12x12	N4quda17TwistedDslashCudaI7double2S1_EE	type=exterior_z,comm=0011,reconstruct=8	32	1	1	216	1	1	2341	# 671.89 Gflop/s, 0.00 GB/s, tuned Fri Jan  4 18:44:52 2013
24x24x12x12	N4quda17TwistedDslashCudaI7double2S1_EE	type=exterior_z,comm=0011,reconstruct=8,Xpay	64	1	1	108	1	1	3277	# 580.37 Gflop/s, 0.00 GB/s, tuned Fri Jan  4 18:44:52 2013
24x24x12x12	N4quda17TwistedDslashCudaI7double2S1_EE	type=interior,comm=0011,ghost=0011,reconstruct=12	32	1	1	1296	1	1	2341	# 56.26 Gflop/s, 0.00 GB/s, tuned Wed Feb  6 15:49:25 2013
24x24x12x12	N4quda17TwistedDslashCudaI7double2S1_EE	type=interior,comm=0011,ghost=0011,reconstruct=12,Xpay	32	1	1	1296	1	1	2341	# 54.19 Gflop/s, 0.00 GB/s, tuned Wed Feb  6 15:49:26 2013
24x24x12x12	N4quda17TwistedDslashCudaI7double2S1_EE	type=interior,comm=0011,ghost=0011,reconstruct=8	32	1	1	1296	1	1	2049	# 37.76 Gflop/s, 0.00 GB/s, tuned Fri Jan  4 18:44:52 2013
24x24x12x12	N4quda17TwistedDslashCudaI7double2S1_EE	type=interior,comm=0011,ghost=0011,reconstruct=8,Xpay	32	1	1	1296	1	1	2049	# 37.32 Gflop/s, 0.00 GB/s, tuned Fri Jan  4 18:44:52 2013
24x24x12x24	N4quda15TwistGamma5CudaI6float4EE	512	1	1	1	1	1	4097	2049	# 37.32 Gflop/s, 0.00 GB/s, tuned Fri Jan  4 18:44:52 2013
24x24x12x24	N4quda15TwistGamma5CudaI7double2EE	512	1	1	1	1	1	2341	2049	# 37.32 Gflop/s, 0.00 GB/s, tuned Fri Jan  4 18:44:52 2013
24x24x12x24	N4quda16WilsonDslashCudaI6float4S1_EE	type=exterior_t,comm=0011,reconstruct=12	512	1	1	14	1	1	3277	# 2689.81 Gflop/s, 0.00 GB/s, tuned Wed Feb  6 15:03:00 2013
24x24x12x24	N4quda16WilsonDslashCudaI6float4S1_EE	type=exterior_z,comm=0011,reconstruct=12	512	1	1	27	1	1	0	# 1710.72 Gflop/s, 0.00 GB/s, tuned Wed Feb  6 15:03:00 2013
24x24x12x24	N4quda16WilsonDslashCudaI6float4S1_EE	type=interior,comm=0011,ghost=0011,reconstruct=12	96	1	1	864	1	1	4097	# 149.60 Gflop/s, 0.00 GB/s, tuned Wed Feb  6 15:03:00 2013
24x24x12x24	N4quda16WilsonDslashCudaI7double2S1_EE	type=exterior_t,comm=0011,reconstruct=12	64	1	1	108	1	1	3277	# 1652.07 Gflop/s, 0.00 GB/s, tuned Wed Feb  6 15:02:45 2013
24x24x12x24	N4quda16WilsonDslashCudaI7double2S1_EE	type=exterior_t,comm=0011,reconstruct=12,Xpay	256	1	1	27	1	1	8193	# 1385.64 Gflop/s, 0.00 GB/s, tuned Wed Feb  6 15:02:44 2013
24x24x12x24	N4quda16WilsonDslashCudaI7double2S1_EE	type=exterior_z,comm=0011,reconstruct=12	96	1	1	144	1	1	5462	# 946.98 Gflop/s, 0.00 GB/s, tuned Wed Feb  6 15:02:45 2013
24x24x12x24	N4quda16WilsonDslashCudaI7double2S1_EE	type=exterior_z,comm=0011,reconstruct=12,Xpay	64	1	1	216	1	1	4097	# 736.27 Gflop/s, 0.00 GB/s, tuned Wed Feb  6 15:02:45 2013
24x24x12x24	N4quda16WilsonDslashCudaI7double2S1_EE	type=interior,comm=0011,ghost=0011,reconstruct=12	32	1	1	2592	1	1	2341	# 58.33 Gflop/s, 0.00 GB/s, tuned Wed Feb  6 15:02:45 2013
24x24x12x24	N4quda16WilsonDslashCudaI7double2S1_EE	type=interior,comm=0011,ghost=0011,reconstruct=12,Xpay	32	1	1	2592	1	1	2341	# 54.15 Gflop/s, 0.00 GB/s, tuned Wed Feb  6 15:02:44 2013
24x24x12x24	N4quda17TwistedDslashCudaI6float4S1_EE	type=exterior_t,comm=0011,reconstruct=12	256	1	1	27	1	1	3277	# 2984.34 Gflop/s, 0.00 GB/s, tuned Wed Feb  6 15:03:00 2013
24x24x12x24	N4quda17TwistedDslashCudaI6float4S1_EE	type=exterior_t,comm=0011,reconstruct=12,Xpay	512	1	1	14	1	1	5462	# 2500.19 Gflop/s, 0.00 GB/s, tuned Wed Feb  6 15:03:00 2013
24x24x12x24	N4quda17TwistedDslashCudaI6float4S1_EE	type=exterior_z,comm=0011,reconstruct=12	512	1	1	27	1	1	2731	# 1806.74 Gflop/s, 0.00 GB/s, tuned Wed Feb  6 15:03:00 2013
24x24x12x24	N4quda17TwistedDslashCudaI6float4S1_EE	type=exterior_z,comm=0011,reconstruct=12,Xpay	352	1	1	40	1	1	5462	# 1455.30 Gflop/s, 0.00 GB/s, tuned Wed Feb  6 15:03:00 2013
24x24x12x24	N4quda17TwistedDslashCudaI6float4S1_EE	type=interior,comm=0011,ghost=0011,reconstruct=12	96	1	1	864	1	1	4097	# 156.23 Gflop/s, 0.00 GB/s, tuned Wed Feb  6 15:03:00 2013
24x24x12x24	N4quda17TwistedDslashCudaI6float4S1_EE	type=interior,comm=0011,ghost=0011,reconstruct=12,Xpay	96	1	1	864	1	1	4097	# 143.98 Gflop/s, 0.00 GB/s, tuned Wed Feb  6 15:03:00 2013
24x24x12x24	N4quda17TwistedDslashCudaI7double2S1_EE	type=exterior_t,comm=0011,reconstruct=12	256	1	1	27	1	1	8193	# 1647.52 Gflop/s, 0.00 GB/s, tuned Wed Feb  6 15:02:53 2013
24x24x12x24	N4quda17TwistedDslashCudaI7double2S1_EE	type=exterior_t,comm=0011,reconstruct=12,Xpay	256	1	1	27	1	1	8193	# 1380.84 Gflop/s, 0.00 GB/s, tuned Wed Feb  6 15:02:53 2013
24x24x12x24	N4quda17TwistedDslashCudaI7double2S1_EE	type=exterior_z,comm=0011,reconstruct=12	64	1	1	216	1	1	4097	# 946.75 Gflop/s, 0.00 GB/s, tuned Wed Feb  6 15:02:53 2013
24x24x12x24	N4quda17TwistedDslashCudaI7double2S1_EE	type=exterior_z,comm=0011,reconstruct=12,Xpay	32	1	1	432	1	1	2341	# 740.27 Gflop/s, 0.00 GB/s, tuned Wed Feb  6 15:02:53 2013
24x24x12x24	N4quda17TwistedDslashCudaI7double2S1_EE	type=interior,comm=0011,ghost=0011,reconstruct=12	32	1	1	2592	1	1	2341	# 58.07 Gflop/s, 0.00 GB/s, tuned Wed Feb  6 15:02:52 2013
24x24x12x24	N4quda17TwistedDslashCudaI7double2S1_EE	type=interior,comm=0011,ghost=0011,reconstruct=12,Xpay	32	1	1	2592	1	1	2341	# 54.87 Gflop/s, 0.00 GB/s, tuned Wed Feb  6 15:02:53 2013
24x24x12x48	N4quda15TwistGamma5CudaI6float4EE	160	1	1	1	1	1	5462	2049	# 37.32 Gflop/s, 0.00 GB/s, tuned Fri Jan  4 18:44:52 2013
24x24x12x48	N4quda15TwistGamma5CudaI6float4EE	288	1	1	1	1	1	8193	2049	# 37.32 Gflop/s, 0.00 GB/s, tuned Fri Jan  4 18:44:52 2013
24x24x12x48	N4quda15TwistGamma5CudaI6float4EE	320	1	1	1	1	1	8193	2341	# 54.87 Gflop/s, 0.00 GB/s, tuned Wed Feb  6 15:02:53 2013
24x24x12x48	N4quda15TwistGamma5CudaI6float4EE	512	1	1	1	1	1	4097	2049	# 37.32 Gflop/s, 0.00 GB/s, tuned Fri Jan  4 18:44:52 2013
24x24x12x48	N4quda15TwistGamma5CudaI6float4EE	544	1	1	1	1	1	2341	2049	# 37.32 Gflop/s, 0.00 GB/s, tuned Fri Jan  4 18:44:52 2013
24x24x12x48	N4quda15TwistGamma5CudaI7double2EE	288	1	1	1	1	1	8193	2049	# 37.32 Gflop/s, 0.00 GB/s, tuned Fri Jan  4 18:44:52 2013
24x24x12x48	N4quda15TwistGamma5CudaI7double2EE	448	1	1	1	1	1	8193	2049	# 37.32 Gflop/s, 0.00 GB/s, tuned Fri Jan  4 18:44:52 2013
24x24x12x48	N4quda15TwistGamma5CudaI7double2EE	512	1	1	1	1	1	0	2049	# 37.32 Gflop/s, 0.00 GB/s, tuned Fri Jan  4 18:44:52 2013
24x24x12x48	N4quda16WilsonDslashCudaI6float4S1_EE	type=exterior_z,comm=0010,reconstruct=12	288	1	1	96	1	1	8193	# 2039.61 Gflop/s, 0.00 GB/s, tuned Tue Feb  5 18:48:15 2013
24x24x12x48	N4quda16WilsonDslashCudaI6float4S1_EE	type=exterior_z,comm=0010,reconstruct=8	416	1	1	67	1	1	8193	# 2148.47 Gflop/s, 0.00 GB/s, tuned Thu Feb 21 16:20:23 2013
24x24x12x48	N4quda16WilsonDslashCudaI6float4S1_EE	type=interior,comm=0010,ghost=0010,reconstruct=12	96	1	1	1728	1	1	4097	# 153.17 Gflop/s, 0.00 GB/s, tuned Tue Feb  5 18:48:15 2013
24x24x12x48	N4quda16WilsonDslashCudaI6float4S1_EE	type=interior,comm=0010,ghost=0010,reconstruct=8	64	1	1	2592	1	1	2731	# 177.09 Gflop/s, 0.00 GB/s, tuned Thu Feb 21 16:20:23 2013
24x24x12x48	N4quda16WilsonDslashCudaI7double2S1_EE	type=exterior_z,comm=0010,reconstruct=12	64	1	1	432	1	1	4097	# 1078.81 Gflop/s, 0.00 GB/s, tuned Tue Feb  5 18:47:46 2013
24x24x12x48	N4quda16WilsonDslashCudaI7double2S1_EE	type=exterior_z,comm=0010,reconstruct=12,Xpay	64	1	1	432	1	1	4097	# 828.08 Gflop/s, 0.00 GB/s, tuned Tue Feb  5 18:47:45 2013
24x24x12x48	N4quda16WilsonDslashCudaI7double2S1_EE	type=exterior_z,comm=0010,reconstruct=8	64	1	1	432	1	1	4097	# 979.23 Gflop/s, 0.00 GB/s, tuned Thu Feb 21 16:20:19 2013
24x24x12x48	N4quda16WilsonDslashCudaI7double2S1_EE	type=exterior_z,comm=0010,reconstruct=8,Xpay	64	1	1	432	1	1	4097	# 776.32 Gflop/s, 0.00 GB/s, tuned Thu Feb 21 16:20:18 2013
24x24x12x48	N4quda16WilsonDslashCudaI7double2S1_EE	type=interior,comm=0010,ghost=0010,reconstruct=12	32	1	1	5184	1	1	2341	# 59.13 Gflop/s, 0.00 GB/s, tuned Tue Feb  5 18:47:46 2013
24x24x12x48	N4quda16WilsonDslashCudaI7double2S1_EE	type=interior,comm=0010,ghost=0010,reconstruct=12,Xpay	32	1	1	5184	1	1	2341	# 54.09 Gflop/s, 0.00 GB/s, tuned Tue Feb  5 18:47:45 2013
24x24x12x48	N4quda16WilsonDslashCudaI7double2S1_EE	type=interior,comm=0010,ghost=0010,reconstruct=8	32	1	1	5184	1	1	2049	# 38.61 Gflop/s, 0.00 GB/s, tuned Thu Feb 21 16:20:19 2013
24x24x12x48	N4quda16WilsonDslashCudaI7double2S1_EE	type=interior,comm=0010,ghost=0010,reconstruct=8,Xpay	32	1	1	5184	1	1	2049	# 35.73 Gflop/s, 0.00 GB/s, tuned Thu Feb 21 16:20:18 2013
24x24x12x48	N4quda17TwistedDslashCudaI6float4S1_EE	type=exterior_z,comm=0010,reconstruct=12	512	1	1	54	1	1	5462	# 2166.35 Gflop/s, 0.00 GB/s, tuned Tue Feb  5 18:48:14 2013
24x24x12x48	N4quda17TwistedDslashCudaI6float4S1_EE	type=exterior_z,comm=0010,reconstruct=12,Xpay	288	1	1	96	1	1	4097	# 1693.71 Gflop/s, 0.00 GB/s, tuned Tue Feb  5 18:48:15 2013
24x24x12x48	N4quda17TwistedDslashCudaI6float4S1_EE	type=exterior_z,comm=0010,reconstruct=8	416	1	1	67	1	1	4097	# 2246.62 Gflop/s, 0.00 GB/s, tuned Thu Feb 21 16:20:22 2013
24x24x12x48	N4quda17TwistedDslashCudaI6float4S1_EE	type=exterior_z,comm=0010,reconstruct=8,Xpay	96	1	1	288	1	1	2731	# 1734.12 Gflop/s, 0.00 GB/s, tuned Thu Feb 21 16:20:22 2013
24x24x12x48	N4quda17TwistedDslashCudaI6float4S1_EE	type=interior,comm=0010,ghost=0010,reconstruct=12	96	1	1	1728	1	1	4097	# 158.06 Gflop/s, 0.00 GB/s, tuned Tue Feb  5 18:48:14 2013
24x24x12x48	N4quda17TwistedDslashCudaI6float4S1_EE	type=interior,comm=0010,ghost=0010,reconstruct=12,Xpay	96	1	1	1728	1	1	4097	# 145.40 Gflop/s, 0.00 GB/s, tuned Tue Feb  5 18:48:15 2013
24x24x12x48	N4quda17TwistedDslashCudaI6float4S1_EE	type=interior,comm=0010,ghost=0010,reconstruct=8	64	1	1	2592	1	1	2731	# 181.88 Gflop/s, 0.00 GB/s, tuned Thu Feb 21 16:20:22 2013
24x24x12x48	N4quda17TwistedDslashCudaI6float4S1_EE	type=interior,comm=0010,ghost=0010,reconstruct=8,Xpay	64	1	1	2592	1	1	2731	# 168.27 Gflop/s, 0.00 GB/s, tuned Thu Feb 21 16:20:22 2013
24x24x12x48	N4quda17TwistedDslashCudaI7double2S1_EE	type=exterior_z,comm=0010,reconstruct=12	64	1	1	432	1	1	4097	# 1116.18 Gflop/s, 0.00 GB/s, tuned Tue Feb  5 18:48:00 2013
24x24x12x48	N4quda17TwistedDslashCudaI7double2S1_EE	type=exterior_z,comm=0010,reconstruct=12,Xpay	32	1	1	864	1	1	2341	# 838.34 Gflop/s, 0.00 GB/s, tuned Tue Feb  5 18:48:01 2013
24x24x12x48	N4quda17TwistedDslashCudaI7double2S1_EE	type=exterior_z,comm=0010,reconstruct=8	32	1	1	864	1	1	2341	# 975.42 Gflop/s, 0.00 GB/s, tuned Thu Feb 21 16:20:21 2013
24x24x12x48	N4quda17TwistedDslashCudaI7double2S1_EE	type=exterior_z,comm=0010,reconstruct=8,Xpay	32	1	1	864	1	1	2341	# 795.64 Gflop/s, 0.00 GB/s, tuned Thu Feb 21 16:20:22 2013
24x24x12x48	N4quda17TwistedDslashCudaI7double2S1_EE	type=interior,comm=0010,ghost=0010,reconstruct=12	32	1	1	5184	1	1	2341	# 58.27 Gflop/s, 0.00 GB/s, tuned Tue Feb  5 18:48:00 2013
24x24x12x48	N4quda17TwistedDslashCudaI7double2S1_EE	type=interior,comm=0010,ghost=0010,reconstruct=12,Xpay	32	1	1	5184	1	1	2341	# 55.47 Gflop/s, 0.00 GB/s, tuned Tue Feb  5 18:48:01 2013
24x24x12x48	N4quda17TwistedDslashCudaI7double2S1_EE	type=interior,comm=0010,ghost=0010,reconstruct=8	32	1	1	5184	1	1	0	# 37.25 Gflop/s, 0.00 GB/s, tuned Thu Feb 21 16:20:20 2013
24x24x12x48	N4quda17TwistedDslashCudaI7double2S1_EE	type=interior,comm=0010,ghost=0010,reconstruct=8,Xpay	32	1	1	5184	1	1	2049	# 37.57 Gflop/s, 0.00 GB/s, tuned Thu Feb 21 16:20:22 2013
24x24x24x12	N4quda15TwistGamma5CudaI6float4EE	288	1	1	1	1	1	8193	0	# 0.00 Gflop/s, 88.05 GB/s, tuned Fri Jan  4 17:45:03 2013
24x24x24x12	N4quda15TwistGamma5CudaI6float4EE	416	1	1	1	1	1	5462	2049	# 37.57 Gflop/s, 0.00 GB/s, tuned Thu Feb 21 16:20:22 2013
24x24x24x12	N4quda15TwistGamma5CudaI6float4EE	448	1	1	1	1	1	4097	2341	# 55.47 Gflop/s, 0.00 GB/s, tuned Tue Feb  5 18:48:01 2013
24x24x24x12	N4quda15TwistGamma5CudaI6float4EE	512	1	1	1	1	1	0	2049	# 37.57 Gflop/s, 0.00 GB/s, tuned Thu Feb 21 16:20:22 2013
24x24x24x12	N4quda15TwistGamma5CudaI6float4EE	544	1	1	1	1	1	0	2341	# 55.47 Gflop/s, 0.00 GB/s, tuned Tue Feb  5 18:48:01 2013
24x24x24x12	N4quda15TwistGamma5CudaI6float4EE	576	1	1	1	1	1	0	0	# 0.00 Gflop/s, 88.05 GB/s, tuned Fri Jan  4 17:45:03 2013
24x24x24x12	N4quda15TwistGamma5CudaI7double2EE	384	1	1	1	1	1	2049	0	# 0.00 Gflop/s, 88.05 GB/s, tuned Fri Jan  4 17:45:03 2013
24x24x24x12	N4quda15TwistGamma5CudaI7double2EE	448	1	1	1	1	1	2341	0	# 0.00 Gflop/s, 88.05 GB/s, tuned Fri Jan  4 17:45:03 2013
24x24x24x12	N4quda15TwistGamma5CudaI7double2EE	480	1	1	1	1	1	2049	0	# 0.00 Gflop/s, 88.05 GB/s, tuned Fri Jan  4 17:45:03 2013
24x24x24x12	N4quda15TwistGamma5CudaI7double2EE	512	1	1	1	1	1	2731	0	# 0.00 Gflop/s, 88.05 GB/s, tuned Fri Jan  4 17:45:03 2013
24x24x24x12	N4quda16WilsonDslashCudaI6float4S1_EE	type=exterior_t,comm=0001,reconstruct=12	256	1	1	54	1	1	2731	# 1776.45 Gflop/s, 0.00 GB/s, tuned Wed Feb  6 15:00:24 2013
24x24x24x12	N4quda16WilsonDslashCudaI6float4S1_EE	type=exterior_t,comm=0001,reconstruct=8	512	1	1	27	1	1	2731	# 1853.43 Gflop/s, 0.00 GB/s, tuned Fri Jan  4 18:04:03 2013
24x24x24x12	N4quda16WilsonDslashCudaI6float4S1_EE	type=interior,comm=0001,ghost=0001,reconstruct=12	96	1	1	864	1	1	4097	# 141.08 Gflop/s, 0.00 GB/s, tuned Wed Feb  6 15:00:24 2013
24x24x24x12	N4quda16WilsonDslashCudaI6float4S1_EE	type=interior,comm=0001,ghost=0001,reconstruct=8	64	1	1	1296	1	1	2731	# 159.91 Gflop/s, 0.00 GB/s, tuned Fri Jan  4 18:04:03 2013
24x24x24x12	N4quda16WilsonDslashCudaI7double2S1_EE	type=exterior_t,comm=0001,reconstruct=12	256	1	1	54	1	1	8193	# 980.64 Gflop/s, 0.00 GB/s, tuned Wed Feb  6 15:00:23 2013
24x24x24x12	N4quda16WilsonDslashCudaI7double2S1_EE	type=exterior_t,comm=0001,reconstruct=12,Xpay	256	1	1	54	1	1	8193	# 783.10 Gflop/s, 0.00 GB/s, tuned Wed Feb  6 15:00:22 2013
24x24x24x12	N4quda16WilsonDslashCudaI7double2S1_EE	type=exterior_t,comm=0001,reconstruct=8	32	1	1	432	1	1	2341	# 866.85 Gflop/s, 0.00 GB/s, tuned Fri Jan  4 18:03:50 2013
24x24x24x12	N4quda16WilsonDslashCudaI7double2S1_EE	type=exterior_t,comm=0001,reconstruct=8,Xpay	64	1	1	216	1	1	4097	# 665.01 Gflop/s, 0.00 GB/s, tuned Fri Jan  4 18:03:47 2013
24x24x24x12	N4quda16WilsonDslashCudaI7double2S1_EE	type=interior,comm=0001,ghost=0001,reconstruct=12	32	1	1	2592	1	1	2341	# 57.34 Gflop/s, 0.00 GB/s, tuned Wed Feb  6 15:00:23 2013
24x24x24x12	N4quda16WilsonDslashCudaI7double2S1_EE	type=interior,comm=0001,ghost=0001,reconstruct=12,Xpay	32	1	1	2592	1	1	2341	# 52.54 Gflop/s, 0.00 GB/s, tuned Wed Feb  6 15:00:22 2013
24x24x24x12	N4quda16WilsonDslashCudaI7double2S1_EE	type=interior,comm=0001,ghost=0001,reconstruct=8	32	1	1	2592	1	1	2049	# 35.20 Gflop/s, 0.00 GB/s, tuned Fri Jan  4 18:03:50 2013
24x24x24x12	N4quda16WilsonDslashCudaI7double2S1_EE	type=interior,comm=0001,ghost=0001,reconstruct=8,Xpay	32	1	1	2592	1	1	2049	# 32.35 Gflop/s, 0.00 GB/s, tuned Fri Jan  4 18:03:47 2013
24x24x24x12	N4quda17TwistedDslashCudaI6float4S1_EE	type=exterior_t,comm=0001,reconstruct=12	512	1	1	27	1	1	0	# 1856.96 Gflop/s, 0.00 GB/s, tuned Wed Feb  6 15:00:24 2013
24x24x24x12	N4quda17TwistedDslashCudaI6float4S1_EE	type=exterior_t,comm=0001,reconstruct=12,Xpay	512	1	1	27	1	1	2341	# 1490.77 Gflop/s, 0.00 GB/s, tuned Wed Feb  6 15:00:24 2013
24x24x24x12	N4quda17TwistedDslashCudaI6float4S1_EE	type=exterior_t,comm=0001,reconstruct=8	256	1	1	54	1	1	2049	# 1877.24 Gflop/s, 0.00 GB/s, tuned Fri Jan  4 18:04:02 2013
24x24x24x12	N4quda17TwistedDslashCudaI6float4S1_EE	type=exterior_t,comm=0001,reconstruct=8,Xpay	64	1	1	216	1	1	2341	# 1519.15 Gflop/s, 0.00 GB/s, tuned Fri Jan  4 18:04:02 2013
24x24x24x12	N4quda17TwistedDslashCudaI6float4S1_EE	type=interior,comm=0001,ghost=0001,reconstruct=12	96	1	1	864	1	1	4097	# 148.30 Gflop/s, 0.00 GB/s, tuned Wed Feb  6 15:00:24 2013
24x24x24x12	N4quda17TwistedDslashCudaI6float4S1_EE	type=interior,comm=0001,ghost=0001,reconstruct=12,Xpay	96	1	1	864	1	1	4097	# 138.71 Gflop/s, 0.00 GB/s, tuned Wed Feb  6 15:00:24 2013
24x24x24x12	N4quda17TwistedDslashCudaI6float4S1_EE	type=interior,comm=0001,ghost=0001,reconstruct=8	64	1	1	1296	1	1	2731	# 168.17 Gflop/s, 0.00 GB/s, tuned Fri Jan  4 18:04:02 2013
24x24x24x12	N4quda17TwistedDslashCudaI6float4S1_EE	type=interior,comm=0001,ghost=0001,reconstruct=8,Xpay	64	1	1	1296	1	1	2731	# 157.25 Gflop/s, 0.00 GB/s, tuned Fri Jan  4 18:04:02 2013
24x24x24x12	N4quda17TwistedDslashCudaI7double2S1_EE	type=exterior_t,comm=0001,reconstruct=12	64	1	1	216	1	1	4097	# 969.65 Gflop/s, 0.00 GB/s, tuned Wed Feb  6 15:00:23 2013
24x24x24x12	N4quda17TwistedDslashCudaI7double2S1_EE	type=exterior_t,comm=0001,reconstruct=12,Xpay	64	1	1	216	1	1	3277	# 777.93 Gflop/s, 0.00 GB/s, tuned Wed Feb  6 15:00:24 2013
24x24x24x12	N4quda17TwistedDslashCudaI7double2S1_EE	type=exterior_t,comm=0001,reconstruct=8	32	1	1	432	1	1	2341	# 798.24 Gflop/s, 0.00 GB/s, tuned Fri Jan  4 18:03:55 2013
24x24x24x12	N4quda17TwistedDslashCudaI7double2S1_EE	type=exterior_t,comm=0001,reconstruct=8,Xpay	32	1	1	432	1	1	2341	# 687.32 Gflop/s, 0.00 GB/s, tuned Fri Jan  4 18:03:56 2013
24x24x24x12	N4quda17TwistedDslashCudaI7double2S1_EE	type=interior,comm=0001,ghost=0001,reconstruct=12	32	1	1	2592	1	1	2341	# 56.51 Gflop/s, 0.00 GB/s, tuned Wed Feb  6 15:00:23 2013
24x24x24x12	N4quda17TwistedDslashCudaI7double2S1_EE	type=interior,comm=0001,ghost=0001,reconstruct=12,Xpay	32	1	1	2592	1	1	2341	# 53.46 Gflop/s, 0.00 GB/s, tuned Wed Feb  6 15:00:24 2013
24x24x24x12	N4quda17TwistedDslashCudaI7double2S1_EE	type=interior,comm=0001,ghost=0001,reconstruct=8	32	1	1	2592	1	1	2049	# 34.40 Gflop/s, 0.00 GB/s, tuned Fri Jan  4 18:03:55 2013
24x24x24x12	N4quda17TwistedDslashCudaI7double2S1_EE	type=interior,comm=0001,ghost=0001,reconstruct=8,Xpay	32	1	1	2592	1	1	2049	# 34.10 Gflop/s, 0.00 GB/s, tuned Fri Jan  4 18:03:56 2013
24x24x24x24	N4quda15TwistGamma5CudaI6float4EE	128	1	1	1	1	1	5462	2049	# 34.10 Gflop/s, 0.00 GB/s, tuned Fri Jan  4 18:03:56 2013
24x24x24x24	N4quda15TwistGamma5CudaI6float4EE	224	1	1	1	1	1	5462	2049	# 34.10 Gflop/s, 0.00 GB/s, tuned Fri Jan  4 18:03:56 2013
24x24x24x24	N4quda15TwistGamma5CudaI6float4EE	256	1	1	1	1	1	8193	2049	# 34.10 Gflop/s, 0.00 GB/s, tuned Fri Jan  4 18:03:56 2013
24x24x24x24	N4quda15TwistGamma5CudaI6float4EE	288	1	1	1	1	1	8193	0	# 0.00 Gflop/s, 88.05 GB/s, tuned Fri Jan  4 17:45:03 2013
24x24x24x24	N4quda15TwistGamma5CudaI6float4EE	320	1	1	1	1	1	8193	2049	# 34.10 Gflop/s, 0.00 GB/s, tuned Fri Jan  4 18:03:56 2013
24x24x24x24	N4quda15TwistGamma5CudaI6float4EE	352	1	1	1	1	1	8193	2049	# 34.10 Gflop/s, 0.00 GB/s, tuned Fri Jan  4 18:03:56 2013
24x24x24x24	N4quda15TwistGamma5CudaI6float4EE	384	1	1	1	1	1	8193	2049	# 34.10 Gflop/s, 0.00 GB/s, tuned Fri Jan  4 18:03:56 2013
24x24x24x24	N4quda15TwistGamma5CudaI6float4EE	416	1	1	1	1	1	3277	2049	# 34.10 Gflop/s, 0.00 GB/s, tuned Fri Jan  4 18:03:56 2013
24x24x24x24	N4quda15TwistGamma5CudaI6float4EE	448	1	1	1	1	1	0	2049	# 34.10 Gflop/s, 0.00 GB/s, tuned Fri Jan  4 18:03:56 2013
24x24x24x24	N4quda15TwistGamma5CudaI6float4EE	480	1	1	1	1	1	3277	2049	# 34.10 Gflop/s, 0.00 GB/s, tuned Fri Jan  4 18:03:56 2013
24x24x24x24	N4quda15TwistGamma5CudaI6float4EE	512	1	1	1	1	1	2341	2049	# 34.10 Gflop/s, 0.00 GB/s, tuned Fri Jan  4 18:03:56 2013
24x24x24x24	N4quda15TwistGamma5CudaI6float4EE	544	1	1	1	1	1	8193	2049	# 34.10 Gflop/s, 0.00 GB/s, tuned Fri Jan  4 18:03:56 2013
24x24x24x24	N4quda15TwistGamma5CudaI6float4EE	576	1	1	1	1	1	0	2049	# 34.10 Gflop/s, 0.00 GB/s, tuned Fri Jan  4 18:03:56 2013
24x24x24x24	N4quda15TwistGamma5CudaI6float4EE	608	1	1	1	1	1	5462	2049	# 34.10 Gflop/s, 0.00 GB/s, tuned Fri Jan  4 18:03:56 2013
24x24x24x24	N4quda15TwistGamma5CudaI6float4EE	64	1	1	1	1	1	2341	2049	# 34.10 Gflop/s, 0.00 GB/s, tuned Fri Jan  4 18:03:56 2013
24x24x24x24	N4quda15TwistGamma5CudaI7double2EE	192	1	1	1	1	1	3277	2049	# 34.10 Gflop/s, 0.00 GB/s, tuned Fri Jan  4 18:03:56 2013
24x24x24x24	N4quda15TwistGamma5CudaI7double2EE	256	1	1	1	1	1	8193	2049	# 34.10 Gflop/s, 0.00 GB/s, tuned Fri Jan  4 18:03:56 2013
24x24x24x24	N4quda15TwistGamma5CudaI7double2EE	288	1	1	1	1	1	0	2049	# 34.10 Gflop/s, 0.00 GB/s, tuned Fri Jan  4 18:03:56 2013
24x24x24x24	N4quda15TwistGamma5CudaI7double2EE	320	1	1	1	1	1	2341	2049	# 34.10 Gflop/s, 0.00 GB/s, tuned Fri Jan  4 18:03:56 2013
24x24x24x24	N4quda15TwistGamma5CudaI7double2EE	384	1	1	1	1	1	2049	2049	# 34.10 Gflop/s, 0.00 GB/s, tuned Fri Jan  4 18:03:56 2013
24x24x24x24	N4quda15TwistGamma5CudaI7double2EE	416	1	1	1	1	1	2731	2049	# 34.10 Gflop/s, 0.00 GB/s, tuned Fri Jan  4 18:03:56 2013
24x24x24x24	N4quda15TwistGamma5CudaI7double2EE	448	1	1	1	1	1	0	0	# 0.00 Gflop/s, 88.05 GB/s, tuned Fri Jan  4 17:45:03 2013
24x24x24x24	N4quda15TwistGamma5CudaI7double2EE	480	1	1	1	1	1	3277	2049	# 34.10 Gflop/s, 0.00 GB/s, tuned Fri Jan  4 18:03:56 2013
24x24x24x24	N4quda15TwistGamma5CudaI7double2EE	512	1	1	1	1	1	5462	2049	# 34.10 Gflop/s, 0.00 GB/s, tuned Fri Jan  4 18:03:56 2013
24x24x24x24	N4quda16WilsonDslashCudaI6float4S1_EE	type=exterior_t,comm=0001,reconstruct=12	512	1	1	27	1	1	4097	# 3661.25 Gflop/s, 0.00 GB/s, tuned Mon Jan 28 19:02:39 2013
24x24x24x24	N4quda16WilsonDslashCudaI6float4S1_EE	type=exterior_t,comm=0001,reconstruct=12,Xpay	512	1	1	27	1	1	3277	# 2918.40 Gflop/s, 0.00 GB/s, tuned Tue Jan 29 10:09:29 2013
24x24x24x24	N4quda16WilsonDslashCudaI6float4S1_EE	type=exterior_t,comm=0001,reconstruct=8	256	1	1	54	1	1	2049	# 3678.97 Gflop/s, 0.00 GB/s, tuned Fri Jan  4 18:00:13 2013
24x24x24x24	N4quda16WilsonDslashCudaI6float4S1_EE	type=exterior_t,comm=0001,reconstruct=8,Xpay	512	1	1	27	1	1	3277	# 2895.76 Gflop/s, 0.00 GB/s, tuned Thu Feb 14 14:13:34 2013
24x24x24x24	N4quda16WilsonDslashCudaI6float4S1_EE	type=interior,comm=0001,ghost=0001,reconstruct=12	96	1	1	1728	1	1	4097	# 145.95 Gflop/s, 0.00 GB/s, tuned Mon Jan 28 19:02:39 2013
24x24x24x24	N4quda16WilsonDslashCudaI6float4S1_EE	type=interior,comm=0001,ghost=0001,reconstruct=12,Xpay	64	1	1	2592	1	1	3277	# 136.20 Gflop/s, 0.00 GB/s, tuned Tue Jan 29 10:09:29 2013
24x24x24x24	N4quda16WilsonDslashCudaI6float4S1_EE	type=interior,comm=0001,ghost=0001,reconstruct=8	64	1	1	2592	1	1	2731	# 165.72 Gflop/s, 0.00 GB/s, tuned Fri Jan  4 18:00:13 2013
24x24x24x24	N4quda16WilsonDslashCudaI6float4S1_EE	type=interior,comm=0001,ghost=0001,reconstruct=8,Xpay	64	1	1	2592	1	1	2731	# 154.51 Gflop/s, 0.00 GB/s, tuned Thu Feb 14 14:13:34 2013
24x24x24x24	N4quda16WilsonDslashCudaI7double2S1_EE	type=exterior_t,comm=0001,reconstruct=12	256	1	1	54	1	1	8193	# 1978.85 Gflop/s, 0.00 GB/s, tuned Mon Jan 28 19:02:36 2013
24x24x24x24	N4quda16WilsonDslashCudaI7double2S1_EE	type=exterior_t,comm=0001,reconstruct=12,Xpay	256	1	1	54	1	1	8193	# 1578.74 Gflop/s, 0.00 GB/s, tuned Mon Jan 28 19:02:35 2013
24x24x24x24	N4quda16WilsonDslashCudaI7double2S1_EE	type=exterior_t,comm=0001,reconstruct=8	32	1	1	432	1	1	2341	# 1720.18 Gflop/s, 0.00 GB/s, tuned Fri Jan  4 17:59:48 2013
24x24x24x24	N4quda16WilsonDslashCudaI7double2S1_EE	type=exterior_t,comm=0001,reconstruct=8,Xpay	64	1	1	216	1	1	4097	# 1342.62 Gflop/s, 0.00 GB/s, tuned Fri Jan  4 17:59:43 2013
24x24x24x24	N4quda16WilsonDslashCudaI7double2S1_EE	type=interior,comm=0001,ghost=0001,reconstruct=12	32	1	1	5184	1	1	2341	# 58.19 Gflop/s, 0.00 GB/s, tuned Mon Jan 28 19:02:36 2013
24x24x24x24	N4quda16WilsonDslashCudaI7double2S1_EE	type=interior,comm=0001,ghost=0001,reconstruct=12,Xpay	32	1	1	5184	1	1	2341	# 53.16 Gflop/s, 0.00 GB/s, tuned Mon Jan 28 19:02:35 2013
24x24x24x24	N4quda16WilsonDslashCudaI7double2S1_EE	type=interior,comm=0001,ghost=0001,reconstruct=8	32	1	1	5184	1	1	2049	# 34.74 Gflop/s, 0.00 GB/s, tuned Fri Jan  4 17:59:48 2013
24x24x24x24	N4quda16WilsonDslashCudaI7double2S1_EE	type=interior,comm=0001,ghost=0001,reconstruct=8,Xpay	32	1	1	5184	1	1	2049	# 31.51 Gflop/s, 0.00 GB/s, tuned Fri Jan  4 17:59:43 2013
24x24x24x24	N4quda17TwistedDslashCudaI6float4S1_EE	type=exterior_t,comm=0001,reconstruct=12	512	1	1	27	1	1	2341	# 3822.10 Gflop/s, 0.00 GB/s, tuned Mon Jan 28 19:02:39 2013
24x24x24x24	N4quda17TwistedDslashCudaI6float4S1_EE	type=exterior_t,comm=0001,reconstruct=12,Xpay	512	1	1	27	1	1	4097	# 3085.56 Gflop/s, 0.00 GB/s, tuned Mon Jan 28 19:02:39 2013
24x24x24x24	N4quda17TwistedDslashCudaI6float4S1_EE	type=exterior_t,comm=0001,reconstruct=8	512	1	1	27	1	1	5462	# 3727.34 Gflop/s, 0.00 GB/s, tuned Fri Jan  4 18:00:13 2013
24x24x24x24	N4quda17TwistedDslashCudaI6float4S1_EE	type=exterior_t,comm=0001,reconstruct=8,Xpay	512	1	1	27	1	1	2049	# 3107.77 Gflop/s, 0.00 GB/s, tuned Fri Jan  4 18:00:13 2013
24x24x24x24	N4quda17TwistedDslashCudaI6float4S1_EE	type=interior,comm=0001,ghost=0001,reconstruct=12	64	1	1	2592	1	1	3277	# 150.48 Gflop/s, 0.00 GB/s, tuned Mon Jan 28 19:02:39 2013
24x24x24x24	N4quda17TwistedDslashCudaI6float4S1_EE	type=interior,comm=0001,ghost=0001,reconstruct=12,Xpay	64	1	1	2592	1	1	3277	# 140.42 Gflop/s, 0.00 GB/s, tuned Mon Jan 28 19:02:39 2013
24x24x24x24	N4quda17TwistedDslashCudaI6float4S1_EE	type=interior,comm=0001,ghost=0001,reconstruct=8	64	1	1	2592	1	1	2731	# 172.07 Gflop/s, 0.00 GB/s, tuned Fri Jan  4 18:00:12 2013
24x24x24x24	N4quda17TwistedDslashCudaI6float4S1_EE	type=interior,comm=0001,ghost=0001,reconstruct=8,Xpay	64	1	1	2592	1	1	2731	# 155.71 Gflop/s, 0.00 GB/s, tuned Fri Jan  4 18:00:13 2013
24x24x24x24	N4quda17TwistedDslashCudaI7double2S1_EE	type=exterior_t,comm=0001,reconstruct=12	128	1	1	108	1	1	5462	# 1975.94 Gflop/s, 0.00 GB/s, tuned Mon Jan 28 19:02:37 2013
24x24x24x24	N4quda17TwistedDslashCudaI7double2S1_EE	type=exterior_t,comm=0001,reconstruct=12,Xpay	64	1	1	216	1	1	3277	# 1571.18 Gflop/s, 0.00 GB/s, tuned Mon Jan 28 19:02:38 2013
24x24x24x24	N4quda17TwistedDslashCudaI7double2S1_EE	type=exterior_t,comm=0001,reconstruct=8	64	1	1	216	1	1	3277	# 1590.16 Gflop/s, 0.00 GB/s, tuned Fri Jan  4 17:59:58 2013
24x24x24x24	N4quda17TwistedDslashCudaI7double2S1_EE	type=exterior_t,comm=0001,reconstruct=8,Xpay	32	1	1	432	1	1	2341	# 1380.58 Gflop/s, 0.00 GB/s, tuned Fri Jan  4 18:00:00 2013
24x24x24x24	N4quda17TwistedDslashCudaI7double2S1_EE	type=interior,comm=0001,ghost=0001,reconstruct=12	32	1	1	5184	1	1	2341	# 57.25 Gflop/s, 0.00 GB/s, tuned Mon Jan 28 19:02:37 2013
24x24x24x24	N4quda17TwistedDslashCudaI7double2S1_EE	type=interior,comm=0001,ghost=0001,reconstruct=12,Xpay	32	1	1	5184	1	1	2341	# 54.10 Gflop/s, 0.00 GB/s, tuned Mon Jan 28 19:02:38 2013
24x24x24x24	N4quda17TwistedDslashCudaI7double2S1_EE	type=interior,comm=0001,ghost=0001,reconstruct=8	96	1	1	1728	1	1	4097	# 33.42 Gflop/s, 0.00 GB/s, tuned Fri Jan  4 17:59:58 2013
24x24x24x24	N4quda17TwistedDslashCudaI7double2S1_EE	type=interior,comm=0001,ghost=0001,reconstruct=8,Xpay	32	1	1	5184	1	1	2049	# 33.32 Gflop/s, 0.00 GB/s, tuned Fri Jan  4 18:00:00 2013
24x24x24x3	N4quda15TwistGamma5CudaI6float4EE	512	1	1	1	1	1	2049	2049	# 33.32 Gflop/s, 0.00 GB/s, tuned Fri Jan  4 18:00:00 2013
24x24x24x3	N4quda15TwistGamma5CudaI7double2EE	512	1	1	1	1	1	4097	2049	# 33.32 Gflop/s, 0.00 GB/s, tuned Fri Jan  4 18:00:00 2013
24x24x24x3	N4quda16WilsonDslashCudaI6float4S1_EE	type=exterior_t,comm=0001,reconstruct=8	256	1	1	54	1	1	5462	# 456.68 Gflop/s, 0.00 GB/s, tuned Fri Jan  4 18:15:06 2013
24x24x24x3	N4quda16WilsonDslashCudaI6float4S1_EE	type=interior,comm=0001,ghost=0001,reconstruct=8	96	1	1	216	1	1	3277	# 146.92 Gflop/s, 0.00 GB/s, tuned Fri Jan  4 18:15:06 2013
24x24x24x3	N4quda16WilsonDslashCudaI7double2S1_EE	type=exterior_t,comm=0001,reconstruct=8	64	1	1	216	1	1	4097	# 210.73 Gflop/s, 0.00 GB/s, tuned Fri Jan  4 18:15:02 2013
24x24x24x3	N4quda16WilsonDslashCudaI7double2S1_EE	type=exterior_t,comm=0001,reconstruct=8,Xpay	32	1	1	432	1	1	2341	# 169.30 Gflop/s, 0.00 GB/s, tuned Fri Jan  4 18:15:01 2013
24x24x24x3	N4quda16WilsonDslashCudaI7double2S1_EE	type=interior,comm=0001,ghost=0001,reconstruct=8	32	1	1	648	1	1	2341	# 37.44 Gflop/s, 0.00 GB/s, tuned Fri Jan  4 18:15:02 2013
24x24x24x3	N4quda16WilsonDslashCudaI7double2S1_EE	type=interior,comm=0001,ghost=0001,reconstruct=8,Xpay	32	1	1	648	1	1	2049	# 37.11 Gflop/s, 0.00 GB/s, tuned Fri Jan  4 18:15:01 2013
24x24x24x3	N4quda17TwistedDslashCudaI6float4S1_EE	type=exterior_t,comm=0001,reconstruct=8	256	1	1	54	1	1	2731	# 464.72 Gflop/s, 0.00 GB/s, tuned Fri Jan  4 18:15:06 2013
24x24x24x3	N4quda17TwistedDslashCudaI6float4S1_EE	type=exterior_t,comm=0001,reconstruct=8,Xpay	128	1	1	108	1	1	2049	# 381.68 Gflop/s, 0.00 GB/s, tuned Fri Jan  4 18:15:06 2013
24x24x24x3	N4quda17TwistedDslashCudaI6float4S1_EE	type=interior,comm=0001,ghost=0001,reconstruct=8	384	1	1	54	1	1	5462	# 150.64 Gflop/s, 0.00 GB/s, tuned Fri Jan  4 18:15:06 2013
24x24x24x3	N4quda17TwistedDslashCudaI6float4S1_EE	type=interior,comm=0001,ghost=0001,reconstruct=8,Xpay	384	1	1	54	1	1	3277	# 149.42 Gflop/s, 0.00 GB/s, tuned Fri Jan  4 18:15:06 2013
24x24x24x3	N4quda17TwistedDslashCudaI7double2S1_EE	type=exterior_t,comm=0001,reconstruct=8	64	1	1	216	1	1	3277	# 200.09 Gflop/s, 0.00 GB/s, tuned Fri Jan  4 18:15:03 2013
24x24x24x3	N4quda17TwistedDslashCudaI7double2S1_EE	type=exterior_t,comm=0001,reconstruct=8,Xpay	32	1	1	432	1	1	2341	# 171.57 Gflop/s, 0.00 GB/s, tuned Fri Jan  4 18:15:04 2013
24x24x24x3	N4quda17TwistedDslashCudaI7double2S1_EE	type=interior,comm=0001,ghost=0001,reconstruct=8	32	1	1	648	1	1	2049	# 37.60 Gflop/s, 0.00 GB/s, tuned Fri Jan  4 18:15:03 2013
24x24x24x3	N4quda17TwistedDslashCudaI7double2S1_EE	type=interior,comm=0001,ghost=0001,reconstruct=8,Xpay	32	1	1	648	1	1	2049	# 39.01 Gflop/s, 0.00 GB/s, tuned Fri Jan  4 18:15:03 2013
24x24x24x4	N4quda15TwistGamma5CudaI6float4EE	512	1	1	1	1	1	2341	2049	# 39.01 Gflop/s, 0.00 GB/s, tuned Fri Jan  4 18:15:03 2013
24x24x24x4	N4quda15TwistGamma5CudaI7double2EE	448	1	1	1	1	1	3277	2049	# 39.01 Gflop/s, 0.00 GB/s, tuned Fri Jan  4 18:15:03 2013
24x24x24x4	N4quda15TwistGamma5CudaI7double2EE	480	1	1	1	1	1	4097	2049	# 39.01 Gflop/s, 0.00 GB/s, tuned Fri Jan  4 18:15:03 2013
24x24x24x4	N4quda16WilsonDslashCudaI6float4S1_EE	type=exterior_t,comm=0001,reconstruct=8	256	1	1	54	1	1	2341	# 602.79 Gflop/s, 0.00 GB/s, tuned Fri Jan  4 18:32:21 2013
24x24x24x4	N4quda16WilsonDslashCudaI6float4S1_EE	type=interior,comm=0001,ghost=0001,reconstruct=8	416	1	1	67	1	1	2049	# 148.83 Gflop/s, 0.00 GB/s, tuned Fri Jan  4 18:32:21 2013
24x24x24x4	N4quda16WilsonDslashCudaI7double2S1_EE	type=exterior_t,comm=0001,reconstruct=8	32	1	1	432	1	1	2341	# 282.30 Gflop/s, 0.00 GB/s, tuned Fri Jan  4 18:32:16 2013
24x24x24x4	N4quda16WilsonDslashCudaI7double2S1_EE	type=exterior_t,comm=0001,reconstruct=8,Xpay	64	1	1	216	1	1	3277	# 220.31 Gflop/s, 0.00 GB/s, tuned Fri Jan  4 18:32:15 2013
24x24x24x4	N4quda16WilsonDslashCudaI7double2S1_EE	type=interior,comm=0001,ghost=0001,reconstruct=8	32	1	1	864	1	1	2049	# 37.06 Gflop/s, 0.00 GB/s, tuned Fri Jan  4 18:32:16 2013
24x24x24x4	N4quda16WilsonDslashCudaI7double2S1_EE	type=interior,comm=0001,ghost=0001,reconstruct=8,Xpay	32	1	1	864	1	1	2049	# 35.37 Gflop/s, 0.00 GB/s, tuned Fri Jan  4 18:32:15 2013
24x24x24x4	N4quda17TwistedDslashCudaI6float4S1_EE	type=exterior_t,comm=0001,reconstruct=8	512	1	1	27	1	1	2731	# 620.58 Gflop/s, 0.00 GB/s, tuned Fri Jan  4 18:32:21 2013
24x24x24x4	N4quda17TwistedDslashCudaI6float4S1_EE	type=exterior_t,comm=0001,reconstruct=8,Xpay	512	1	1	27	1	1	2049	# 511.89 Gflop/s, 0.00 GB/s, tuned Fri Jan  4 18:32:21 2013
24x24x24x4	N4quda17TwistedDslashCudaI6float4S1_EE	type=interior,comm=0001,ghost=0001,reconstruct=8	416	1	1	67	1	1	8193	# 152.80 Gflop/s, 0.00 GB/s, tuned Fri Jan  4 18:32:21 2013
24x24x24x4	N4quda17TwistedDslashCudaI6float4S1_EE	type=interior,comm=0001,ghost=0001,reconstruct=8,Xpay	416	1	1	67	1	1	2731	# 146.24 Gflop/s, 0.00 GB/s, tuned Fri Jan  4 18:32:21 2013
24x24x24x4	N4quda17TwistedDslashCudaI7double2S1_EE	type=exterior_t,comm=0001,reconstruct=8	32	1	1	432	1	1	2341	# 273.90 Gflop/s, 0.00 GB/s, tuned Fri Jan  4 18:32:18 2013
24x24x24x4	N4quda17TwistedDslashCudaI7double2S1_EE	type=exterior_t,comm=0001,reconstruct=8,Xpay	32	1	1	432	1	1	2049	# 227.02 Gflop/s, 0.00 GB/s, tuned Fri Jan  4 18:32:18 2013
24x24x24x4	N4quda17TwistedDslashCudaI7double2S1_EE	type=interior,comm=0001,ghost=0001,reconstruct=8	32	1	1	864	1	1	2049	# 37.54 Gflop/s, 0.00 GB/s, tuned Fri Jan  4 18:32:18 2013
24x24x24x4	N4quda17TwistedDslashCudaI7double2S1_EE	type=interior,comm=0001,ghost=0001,reconstruct=8,Xpay	32	1	1	864	1	1	2049	# 37.95 Gflop/s, 0.00 GB/s, tuned Fri Jan  4 18:32:18 2013
24x24x24x48	N4quda15TwistGamma5CudaI6float4EE	128	1	1	1	1	1	5462	0	# 0.00 Gflop/s, 88.61 GB/s, tuned Thu Jan  3 12:23:12 2013
24x24x24x48	N4quda15TwistGamma5CudaI6float4EE	160	1	1	1	1	1	5462	0	# 0.00 Gflop/s, 88.61 GB/s, tuned Thu Jan  3 12:23:12 2013
24x24x24x48	N4quda15TwistGamma5CudaI6float4EE	256	1	1	1	1	1	8193	2049	# 37.95 Gflop/s, 0.00 GB/s, tuned Fri Jan  4 18:32:18 2013
24x24x24x48	N4quda15TwistGamma5CudaI6float4EE	288	1	1	1	1	1	8193	0	# 0.00 Gflop/s, 88.61 GB/s, tuned Thu Jan  3 12:23:12 2013
24x24x24x48	N4quda15TwistGamma5CudaI6float4EE	320	1	1	1	1	1	8193	0	# 0.00 Gflop/s, 88.61 GB/s, tuned Thu Jan  3 12:23:12 2013
24x24x24x48	N4quda15TwistGamma5CudaI6float4EE	64	1	1	1	1	1	2731	0	# 0.00 Gflop/s, 88.61 GB/s, tuned Thu Jan  3 12:23:12 2013
24x24x24x48	N4quda15TwistGamma5CudaI6float4EE	96	1	1	1	1	1	5462	0	# 0.00 Gflop/s, 88.61 GB/s, tuned Thu Jan  3 12:23:12 2013
24x24x24x48	N4quda15TwistGamma5CudaI7double2EE	256	1	1	1	1	1	8193	0	# 0.00 Gflop/s, 88.61 GB/s, tuned Thu Jan  3 12:23:12 2013
24x24x24x48	N4quda15TwistGamma5CudaI7double2EE	288	1	1	1	1	1	2341	0	# 0.00 Gflop/s, 88.61 GB/s, tuned Thu Jan  3 12:23:12 2013
24x24x24x48	N4quda15TwistGamma5CudaI7double2EE	320	1	1	1	1	1	2731	0	# 0.00 Gflop/s, 88.61 GB/s, tuned Thu Jan  3 12:23:12 2013
24x24x24x48	N4quda15TwistGamma5CudaI7double2EE	352	1	1	1	1	1	2341	0	# 0.00 Gflop/s, 88.61 GB/s, tuned Thu Jan  3 12:23:12 2013
24x24x24x48	N4quda15TwistGamma5CudaI7double2EE	384	1	1	1	1	1	4097	0	# 0.00 Gflop/s, 88.61 GB/s, tuned Thu Jan  3 12:23:12 2013
24x24x24x48	N4quda15TwistGamma5CudaI7double2EE	448	1	1	1	1	1	2731	0	# 0.00 Gflop/s, 88.61 GB/s, tuned Thu Jan  3 12:23:12 2013
24x24x24x48	N4quda15TwistGamma5CudaI7double2EE	512	1	1	1	1	1	4097	0	# 0.00 Gflop/s, 88.61 GB/s, tuned Thu Jan  3 12:23:12 2013
24x24x24x48	N4quda16WilsonDslashCudaI6float4S1_EE	type=interior,comm=0000,ghost=0000,reconstruct=12	96	1	1	3456	1	1	4097	# 146.45 Gflop/s, 0.00 GB/s, tuned Thu Jan  3 12:22:13 2013
24x24x24x48	N4quda16WilsonDslashCudaI6float4S1_EE	type=interior,comm=0000,ghost=0000,reconstruct=12,Xpay	128	1	1	2592	1	1	5462	# 133.66 Gflop/s, 0.00 GB/s, tuned Thu Jan  3 16:46:14 2013
24x24x24x48	N4quda16WilsonDslashCudaI6float4S1_EE	type=interior,comm=0000,ghost=0000,reconstruct=18,Xpay	96	1	1	3456	1	1	4097	# 99.89 Gflop/s, 0.00 GB/s, tuned Thu Jan  3 19:10:13 2013
24x24x24x48	N4quda16WilsonDslashCudaI6float4S1_EE	type=interior,comm=0000,ghost=0000,reconstruct=8	64	1	1	5184	1	1	2731	# 168.16 Gflop/s, 0.00 GB/s, tuned Fri Jan  4 17:56:01 2013
24x24x24x48	N4quda16WilsonDslashCudaI6float4S1_EE	type=interior,comm=0000,ghost=0000,reconstruct=8,Xpay	64	1	1	5184	1	1	2731	# 152.32 Gflop/s, 0.00 GB/s, tuned Thu Jan  3 19:04:13 2013
24x24x24x48	N4quda16WilsonDslashCudaI7double2S1_EE	type=interior,comm=0000,ghost=0000,reconstruct=12	32	1	1	10368	1	1	2341	# 57.48 Gflop/s, 0.00 GB/s, tuned Thu Jan  3 12:21:23 2013
24x24x24x48	N4quda16WilsonDslashCudaI7double2S1_EE	type=interior,comm=0000,ghost=0000,reconstruct=12,Xpay	32	1	1	10368	1	1	2341	# 51.84 Gflop/s, 0.00 GB/s, tuned Thu Jan  3 12:21:14 2013
24x24x24x48	N4quda16WilsonDslashCudaI7double2S1_EE	type=interior,comm=0000,ghost=0000,reconstruct=18,Xpay	32	1	1	10368	1	1	2341	# 42.49 Gflop/s, 0.00 GB/s, tuned Thu Jan  3 19:10:12 2013
24x24x24x48	N4quda16WilsonDslashCudaI7double2S1_EE	type=interior,comm=0000,ghost=0000,reconstruct=8	32	1	1	10368	1	1	0	# 34.15 Gflop/s, 0.00 GB/s, tuned Fri Jan  4 17:55:55 2013
24x24x24x48	N4quda16WilsonDslashCudaI7double2S1_EE	type=interior,comm=0000,ghost=0000,reconstruct=8,Xpay	32	1	1	10368	1	1	2049	# 30.78 Gflop/s, 0.00 GB/s, tuned Thu Jan  3 19:04:13 2013
24x24x24x48	N4quda17TwistedDslashCudaI6float4S1_EE	type=interior,comm=0000,ghost=0000,reconstruct=12	96	1	1	3456	1	1	4097	# 152.46 Gflop/s, 0.00 GB/s, tuned Thu Jan  3 12:22:11 2013
24x24x24x48	N4quda17TwistedDslashCudaI6float4S1_EE	type=interior,comm=0000,ghost=0000,reconstruct=12,Xpay	64	1	1	5184	1	1	3277	# 139.00 Gflop/s, 0.00 GB/s, tuned Thu Jan  3 12:22:12 2013
24x24x24x48	N4quda17TwistedDslashCudaI6float4S1_EE	type=interior,comm=0000,ghost=0000,reconstruct=8	64	1	1	5184	1	1	2731	# 174.53 Gflop/s, 0.00 GB/s, tuned Fri Jan  4 17:56:00 2013
24x24x24x48	N4quda17TwistedDslashCudaI6float4S1_EE	type=interior,comm=0000,ghost=0000,reconstruct=8,Xpay	64	1	1	5184	1	1	2731	# 156.61 Gflop/s, 0.00 GB/s, tuned Fri Jan  4 17:56:01 2013
24x24x24x48	N4quda17TwistedDslashCudaI7double2S1_EE	type=interior,comm=0000,ghost=0000,reconstruct=12	32	1	1	10368	1	1	2341	# 56.90 Gflop/s, 0.00 GB/s, tuned Thu Jan  3 12:21:44 2013
24x24x24x48	N4quda17TwistedDslashCudaI7double2S1_EE	type=interior,comm=0000,ghost=0000,reconstruct=12,Xpay	32	1	1	10368	1	1	2341	# 53.00 Gflop/s, 0.00 GB/s, tuned Thu Jan  3 12:21:46 2013
24x24x24x48	N4quda17TwistedDslashCudaI7double2S1_EE	type=interior,comm=0000,ghost=0000,reconstruct=8	96	1	1	3456	1	1	4097	# 33.22 Gflop/s, 0.00 GB/s, tuned Fri Jan  4 17:55:57 2013
24x24x24x48	N4quda17TwistedDslashCudaI7double2S1_EE	type=interior,comm=0000,ghost=0000,reconstruct=8,Xpay	96	1	1	3456	1	1	4097	# 32.48 Gflop/s, 0.00 GB/s, tuned Fri Jan  4 17:56:00 2013
24x24x24x6	N4quda15TwistGamma5CudaI6float4EE	480	1	1	1	1	1	4097	4097	# 32.48 Gflop/s, 0.00 GB/s, tuned Fri Jan  4 17:56:00 2013
24x24x24x6	N4quda15TwistGamma5CudaI6float4EE	544	1	1	1	1	1	5462	4097	# 32.48 Gflop/s, 0.00 GB/s, tuned Fri Jan  4 17:56:00 2013
24x24x24x6	N4quda15TwistGamma5CudaI6float4EE	576	1	1	1	1	1	2341	4097	# 32.48 Gflop/s, 0.00 GB/s, tuned Fri Jan  4 17:56:00 2013
24x24x24x6	N4quda15TwistGamma5CudaI7double2EE	352	1	1	1	1	1	2731	4097	# 32.48 Gflop/s, 0.00 GB/s, tuned Fri Jan  4 17:56:00 2013
24x24x24x6	N4quda15TwistGamma5CudaI7double2EE	416	1	1	1	1	1	2049	4097	# 32.48 Gflop/s, 0.00 GB/s, tuned Fri Jan  4 17:56:00 2013
24x24x24x6	N4quda15TwistGamma5CudaI7double2EE	480	1	1	1	1	1	2341	4097	# 32.48 Gflop/s, 0.00 GB/s, tuned Fri Jan  4 17:56:00 2013
24x24x24x6	N4quda16WilsonDslashCudaI6float4S1_EE	type=exterior_t,comm=0001,reconstruct=12	512	1	1	27	1	1	2731	# 884.55 Gflop/s, 0.00 GB/s, tuned Wed Feb  6 15:38:11 2013
24x24x24x6	N4quda16WilsonDslashCudaI6float4S1_EE	type=exterior_t,comm=0001,reconstruct=8	512	1	1	27	1	1	8193	# 919.25 Gflop/s, 0.00 GB/s, tuned Fri Jan  4 18:21:57 2013
24x24x24x6	N4quda16WilsonDslashCudaI6float4S1_EE	type=interior,comm=0001,ghost=0001,reconstruct=12	96	1	1	432	1	1	4097	# 135.10 Gflop/s, 0.00 GB/s, tuned Wed Feb  6 15:38:11 2013
24x24x24x6	N4quda16WilsonDslashCudaI6float4S1_EE	type=interior,comm=0001,ghost=0001,reconstruct=8	96	1	1	432	1	1	3277	# 156.13 Gflop/s, 0.00 GB/s, tuned Fri Jan  4 18:21:57 2013
24x24x24x6	N4quda16WilsonDslashCudaI7double2S1_EE	type=exterior_t,comm=0001,reconstruct=12	256	1	1	54	1	1	8193	# 500.06 Gflop/s, 0.00 GB/s, tuned Wed Feb  6 15:38:10 2013
24x24x24x6	N4quda16WilsonDslashCudaI7double2S1_EE	type=exterior_t,comm=0001,reconstruct=12,Xpay	256	1	1	54	1	1	8193	# 384.33 Gflop/s, 0.00 GB/s, tuned Wed Feb  6 15:38:09 2013
24x24x24x6	N4quda16WilsonDslashCudaI7double2S1_EE	type=exterior_t,comm=0001,reconstruct=8	32	1	1	432	1	1	2341	# 424.50 Gflop/s, 0.00 GB/s, tuned Fri Jan  4 18:21:50 2013
24x24x24x6	N4quda16WilsonDslashCudaI7double2S1_EE	type=exterior_t,comm=0001,reconstruct=8,Xpay	64	1	1	216	1	1	3277	# 331.02 Gflop/s, 0.00 GB/s, tuned Fri Jan  4 18:21:48 2013
24x24x24x6	N4quda16WilsonDslashCudaI7double2S1_EE	type=interior,comm=0001,ghost=0001,reconstruct=12	64	1	1	648	1	1	4097	# 55.96 Gflop/s, 0.00 GB/s, tuned Wed Feb  6 15:38:10 2013
24x24x24x6	N4quda16WilsonDslashCudaI7double2S1_EE	type=interior,comm=0001,ghost=0001,reconstruct=12,Xpay	32	1	1	1296	1	1	2341	# 52.61 Gflop/s, 0.00 GB/s, tuned Wed Feb  6 15:38:09 2013
24x24x24x6	N4quda16WilsonDslashCudaI7double2S1_EE	type=interior,comm=0001,ghost=0001,reconstruct=8	32	1	1	1296	1	1	2049	# 36.00 Gflop/s, 0.00 GB/s, tuned Fri Jan  4 18:21:50 2013
24x24x24x6	N4quda16WilsonDslashCudaI7double2S1_EE	type=interior,comm=0001,ghost=0001,reconstruct=8,Xpay	32	1	1	1296	1	1	2049	# 33.66 Gflop/s, 0.00 GB/s, tuned Fri Jan  4 18:21:48 2013
24x24x24x6	N4quda17TwistedDslashCudaI6float4S1_EE	type=exterior_t,comm=0001,reconstruct=12	512	1	1	27	1	1	3277	# 930.87 Gflop/s, 0.00 GB/s, tuned Wed Feb  6 15:38:10 2013
24x24x24x6	N4quda17TwistedDslashCudaI6float4S1_EE	type=exterior_t,comm=0001,reconstruct=12,Xpay	512	1	1	27	1	1	4097	# 745.69 Gflop/s, 0.00 GB/s, tuned Wed Feb  6 15:38:11 2013
24x24x24x6	N4quda17TwistedDslashCudaI6float4S1_EE	type=exterior_t,comm=0001,reconstruct=8	512	1	1	27	1	1	3277	# 937.65 Gflop/s, 0.00 GB/s, tuned Fri Jan  4 18:21:56 2013
24x24x24x6	N4quda17TwistedDslashCudaI6float4S1_EE	type=exterior_t,comm=0001,reconstruct=8,Xpay	512	1	1	27	1	1	0	# 764.00 Gflop/s, 0.00 GB/s, tuned Fri Jan  4 18:21:56 2013
24x24x24x6	N4quda17TwistedDslashCudaI6float4S1_EE	type=interior,comm=0001,ghost=0001,reconstruct=12	96	1	1	432	1	1	4097	# 141.87 Gflop/s, 0.00 GB/s, tuned Wed Feb  6 15:38:10 2013
24x24x24x6	N4quda17TwistedDslashCudaI6float4S1_EE	type=interior,comm=0001,ghost=0001,reconstruct=12,Xpay	64	1	1	648	1	1	3277	# 134.99 Gflop/s, 0.00 GB/s, tuned Wed Feb  6 15:38:11 2013
24x24x24x6	N4quda17TwistedDslashCudaI6float4S1_EE	type=interior,comm=0001,ghost=0001,reconstruct=8	96	1	1	432	1	1	3277	# 160.99 Gflop/s, 0.00 GB/s, tuned Fri Jan  4 18:21:56 2013
24x24x24x6	N4quda17TwistedDslashCudaI6float4S1_EE	type=interior,comm=0001,ghost=0001,reconstruct=8,Xpay	64	1	1	648	1	1	2731	# 150.22 Gflop/s, 0.00 GB/s, tuned Fri Jan  4 18:21:56 2013
24x24x24x6	N4quda17TwistedDslashCudaI7double2S1_EE	type=exterior_t,comm=0001,reconstruct=12	32	1	1	432	1	1	2341	# 481.97 Gflop/s, 0.00 GB/s, tuned Wed Feb  6 15:38:10 2013
24x24x24x6	N4quda17TwistedDslashCudaI7double2S1_EE	type=exterior_t,comm=0001,reconstruct=12,Xpay	64	1	1	216	1	1	3277	# 387.24 Gflop/s, 0.00 GB/s, tuned Wed Feb  6 15:38:10 2013
24x24x24x6	N4quda17TwistedDslashCudaI7double2S1_EE	type=exterior_t,comm=0001,reconstruct=8	32	1	1	432	1	1	2341	# 395.10 Gflop/s, 0.00 GB/s, tuned Fri Jan  4 18:21:52 2013
24x24x24x6	N4quda17TwistedDslashCudaI7double2S1_EE	type=exterior_t,comm=0001,reconstruct=8,Xpay	32	1	1	432	1	1	2341	# 348.03 Gflop/s, 0.00 GB/s, tuned Fri Jan  4 18:21:53 2013
24x24x24x6	N4quda17TwistedDslashCudaI7double2S1_EE	type=interior,comm=0001,ghost=0001,reconstruct=12	32	1	1	1296	1	1	2731	# 55.21 Gflop/s, 0.00 GB/s, tuned Wed Feb  6 15:38:10 2013
24x24x24x6	N4quda17TwistedDslashCudaI7double2S1_EE	type=interior,comm=0001,ghost=0001,reconstruct=12,Xpay	32	1	1	1296	1	1	2341	# 53.02 Gflop/s, 0.00 GB/s, tuned Wed Feb  6 15:38:10 2013
24x24x24x6	N4quda17TwistedDslashCudaI7double2S1_EE	type=interior,comm=0001,ghost=0001,reconstruct=8	32	1	1	1296	1	1	2049	# 35.14 Gflop/s, 0.00 GB/s, tuned Fri Jan  4 18:21:52 2013
24x24x24x6	N4quda17TwistedDslashCudaI7double2S1_EE	type=interior,comm=0001,ghost=0001,reconstruct=8,Xpay	32	1	1	1296	1	1	2049	# 35.16 Gflop/s, 0.00 GB/s, tuned Fri Jan  4 18:21:53 2013
24x48x48x12	N4quda11axpyCGNorm2I7double26float26float4EE	stride=663552,prec=4	352	1	1	12	1	1	5632	# 50.23 Gflop/s, 100.46 GB/s, tuned Wed Aug  6 18:32:06 2014
24x48x48x12	N4quda22HeavyQuarkResidualNormI7double37double2S2_EE	stride=663552,prec=8	320	1	1	224	1	1	7680	# 22.97 Gflop/s, 91.88 GB/s, tuned Wed Aug  6 18:39:20 2014
24x48x48x12	N4quda3DotId6float26float4EE	stride=663552,prec=4	64	1	1	96	1	1	512	# 24.21 Gflop/s, 96.82 GB/s, tuned Wed Aug  6 18:31:47 2014
24x48x48x12	N4quda3xpyI7double2S1_EE	stride=663552,prec=8	672	1	1	9	1	1	0	# 4.09 Gflop/s, 98.20 GB/s, tuned Wed Aug  6 18:33:53 2014
24x48x48x12	N4quda4axpyI6float26float4EE	stride=663552,prec=4	160	1	1	36	1	1	0	# 16.74 Gflop/s, 100.46 GB/s, tuned Wed Aug  6 18:32:58 2014
24x48x48x12	N4quda4xpayI6float26float4EE	stride=663552,prec=4	352	1	1	12	1	1	0	# 16.77 Gflop/s, 100.60 GB/s, tuned Wed Aug  6 18:31:34 2014
24x48x48x12	N4quda4xpayI7double2S1_EE	stride=663552,prec=8	96	1	1	48	1	1	0	# 8.21 Gflop/s, 98.55 GB/s, tuned Wed Aug  6 18:29:59 2014
24x48x48x12	N4quda5Norm2Id7double2S1_EE	stride=663552,prec=8	128	1	1	96	1	1	1024	# 24.42 Gflop/s, 97.68 GB/s, tuned Wed Aug  6 18:30:14 2014
24x48x48x12	N4quda8axpyZpbxI6float26float4EE	stride=663552,prec=4	64	1	1	36	1	1	0	# 38.77 Gflop/s, 96.93 GB/s, tuned Wed Aug  6 18:32:39 2014
24x48x48x12	N4quda8xmyNorm2Id7double2S1_EE	stride=663552,prec=8	352	1	1	12	1	1	2816	# 12.27 Gflop/s, 98.15 GB/s, tuned Wed Aug  6 18:31:00 2014
24x48x48x12	copyKernel	stride=663552,out_prec=4,in_prec=8	288	1	1	9	1	1	0	# 0.00 Gflop/s, 92.65 GB/s, tuned Wed Aug  6 18:31:12 2014
24x48x48x12	copyKernel	stride=663552,out_prec=8,in_prec=4	192	1	1	6	1	1	0	# 0.00 Gflop/s, 88.40 GB/s, tuned Wed Aug  6 18:33:15 2014
24x48x48x16	N4quda11axpyCGNorm2I7double26float26float4EE	stride=884736,prec=4	32	1	1	112	1	1	1024	# 48.19 Gflop/s, 96.38 GB/s, tuned Fri Aug  8 17:43:34 2014
24x48x48x16	N4quda22HeavyQuarkResidualNormI7double37double2S2_EE	stride=884736,prec=8	224	1	1	196	1	1	5376	# 22.92 Gflop/s, 91.69 GB/s, tuned Fri Aug  8 17:54:59 2014
24x48x48x16	N4quda3DotId6float26float4EE	stride=884736,prec=4	704	1	1	14	1	1	5632	# 24.15 Gflop/s, 96.60 GB/s, tuned Fri Aug  8 17:43:09 2014
24x48x48x16	N4quda3xpyI7double2S1_EE	stride=884736,prec=8	384	1	1	9	1	1	0	# 3.97 Gflop/s, 95.33 GB/s, tuned Fri Aug  8 17:45:58 2014
24x48x48x16	N4quda4axpyI6float26float4EE	stride=884736,prec=4	32	1	1	109	1	1	0	# 16.21 Gflop/s, 97.26 GB/s, tuned Fri Aug  8 17:44:45 2014
24x48x48x16	N4quda4xpayI6float26float4EE	stride=884736,prec=4	480	1	1	9	1	1	0	# 16.18 Gflop/s, 97.06 GB/s, tuned Fri Aug  8 17:42:52 2014
24x48x48x16	N4quda4xpayI7double2S1_EE	stride=884736,prec=8	128	1	1	32	1	1	0	# 7.90 Gflop/s, 94.86 GB/s, tuned Fri Aug  8 17:40:46 2014
24x48x48x16	N4quda5Norm2Id7double2S1_EE	stride=884736,prec=8	832	1	1	14	1	1	6656	# 24.55 Gflop/s, 98.20 GB/s, tuned Fri Aug  8 17:41:04 2014
24x48x48x16	N4quda8axpyZpbxI6float26float4EE	stride=884736,prec=4	288	1	1	8	1	1	0	# 38.69 Gflop/s, 96.73 GB/s, tuned Fri Aug  8 17:44:16 2014
24x48x48x16	N4quda8xmyNorm2Id7double2S1_EE	stride=884736,prec=8	416	1	1	9	1	1	3328	# 11.84 Gflop/s, 94.69 GB/s, tuned Fri Aug  8 17:42:06 2014
24x48x48x16	copyKernel	stride=884736,out_prec=4,in_prec=8	384	1	1	7	1	1	0	# 0.00 Gflop/s, 91.34 GB/s, tuned Fri Aug  8 17:42:22 2014
24x48x48x16	copyKernel	stride=884736,out_prec=8,in_prec=4	64	1	1	17	1	1	0	# 0.00 Gflop/s, 87.77 GB/s, tuned Fri Aug  8 17:45:07 2014
24x48x48x6	N4quda11axpyCGNorm2I7double26float26float4EE	stride=331776,prec=4	768	1	1	10	1	1	12288	# 48.62 Gflop/s, 97.24 GB/s, tuned Fri Jan  4 19:32:41 2013
24x48x48x6	N4quda22HeavyQuarkResidualNormI7double37double2S2_EE	stride=331776,prec=8	320	1	1	140	1	1	7680	# 22.70 Gflop/s, 90.81 GB/s, tuned Fri Jan  4 19:35:22 2013
24x48x48x6	N4quda3DotId6float26float4EE	stride=331776,prec=4	64	1	1	112	1	1	512	# 23.72 Gflop/s, 94.88 GB/s, tuned Fri Jan  4 19:32:32 2013
24x48x48x6	N4quda3xpyI7double2S1_EE	stride=331776,prec=8	416	1	1	9	1	1	0	# 4.03 Gflop/s, 96.65 GB/s, tuned Fri Jan  4 19:33:34 2013
24x48x48x6	N4quda4axpyI6float26float4EE	stride=331776,prec=4	32	1	1	112	1	1	0	# 16.62 Gflop/s, 99.72 GB/s, tuned Fri Jan  4 19:33:07 2013
24x48x48x6	N4quda4xpayI6float26float4EE	stride=331776,prec=4	32	1	1	112	1	1	0	# 16.58 Gflop/s, 99.48 GB/s, tuned Fri Jan  4 19:32:25 2013
24x48x48x6	N4quda4xpayI7double2S1_EE	stride=331776,prec=8	416	1	1	9	1	1	0	# 8.15 Gflop/s, 97.76 GB/s, tuned Fri Jan  4 19:31:44 2013
24x48x48x6	N4quda5Norm2Id7double2S1_EE	stride=331776,prec=8	128	1	1	112	1	1	1024	# 24.32 Gflop/s, 97.29 GB/s, tuned Fri Jan  4 19:31:23 2013
24x48x48x6	N4quda8axpyZpbxI6float26float4EE	stride=331776,prec=4	160	1	1	17	1	1	0	# 38.87 Gflop/s, 97.16 GB/s, tuned Fri Jan  4 19:32:57 2013
24x48x48x6	N4quda8xmyNorm2Id7double2S1_EE	stride=331776,prec=8	384	1	1	10	1	1	3072	# 12.00 Gflop/s, 96.01 GB/s, tuned Fri Jan  4 19:32:08 2013
24x48x48x6	copyKernel	stride=331776,out_prec=4,in_prec=8	512	1	1	8	1	1	0	# 0.00 Gflop/s, 92.06 GB/s, tuned Fri Jan  4 19:32:14 2013
24x48x48x6	copyKernel	stride=331776,out_prec=8,in_prec=4	640	1	1	252	1	1	0	# 0.00 Gflop/s, 88.81 GB/s, tuned Fri Jan  4 19:33:15 2013
27648	N4quda10PackSpinorIddLi4ELi3ENS_11FloatNOrderIdLi4ELi3ELi2EEENS_21SpaceSpinorColorOrderIdLi4ELi3EEENS_13PreserveBasisIddLi4ELi3EEEEE	out_stride=27648,in_stride=27648	64	1	1	432	1	1	12480	# 0.00 Gflop/s, 42.59 GB/s, tuned Fri Jan  4 18:32:14 2013
27648	N4quda10PackSpinorIddLi4ELi3ENS_21SpaceSpinorColorOrderIdLi4ELi3EEENS_11FloatNOrderIdLi4ELi3ELi2EEENS_13PreserveBasisIddLi4ELi3EEEEE	out_stride=27648,in_stride=27648	64	1	1	432	1	1	12480	# 0.00 Gflop/s, 20.48 GB/s, tuned Fri Jan  4 18:32:33 2013
32x32x32x16	N4quda15TwistGamma5CudaI7double2EE	192	1	1	1	1	1	8193	0	# 0.00 Gflop/s, 20.48 GB/s, tuned Fri Jan  4 18:32:33 2013
32x32x32x16	N4quda15TwistGamma5CudaI7double2EE	256	1	1	1	1	1	8193	0	# 0.00 Gflop/s, 20.48 GB/s, tuned Fri Jan  4 18:32:33 2013
32x32x32x16	N4quda15TwistGamma5CudaI7double2EE	288	1	1	1	1	1	0	0	# 0.00 Gflop/s, 20.48 GB/s, tuned Fri Jan  4 18:32:33 2013
32x32x32x16	N4quda15TwistGamma5CudaI7double2EE	320	1	1	1	1	1	2341	0	# 0.00 Gflop/s, 20.48 GB/s, tuned Fri Jan  4 18:32:33 2013
32x32x32x16	N4quda15TwistGamma5CudaI7double2EE	384	1	1	1	1	1	4097	0	# 0.00 Gflop/s, 20.48 GB/s, tuned Fri Jan  4 18:32:33 2013
32x32x32x16	N4quda15TwistGamma5CudaI7double2EE	448	1	1	1	1	1	2049	0	# 0.00 Gflop/s, 20.48 GB/s, tuned Fri Jan  4 18:32:33 2013
32x32x32x16	N4quda15TwistGamma5CudaI7double2EE	512	1	1	1	1	1	4097	0	# 0.00 Gflop/s, 20.48 GB/s, tuned Fri Jan  4 18:32:33 2013
32x32x32x16	N4quda16WilsonDslashCudaI7double2S1_EE	type=exterior_t,comm=0001,reconstruct=12	64	1	1	512	1	1	3277	# 1500.41 Gflop/s, 0.00 GB/s, tuned Fri Apr 17 15:49:24 2015
32x32x32x16	N4quda16WilsonDslashCudaI7double2S1_EE	type=exterior_t,comm=0001,reconstruct=12,Xpay	32	1	1	1024	1	1	2049	# 1152.36 Gflop/s, 0.00 GB/s, tuned Fri Apr 17 15:49:22 2015
32x32x32x16	N4quda16WilsonDslashCudaI7double2S1_EE	type=interior,comm=0001,ghost=0001,reconstruct=12	32	1	1	8192	1	1	2341	# 58.66 Gflop/s, 0.00 GB/s, tuned Fri Apr 17 15:49:24 2015
32x32x32x16	N4quda16WilsonDslashCudaI7double2S1_EE	type=interior,comm=0001,ghost=0001,reconstruct=12,Xpay	32	1	1	8192	1	1	2341	# 53.87 Gflop/s, 0.00 GB/s, tuned Fri Apr 17 15:49:22 2015
32x32x32x16	N4quda17TwistedDslashCudaI7double2S1_EE	type=exterior_t,comm=0001,reconstruct=12	32	1	1	1024	1	1	2341	# 1529.00 Gflop/s, 0.00 GB/s, tuned Fri Apr 17 15:49:46 2015
32x32x32x16	N4quda17TwistedDslashCudaI7double2S1_EE	type=exterior_t,comm=0001,reconstruct=12,Xpay	32	1	1	1024	1	1	2049	# 1168.99 Gflop/s, 0.00 GB/s, tuned Fri Apr 17 15:49:48 2015
32x32x32x16	N4quda17TwistedDslashCudaI7double2S1_EE	type=interior,comm=0001,ghost=0001,reconstruct=12	32	1	1	8192	1	1	2341	# 58.67 Gflop/s, 0.00 GB/s, tuned Fri Apr 17 15:49:46 2015
32x32x32x16	N4quda17TwistedDslashCudaI7double2S1_EE	type=interior,comm=0001,ghost=0001,reconstruct=12,Xpay	32	1	1	8192	1	1	2341	# 54.88 Gflop/s, 0.00 GB/s, tuned Fri Apr 17 15:49:48 2015
32x32x32x32	N4quda15TwistGamma5CudaI6float4EE	160	1	1	1	1	1	5462	12480	# 0.00 Gflop/s, 20.48 GB/s, tuned Fri Jan  4 18:32:33 2013
32x32x32x32	N4quda15TwistGamma5CudaI6float4EE	288	1	1	1	1	1	8193	12480	# 0.00 Gflop/s, 20.48 GB/s, tuned Fri Jan  4 18:32:33 2013
32x32x32x32	N4quda15TwistGamma5CudaI7double2EE	288	1	1	1	1	1	8193	12480	# 0.00 Gflop/s, 20.48 GB/s, tuned Fri Jan  4 18:32:33 2013
32x32x32x32	N4quda15TwistGamma5CudaI7double2EE	320	1	1	1	1	1	3277	12480	# 0.00 Gflop/s, 20.48 GB/s, tuned Fri Jan  4 18:32:33 2013
32x32x32x32	N4quda16WilsonDslashCudaI6float4S1_EE	type=exterior_t,comm=0001,reconstruct=8	480	1	1	69	1	1	2049	# 6041.03 Gflop/s, 0.00 GB/s, tuned Fri Jan  4 19:02:27 2013
32x32x32x32	N4quda16WilsonDslashCudaI6float4S1_EE	type=interior,comm=0001,ghost=0001,reconstruct=8	64	1	1	8192	1	1	2731	# 173.64 Gflop/s, 0.00 GB/s, tuned Fri Jan  4 19:02:27 2013
32x32x32x32	N4quda16WilsonDslashCudaI7double2S1_EE	type=exterior_t,comm=0001,reconstruct=8	32	1	1	1024	1	1	2341	# 2755.37 Gflop/s, 0.00 GB/s, tuned Fri Jan  4 19:01:08 2013
32x32x32x32	N4quda16WilsonDslashCudaI7double2S1_EE	type=exterior_t,comm=0001,reconstruct=8,Xpay	64	1	1	512	1	1	4097	# 2105.33 Gflop/s, 0.00 GB/s, tuned Fri Jan  4 19:00:53 2013
32x32x32x32	N4quda16WilsonDslashCudaI7double2S1_EE	type=interior,comm=0001,ghost=0001,reconstruct=8	32	1	1	16384	1	1	2049	# 35.00 Gflop/s, 0.00 GB/s, tuned Fri Jan  4 19:01:08 2013
32x32x32x32	N4quda16WilsonDslashCudaI7double2S1_EE	type=interior,comm=0001,ghost=0001,reconstruct=8,Xpay	32	1	1	16384	1	1	2049	# 31.48 Gflop/s, 0.00 GB/s, tuned Fri Jan  4 19:00:53 2013
32x32x32x32	N4quda17TwistedDslashCudaI6float4S1_EE	type=exterior_t,comm=0001,reconstruct=8	480	1	1	69	1	1	8193	# 6142.35 Gflop/s, 0.00 GB/s, tuned Fri Jan  4 19:02:26 2013
32x32x32x32	N4quda17TwistedDslashCudaI6float4S1_EE	type=exterior_t,comm=0001,reconstruct=8,Xpay	96	1	1	342	1	1	2341	# 4916.24 Gflop/s, 0.00 GB/s, tuned Fri Jan  4 19:02:26 2013
32x32x32x32	N4quda17TwistedDslashCudaI6float4S1_EE	type=interior,comm=0001,ghost=0001,reconstruct=8	64	1	1	8192	1	1	2731	# 178.56 Gflop/s, 0.00 GB/s, tuned Fri Jan  4 19:02:25 2013
32x32x32x32	N4quda17TwistedDslashCudaI6float4S1_EE	type=interior,comm=0001,ghost=0001,reconstruct=8,Xpay	64	1	1	8192	1	1	2731	# 163.55 Gflop/s, 0.00 GB/s, tuned Fri Jan  4 19:02:26 2013
32x32x32x32	N4quda17TwistedDslashCudaI7double2S1_EE	type=exterior_t,comm=0001,reconstruct=8	32	1	1	1024	1	1	2049	# 2575.26 Gflop/s, 0.00 GB/s, tuned Fri Jan  4 19:01:42 2013
32x32x32x32	N4quda17TwistedDslashCudaI7double2S1_EE	type=exterior_t,comm=0001,reconstruct=8,Xpay	32	1	1	1024	1	1	2341	# 2212.03 Gflop/s, 0.00 GB/s, tuned Fri Jan  4 19:01:45 2013
32x32x32x32	N4quda17TwistedDslashCudaI7double2S1_EE	type=interior,comm=0001,ghost=0001,reconstruct=8	32	1	1	16384	1	1	2049	# 33.39 Gflop/s, 0.00 GB/s, tuned Fri Jan  4 19:01:41 2013
32x32x32x32	N4quda17TwistedDslashCudaI7double2S1_EE	type=interior,comm=0001,ghost=0001,reconstruct=8,Xpay	32	1	1	16384	1	1	2049	# 33.14 Gflop/s, 0.00 GB/s, tuned Fri Jan  4 19:01:45 2013
32x32x32x4	N4quda15TwistGamma5CudaI6float4EE	288	1	1	1	1	1	8193	2049	# 33.14 Gflop/s, 0.00 GB/s, tuned Fri Jan  4 19:01:45 2013
32x32x32x4	N4quda15TwistGamma5CudaI7double2EE	416	1	1	1	1	1	2731	2049	# 33.14 Gflop/s, 0.00 GB/s, tuned Fri Jan  4 19:01:45 2013
32x32x32x4	N4quda15TwistGamma5CudaI7double2EE	448	1	1	1	1	1	8193	2049	# 33.14 Gflop/s, 0.00 GB/s, tuned Fri Jan  4 19:01:45 2013
32x32x32x4	N4quda16WilsonDslashCudaI6float4S1_EE	type=exterior_t,comm=0001,reconstruct=8	192	1	1	171	1	1	2049	# 753.03 Gflop/s, 0.00 GB/s, tuned Fri Jan  4 19:07:14 2013
32x32x32x4	N4quda16WilsonDslashCudaI6float4S1_EE	type=interior,comm=0001,ghost=0001,reconstruct=8	64	1	1	1024	1	1	2731	# 166.07 Gflop/s, 0.00 GB/s, tuned Fri Jan  4 19:07:14 2013
32x32x32x4	N4quda16WilsonDslashCudaI7double2S1_EE	type=exterior_t,comm=0001,reconstruct=8	32	1	1	1024	1	1	2341	# 334.28 Gflop/s, 0.00 GB/s, tuned Fri Jan  4 19:07:04 2013
32x32x32x4	N4quda16WilsonDslashCudaI7double2S1_EE	type=exterior_t,comm=0001,reconstruct=8,Xpay	32	1	1	1024	1	1	2341	# 263.41 Gflop/s, 0.00 GB/s, tuned Fri Jan  4 19:07:02 2013
32x32x32x4	N4quda16WilsonDslashCudaI7double2S1_EE	type=interior,comm=0001,ghost=0001,reconstruct=8	32	1	1	2048	1	1	2049	# 38.93 Gflop/s, 0.00 GB/s, tuned Fri Jan  4 19:07:04 2013
32x32x32x4	N4quda16WilsonDslashCudaI7double2S1_EE	type=interior,comm=0001,ghost=0001,reconstruct=8,Xpay	32	1	1	2048	1	1	2049	# 36.64 Gflop/s, 0.00 GB/s, tuned Fri Jan  4 19:07:01 2013
32x32x32x4	N4quda17TwistedDslashCudaI6float4S1_EE	type=exterior_t,comm=0001,reconstruct=8	160	1	1	205	1	1	3277	# 778.06 Gflop/s, 0.00 GB/s, tuned Fri Jan  4 19:07:14 2013
32x32x32x4	N4quda17TwistedDslashCudaI6float4S1_EE	type=exterior_t,comm=0001,reconstruct=8,Xpay	512	1	1	64	1	1	8193	# 616.23 Gflop/s, 0.00 GB/s, tuned Fri Jan  4 19:07:14 2013
32x32x32x4	N4quda17TwistedDslashCudaI6float4S1_EE	type=interior,comm=0001,ghost=0001,reconstruct=8	64	1	1	1024	1	1	2731	# 172.76 Gflop/s, 0.00 GB/s, tuned Fri Jan  4 19:07:14 2013
32x32x32x4	N4quda17TwistedDslashCudaI6float4S1_EE	type=interior,comm=0001,ghost=0001,reconstruct=8,Xpay	64	1	1	1024	1	1	2731	# 164.23 Gflop/s, 0.00 GB/s, tuned Fri Jan  4 19:07:14 2013
32x32x32x4	N4quda17TwistedDslashCudaI7double2S1_EE	type=exterior_t,comm=0001,reconstruct=8	32	1	1	1024	1	1	2341	# 335.27 Gflop/s, 0.00 GB/s, tuned Fri Jan  4 19:07:08 2013
32x32x32x4	N4quda17TwistedDslashCudaI7double2S1_EE	type=exterior_t,comm=0001,reconstruct=8,Xpay	32	1	1	1024	1	1	2341	# 272.02 Gflop/s, 0.00 GB/s, tuned Fri Jan  4 19:07:09 2013
32x32x32x4	N4quda17TwistedDslashCudaI7double2S1_EE	type=interior,comm=0001,ghost=0001,reconstruct=8	32	1	1	2048	1	1	2049	# 37.75 Gflop/s, 0.00 GB/s, tuned Fri Jan  4 19:07:08 2013
32x32x32x4	N4quda17TwistedDslashCudaI7double2S1_EE	type=interior,comm=0001,ghost=0001,reconstruct=8,Xpay	32	1	1	2048	1	1	2049	# 38.73 Gflop/s, 0.00 GB/s, tuned Fri Jan  4 19:07:09 2013
32x32x32x64	N4quda15TwistGamma5CudaI6float4EE	128	1	1	1	1	1	5462	2341	# 53.00 Gflop/s, 0.00 GB/s, tuned Thu Jan  3 12:21:46 2013
32x32x32x64	N4quda15TwistGamma5CudaI7double2EE	288	1	1	1	1	1	8193	2341	# 53.00 Gflop/s, 0.00 GB/s, tuned Thu Jan  3 12:21:46 2013
32x32x32x64	N4quda16WilsonDslashCudaI6float4S1_EE	type=interior,comm=0000,ghost=0000,reconstruct=8	64	1	1	16384	1	1	2731	# 172.79 Gflop/s, 0.00 GB/s, tuned Fri Jan  4 17:41:57 2013
32x32x32x64	N4quda16WilsonDslashCudaI7double2S1_EE	type=interior,comm=0000,ghost=0000,reconstruct=8	32	1	1	32768	1	1	2049	# 34.11 Gflop/s, 0.00 GB/s, tuned Fri Jan  4 17:39:20 2013
32x32x32x64	N4quda16WilsonDslashCudaI7double2S1_EE	type=interior,comm=0000,ghost=0000,reconstruct=8,Xpay	32	1	1	32768	1	1	2049	# 30.84 Gflop/s, 0.00 GB/s, tuned Fri Jan  4 17:38:51 2013
32x32x32x64	N4quda17TwistedDslashCudaI6float4S1_EE	type=interior,comm=0000,ghost=0000,reconstruct=8	64	1	1	16384	1	1	2731	# 180.09 Gflop/s, 0.00 GB/s, tuned Fri Jan  4 17:41:54 2013
32x32x32x64	N4quda17TwistedDslashCudaI6float4S1_EE	type=interior,comm=0000,ghost=0000,reconstruct=8,Xpay	64	1	1	16384	1	1	2731	# 162.29 Gflop/s, 0.00 GB/s, tuned Fri Jan  4 17:41:56 2013
32x32x32x64	N4quda17TwistedDslashCudaI7double2S1_EE	type=interior,comm=0000,ghost=0000,reconstruct=8	96	1	1	10923	1	1	4097	# 33.25 Gflop/s, 0.00 GB/s, tuned Fri Jan  4 17:40:27 2013
32x32x32x64	N4quda17TwistedDslashCudaI7double2S1_EE	type=interior,comm=0000,ghost=0000,reconstruct=8,Xpay	32	1	1	32768	1	1	2049	# 32.50 Gflop/s, 0.00 GB/s, tuned Fri Jan  4 17:40:34 2013
32x32x32x8	N4quda15TwistGamma5CudaI6float4EE	128	1	1	1	1	1	5462	2049	# 32.50 Gflop/s, 0.00 GB/s, tuned Fri Jan  4 17:40:34 2013
32x32x32x8	N4quda15TwistGamma5CudaI6float4EE	160	1	1	1	1	1	5462	2049	# 32.50 Gflop/s, 0.00 GB/s, tuned Fri Jan  4 17:40:34 2013
32x32x32x8	N4quda15TwistGamma5CudaI6float4EE	256	1	1	1	1	1	8193	2049	# 32.50 Gflop/s, 0.00 GB/s, tuned Fri Jan  4 17:40:34 2013
32x32x32x8	N4quda15TwistGamma5CudaI6float4EE	288	1	1	1	1	1	8193	2049	# 32.50 Gflop/s, 0.00 GB/s, tuned Fri Jan  4 17:40:34 2013
32x32x32x8	N4quda15TwistGamma5CudaI6float4EE	320	1	1	1	1	1	8193	2049	# 32.50 Gflop/s, 0.00 GB/s, tuned Fri Jan  4 17:40:34 2013
32x32x32x8	N4quda15TwistGamma5CudaI6float4EE	352	1	1	1	1	1	8193	2049	# 32.50 Gflop/s, 0.00 GB/s, tuned Fri Jan  4 17:40:34 2013
32x32x32x8	N4quda15TwistGamma5CudaI6float4EE	384	1	1	1	1	1	4097	2049	# 32.50 Gflop/s, 0.00 GB/s, tuned Fri Jan  4 17:40:34 2013
32x32x32x8	N4quda15TwistGamma5CudaI6float4EE	416	1	1	1	1	1	2731	2049	# 32.50 Gflop/s, 0.00 GB/s, tuned Fri Jan  4 17:40:34 2013
32x32x32x8	N4quda15TwistGamma5CudaI6float4EE	448	1	1	1	1	1	4097	2049	# 32.50 Gflop/s, 0.00 GB/s, tuned Fri Jan  4 17:40:34 2013
32x32x32x8	N4quda15TwistGamma5CudaI6float4EE	480	1	1	1	1	1	4097	2049	# 32.50 Gflop/s, 0.00 GB/s, tuned Fri Jan  4 17:40:34 2013
32x32x32x8	N4quda15TwistGamma5CudaI6float4EE	512	1	1	1	1	1	2049	2049	# 32.50 Gflop/s, 0.00 GB/s, tuned Fri Jan  4 17:40:34 2013
32x32x32x8	N4quda15TwistGamma5CudaI6float4EE	544	1	1	1	1	1	2341	2049	# 32.50 Gflop/s, 0.00 GB/s, tuned Fri Jan  4 17:40:34 2013
32x32x32x8	N4quda15TwistGamma5CudaI6float4EE	576	1	1	1	1	1	8193	2049	# 32.50 Gflop/s, 0.00 GB/s, tuned Fri Jan  4 17:40:34 2013
32x32x32x8	N4quda15TwistGamma5CudaI6float4EE	608	1	1	1	1	1	3277	2049	# 32.50 Gflop/s, 0.00 GB/s, tuned Fri Jan  4 17:40:34 2013
32x32x32x8	N4quda15TwistGamma5CudaI6float4EE	64	1	1	1	1	1	2731	2049	# 32.50 Gflop/s, 0.00 GB/s, tuned Fri Jan  4 17:40:34 2013
32x32x32x8	N4quda15TwistGamma5CudaI6float4EE	96	1	1	1	1	1	4097	2049	# 32.50 Gflop/s, 0.00 GB/s, tuned Fri Jan  4 17:40:34 2013
32x32x32x8	N4quda15TwistGamma5CudaI7double2EE	256	1	1	1	1	1	8193	2049	# 32.50 Gflop/s, 0.00 GB/s, tuned Fri Jan  4 17:40:34 2013
32x32x32x8	N4quda15TwistGamma5CudaI7double2EE	288	1	1	1	1	1	2731	2049	# 32.50 Gflop/s, 0.00 GB/s, tuned Fri Jan  4 17:40:34 2013
32x32x32x8	N4quda15TwistGamma5CudaI7double2EE	320	1	1	1	1	1	0	2049	# 32.50 Gflop/s, 0.00 GB/s, tuned Fri Jan  4 17:40:34 2013
32x32x32x8	N4quda15TwistGamma5CudaI7double2EE	352	1	1	1	1	1	4097	0	# 32.50 Gflop/s, 0.00 GB/s, tuned Fri Jan  4 17:40:34 2013
32x32x32x8	N4quda15TwistGamma5CudaI7double2EE	384	1	1	1	1	1	8193	2049	# 32.50 Gflop/s, 0.00 GB/s, tuned Fri Jan  4 17:40:34 2013
32x32x32x8	N4quda15TwistGamma5CudaI7double2EE	416	1	1	1	1	1	5462	2049	# 32.50 Gflop/s, 0.00 GB/s, tuned Fri Jan  4 17:40:34 2013
32x32x32x8	N4quda15TwistGamma5CudaI7double2EE	448	1	1	1	1	1	2341	2049	# 32.50 Gflop/s, 0.00 GB/s, tuned Fri Jan  4 17:40:34 2013
32x32x32x8	N4quda15TwistGamma5CudaI7double2EE	480	1	1	1	1	1	4097	2049	# 32.50 Gflop/s, 0.00 GB/s, tuned Fri Jan  4 17:40:34 2013
32x32x32x8	N4quda15TwistGamma5CudaI7double2EE	512	1	1	1	1	1	2731	2049	# 32.50 Gflop/s, 0.00 GB/s, tuned Fri Jan  4 17:40:34 2013
32x32x32x8	N4quda16WilsonDslashCudaI6float4S1_EE	type=exterior_t,comm=0001,reconstruct=12	480	1	1	69	1	1	0	# 1486.59 Gflop/s, 0.00 GB/s, tuned Tue Feb 26 14:07:18 2013
32x32x32x8	N4quda16WilsonDslashCudaI6float4S1_EE	type=exterior_t,comm=0001,reconstruct=8	480	1	1	69	1	1	4097	# 1506.47 Gflop/s, 0.00 GB/s, tuned Sat Feb 23 13:02:55 2013
32x32x32x8	N4quda16WilsonDslashCudaI6float4S1_EE	type=interior,comm=0001,ghost=0001,reconstruct=12	96	1	1	1366	1	1	4097	# 144.84 Gflop/s, 0.00 GB/s, tuned Tue Feb 26 14:07:18 2013
32x32x32x8	N4quda16WilsonDslashCudaI6float4S1_EE	type=interior,comm=0001,ghost=0001,reconstruct=8	64	1	1	2048	1	1	2731	# 168.17 Gflop/s, 0.00 GB/s, tuned Sat Feb 23 13:02:55 2013
32x32x32x8	N4quda16WilsonDslashCudaI7double2S1_EE	type=exterior_t,comm=0001,reconstruct=12	96	1	1	342	1	1	5462	# 738.82 Gflop/s, 0.00 GB/s, tuned Tue Feb 26 14:07:15 2013
32x32x32x8	N4quda16WilsonDslashCudaI7double2S1_EE	type=exterior_t,comm=0001,reconstruct=12,Xpay	32	1	1	1024	1	1	2049	# 569.21 Gflop/s, 0.00 GB/s, tuned Tue Feb 26 14:07:15 2013
32x32x32x8	N4quda16WilsonDslashCudaI7double2S1_EE	type=exterior_t,comm=0001,reconstruct=8	32	1	1	1024	1	1	2049	# 655.76 Gflop/s, 0.00 GB/s, tuned Sat Feb 23 13:02:31 2013
32x32x32x8	N4quda16WilsonDslashCudaI7double2S1_EE	type=exterior_t,comm=0001,reconstruct=8,Xpay	64	1	1	512	1	1	4097	# 531.62 Gflop/s, 0.00 GB/s, tuned Sat Feb 23 13:02:30 2013
32x32x32x8	N4quda16WilsonDslashCudaI7double2S1_EE	type=interior,comm=0001,ghost=0001,reconstruct=12	32	1	1	4096	1	1	2341	# 57.21 Gflop/s, 0.00 GB/s, tuned Tue Feb 26 14:07:15 2013
32x32x32x8	N4quda16WilsonDslashCudaI7double2S1_EE	type=interior,comm=0001,ghost=0001,reconstruct=12,Xpay	32	1	1	4096	1	1	2341	# 52.94 Gflop/s, 0.00 GB/s, tuned Tue Feb 26 14:07:15 2013
32x32x32x8	N4quda16WilsonDslashCudaI7double2S1_EE	type=interior,comm=0001,ghost=0001,reconstruct=8	32	1	1	4096	1	1	2049	# 35.70 Gflop/s, 0.00 GB/s, tuned Sat Feb 23 13:02:31 2013
32x32x32x8	N4quda16WilsonDslashCudaI7double2S1_EE	type=interior,comm=0001,ghost=0001,reconstruct=8,Xpay	32	1	1	4096	1	1	2049	# 33.17 Gflop/s, 0.00 GB/s, tuned Sat Feb 23 13:02:30 2013
32x32x32x8	N4quda17TwistedDslashCudaI6float4S1_EE	type=exterior_t,comm=0001,reconstruct=12	480	1	1	69	1	1	8193	# 1554.43 Gflop/s, 0.00 GB/s, tuned Tue Feb 26 14:07:17 2013
32x32x32x8	N4quda17TwistedDslashCudaI6float4S1_EE	type=exterior_t,comm=0001,reconstruct=12,Xpay	480	1	1	69	1	1	2049	# 1199.82 Gflop/s, 0.00 GB/s, tuned Tue Feb 26 14:07:18 2013
32x32x32x8	N4quda17TwistedDslashCudaI6float4S1_EE	type=exterior_t,comm=0001,reconstruct=8	480	1	1	69	1	1	0	# 1530.64 Gflop/s, 0.00 GB/s, tuned Sat Feb 23 13:02:54 2013
32x32x32x8	N4quda17TwistedDslashCudaI6float4S1_EE	type=exterior_t,comm=0001,reconstruct=8,Xpay	256	1	1	128	1	1	0	# 1215.92 Gflop/s, 0.00 GB/s, tuned Sat Feb 23 13:02:54 2013
32x32x32x8	N4quda17TwistedDslashCudaI6float4S1_EE	type=interior,comm=0001,ghost=0001,reconstruct=12	96	1	1	1366	1	1	4097	# 149.40 Gflop/s, 0.00 GB/s, tuned Tue Feb 26 14:07:17 2013
32x32x32x8	N4quda17TwistedDslashCudaI6float4S1_EE	type=interior,comm=0001,ghost=0001,reconstruct=12,Xpay	64	1	1	2048	1	1	3277	# 141.22 Gflop/s, 0.00 GB/s, tuned Tue Feb 26 14:07:18 2013
32x32x32x8	N4quda17TwistedDslashCudaI6float4S1_EE	type=interior,comm=0001,ghost=0001,reconstruct=8	64	1	1	2048	1	1	2731	# 171.65 Gflop/s, 0.00 GB/s, tuned Sat Feb 23 13:02:54 2013
32x32x32x8	N4quda17TwistedDslashCudaI6float4S1_EE	type=interior,comm=0001,ghost=0001,reconstruct=8,Xpay	64	1	1	2048	1	1	2731	# 161.51 Gflop/s, 0.00 GB/s, tuned Sat Feb 23 13:02:54 2013
32x32x32x8	N4quda17TwistedDslashCudaI7double2S1_EE	type=exterior_t,comm=0001,reconstruct=12	32	1	1	1024	1	1	2341	# 760.83 Gflop/s, 0.00 GB/s, tuned Tue Feb 26 14:07:16 2013
32x32x32x8	N4quda17TwistedDslashCudaI7double2S1_EE	type=exterior_t,comm=0001,reconstruct=12,Xpay	64	1	1	512	1	1	3277	# 581.68 Gflop/s, 0.00 GB/s, tuned Tue Feb 26 14:07:17 2013
32x32x32x8	N4quda17TwistedDslashCudaI7double2S1_EE	type=exterior_t,comm=0001,reconstruct=8	32	1	1	1024	1	1	2341	# 648.58 Gflop/s, 0.00 GB/s, tuned Sat Feb 23 13:02:43 2013
32x32x32x8	N4quda17TwistedDslashCudaI7double2S1_EE	type=exterior_t,comm=0001,reconstruct=8,Xpay	32	1	1	1024	1	1	2341	# 541.75 Gflop/s, 0.00 GB/s, tuned Sat Feb 23 13:02:44 2013
32x32x32x8	N4quda17TwistedDslashCudaI7double2S1_EE	type=interior,comm=0001,ghost=0001,reconstruct=12	32	1	1	4096	1	1	2341	# 57.43 Gflop/s, 0.00 GB/s, tuned Tue Feb 26 14:07:16 2013
32x32x32x8	N4quda17TwistedDslashCudaI7double2S1_EE	type=interior,comm=0001,ghost=0001,reconstruct=12,Xpay	32	1	1	4096	1	1	2341	# 54.16 Gflop/s, 0.00 GB/s, tuned Tue Feb 26 14:07:17 2013
32x32x32x8	N4quda17TwistedDslashCudaI7double2S1_EE	type=interior,comm=0001,ghost=0001,reconstruct=8	32	1	1	4096	1	1	2049	# 35.17 Gflop/s, 0.00 GB/s, tuned Sat Feb 23 13:02:43 2013
32x32x32x8	N4quda17TwistedDslashCudaI7double2S1_EE	type=interior,comm=0001,ghost=0001,reconstruct=8,Xpay	32	1	1	4096	1	1	2049	# 34.73 Gflop/s, 0.00 GB/s, tuned Sat Feb 23 13:02:44 2013
331776	N4quda10PackSpinorIddLi4ELi3ENS_11FloatNOrderIdLi4ELi3ELi2EEENS_21SpaceSpinorColorOrderIdLi4ELi3EEENS_13PreserveBasisIddLi4ELi3EEEEE	out_stride=331776,in_stride=331776	32	1	1	10368	1	1	6336	# 0.00 Gflop/s, 46.16 GB/s, tuned Thu Jan  3 12:21:11 2013
331776	N4quda10PackSpinorIddLi4ELi3ENS_21SpaceSpinorColorOrderIdLi4ELi3EEENS_11FloatNOrderIdLi4ELi3ELi2EEENS_13PreserveBasisIddLi4ELi3EEEEE	out_stride=331776,in_stride=331776	32	1	1	10368	1	1	6336	# 0.00 Gflop/s, 21.37 GB/s, tuned Thu Jan  3 12:23:42 2013
41472	N4quda10PackSpinorIddLi4ELi3ENS_11FloatNOrderIdLi4ELi3ELi2EEENS_21SpaceSpinorColorOrderIdLi4ELi3EEENS_13PreserveBasisIddLi4ELi3EEEEE	out_stride=41472,in_stride=41472	64	1	1	648	1	1	12480	# 0.00 Gflop/s, 43.02 GB/s, tuned Fri Jan  4 18:21:48 2013
41472	N4quda10PackSpinorIddLi4ELi3ENS_21SpaceSpinorColorOrderIdLi4ELi3EEENS_11FloatNOrderIdLi4ELi3ELi2EEENS_13PreserveBasisIddLi4ELi3EEEEE	out_stride=41472,in_stride=41472	64	1	1	648	1	1	12480	# 0.00 Gflop/s, 20.49 GB/s, tuned Fri Jan  4 18:22:13 2013
48x48x48x12	N4quda15TwistGamma5CudaI6float4EE	128	1	1	1	1	1	5462	0	# 0.00 Gflop/s, 20.49 GB/s, tuned Fri Jan  4 18:22:13 2013
48x48x48x12	N4quda15TwistGamma5CudaI7double2EE	288	1	1	1	1	1	2049	0	# 0.00 Gflop/s, 20.49 GB/s, tuned Fri Jan  4 18:22:13 2013
48x48x48x12	N4quda16WilsonDslashCudaI6float4S1_EE	type=exterior_t,comm=0001,reconstruct=12	352	1	1	315	1	1	8193	# 2512.76 Gflop/s, 0.00 GB/s, tuned Wed Aug  6 18:31:15 2014
48x48x48x12	N4quda16WilsonDslashCudaI6float4S1_EE	type=interior,comm=0001,ghost=0001,reconstruct=12	96	1	1	6912	1	1	4097	# 147.06 Gflop/s, 0.00 GB/s, tuned Wed Aug  6 18:31:15 2014
48x48x48x12	N4quda16WilsonDslashCudaI7double2S1_EE	type=exterior_t,comm=0001,reconstruct=12	32	1	1	3456	1	1	2341	# 1204.04 Gflop/s, 0.00 GB/s, tuned Wed Aug  6 18:29:22 2014
48x48x48x12	N4quda16WilsonDslashCudaI7double2S1_EE	type=exterior_t,comm=0001,reconstruct=12,Xpay	32	1	1	3456	1	1	2049	# 931.53 Gflop/s, 0.00 GB/s, tuned Wed Aug  6 18:29:18 2014
48x48x48x12	N4quda16WilsonDslashCudaI7double2S1_EE	type=interior,comm=0001,ghost=0001,reconstruct=12	32	1	1	20736	1	1	2341	# 59.24 Gflop/s, 0.00 GB/s, tuned Wed Aug  6 18:29:21 2014
48x48x48x12	N4quda16WilsonDslashCudaI7double2S1_EE	type=interior,comm=0001,ghost=0001,reconstruct=12,Xpay	32	1	1	20736	1	1	2341	# 53.85 Gflop/s, 0.00 GB/s, tuned Wed Aug  6 18:29:17 2014
48x48x48x12	N4quda17TwistedDslashCudaI6float4S1_EE	type=exterior_t,comm=0001,reconstruct=12	416	1	1	266	1	1	4097	# 2630.74 Gflop/s, 0.00 GB/s, tuned Wed Aug  6 18:31:13 2014
48x48x48x12	N4quda17TwistedDslashCudaI6float4S1_EE	type=exterior_t,comm=0001,reconstruct=12,Xpay	288	1	1	384	1	1	4097	# 2009.59 Gflop/s, 0.00 GB/s, tuned Wed Aug  6 18:31:14 2014
48x48x48x12	N4quda17TwistedDslashCudaI6float4S1_EE	type=interior,comm=0001,ghost=0001,reconstruct=12	96	1	1	6912	1	1	4097	# 152.94 Gflop/s, 0.00 GB/s, tuned Wed Aug  6 18:31:13 2014
48x48x48x12	N4quda17TwistedDslashCudaI6float4S1_EE	type=interior,comm=0001,ghost=0001,reconstruct=12,Xpay	64	1	1	10368	1	1	3277	# 143.14 Gflop/s, 0.00 GB/s, tuned Wed Aug  6 18:31:14 2014
48x48x48x12	N4quda17TwistedDslashCudaI7double2S1_EE	type=exterior_t,comm=0001,reconstruct=12	32	1	1	3456	1	1	2341	# 1255.69 Gflop/s, 0.00 GB/s, tuned Wed Aug  6 18:30:18 2014
48x48x48x12	N4quda17TwistedDslashCudaI7double2S1_EE	type=exterior_t,comm=0001,reconstruct=12,Xpay	32	1	1	3456	1	1	2049	# 959.08 Gflop/s, 0.00 GB/s, tuned Wed Aug  6 18:30:22 2014
48x48x48x12	N4quda17TwistedDslashCudaI7double2S1_EE	type=interior,comm=0001,ghost=0001,reconstruct=12	32	1	1	20736	1	1	2341	# 58.53 Gflop/s, 0.00 GB/s, tuned Wed Aug  6 18:30:17 2014
48x48x48x12	N4quda17TwistedDslashCudaI7double2S1_EE	type=interior,comm=0001,ghost=0001,reconstruct=12,Xpay	32	1	1	20736	1	1	2341	# 55.18 Gflop/s, 0.00 GB/s, tuned Wed Aug  6 18:30:22 2014
48x48x48x16	N4quda15TwistGamma5CudaI6float4EE	128	1	1	1	1	1	5462	0	# 55.18 Gflop/s, 0.00 GB/s, tuned Wed Aug  6 18:30:22 2014
48x48x48x16	N4quda15TwistGamma5CudaI6float4EE	160	1	1	1	1	1	5462	0	# 55.18 Gflop/s, 0.00 GB/s, tuned Wed Aug  6 18:30:22 2014
48x48x48x16	N4quda15TwistGamma5CudaI6float4EE	288	1	1	1	1	1	8193	0	# 55.18 Gflop/s, 0.00 GB/s, tuned Wed Aug  6 18:30:22 2014
48x48x48x16	N4quda15TwistGamma5CudaI6float4EE	64	1	1	1	1	1	3277	0	# 55.18 Gflop/s, 0.00 GB/s, tuned Wed Aug  6 18:30:22 2014
48x48x48x16	N4quda15TwistGamma5CudaI6float4EE	96	1	1	1	1	1	5462	0	# 55.18 Gflop/s, 0.00 GB/s, tuned Wed Aug  6 18:30:22 2014
48x48x48x16	N4quda15TwistGamma5CudaI7double2EE	224	1	1	1	1	1	8193	0	# 55.18 Gflop/s, 0.00 GB/s, tuned Wed Aug  6 18:30:22 2014
48x48x48x16	N4quda15TwistGamma5CudaI7double2EE	256	1	1	1	1	1	8193	0	# 55.18 Gflop/s, 0.00 GB/s, tuned Wed Aug  6 18:30:22 2014
48x48x48x16	N4quda15TwistGamma5CudaI7double2EE	288	1	1	1	1	1	5462	0	# 55.18 Gflop/s, 0.00 GB/s, tuned Wed Aug  6 18:30:22 2014
48x48x48x16	N4quda15TwistGamma5CudaI7double2EE	320	1	1	1	1	1	4097	0	# 55.18 Gflop/s, 0.00 GB/s, tuned Wed Aug  6 18:30:22 2014
48x48x48x16	N4quda16WilsonDslashCudaI6float4S1_EE	type=exterior_t,comm=0001,reconstruct=12	288	1	1	384	1	1	2049	# 3343.60 Gflop/s, 0.00 GB/s, tuned Fri Aug  8 17:42:27 2014
48x48x48x16	N4quda16WilsonDslashCudaI6float4S1_EE	type=interior,comm=0001,ghost=0001,reconstruct=12	96	1	1	9216	1	1	4097	# 148.34 Gflop/s, 0.00 GB/s, tuned Fri Aug  8 17:42:27 2014
48x48x48x16	N4quda16WilsonDslashCudaI7double2S1_EE	type=exterior_t,comm=0001,reconstruct=12	64	1	1	1728	1	1	4097	# 1608.79 Gflop/s, 0.00 GB/s, tuned Fri Aug  8 17:39:55 2014
48x48x48x16	N4quda16WilsonDslashCudaI7double2S1_EE	type=exterior_t,comm=0001,reconstruct=12,Xpay	32	1	1	3456	1	1	2341	# 1238.62 Gflop/s, 0.00 GB/s, tuned Fri Aug  8 17:39:49 2014
48x48x48x16	N4quda16WilsonDslashCudaI7double2S1_EE	type=interior,comm=0001,ghost=0001,reconstruct=12	32	1	1	27648	1	1	2341	# 59.02 Gflop/s, 0.00 GB/s, tuned Fri Aug  8 17:39:55 2014
48x48x48x16	N4quda16WilsonDslashCudaI7double2S1_EE	type=interior,comm=0001,ghost=0001,reconstruct=12,Xpay	32	1	1	27648	1	1	2341	# 53.47 Gflop/s, 0.00 GB/s, tuned Fri Aug  8 17:39:49 2014
48x48x48x16	N4quda17TwistedDslashCudaI6float4S1_EE	type=exterior_t,comm=0001,reconstruct=12	352	1	1	315	1	1	2731	# 3485.11 Gflop/s, 0.00 GB/s, tuned Fri Aug  8 17:42:24 2014
48x48x48x16	N4quda17TwistedDslashCudaI6float4S1_EE	type=exterior_t,comm=0001,reconstruct=12,Xpay	288	1	1	384	1	1	4097	# 2681.29 Gflop/s, 0.00 GB/s, tuned Fri Aug  8 17:42:25 2014
48x48x48x16	N4quda17TwistedDslashCudaI6float4S1_EE	type=interior,comm=0001,ghost=0001,reconstruct=12	96	1	1	9216	1	1	4097	# 154.07 Gflop/s, 0.00 GB/s, tuned Fri Aug  8 17:42:23 2014
48x48x48x16	N4quda17TwistedDslashCudaI6float4S1_EE	type=interior,comm=0001,ghost=0001,reconstruct=12,Xpay	64	1	1	13824	1	1	3277	# 141.35 Gflop/s, 0.00 GB/s, tuned Fri Aug  8 17:42:25 2014
48x48x48x16	N4quda17TwistedDslashCudaI7double2S1_EE	type=exterior_t,comm=0001,reconstruct=12	32	1	1	3456	1	1	2341	# 1673.16 Gflop/s, 0.00 GB/s, tuned Fri Aug  8 17:41:10 2014
48x48x48x16	N4quda17TwistedDslashCudaI7double2S1_EE	type=exterior_t,comm=0001,reconstruct=12,Xpay	32	1	1	3456	1	1	2049	# 1278.14 Gflop/s, 0.00 GB/s, tuned Fri Aug  8 17:41:15 2014
48x48x48x16	N4quda17TwistedDslashCudaI7double2S1_EE	type=interior,comm=0001,ghost=0001,reconstruct=12	32	1	1	27648	1	1	2341	# 58.28 Gflop/s, 0.00 GB/s, tuned Fri Aug  8 17:41:09 2014
48x48x48x16	N4quda17TwistedDslashCudaI7double2S1_EE	type=interior,comm=0001,ghost=0001,reconstruct=12,Xpay	32	1	1	27648	1	1	2341	# 54.73 Gflop/s, 0.00 GB/s, tuned Fri Aug  8 17:41:15 2014
48x48x48x6	N4quda15TwistGamma5CudaI6float4EE	160	1	1	1	1	1	5462	12480	# 0.00 Gflop/s, 20.49 GB/s, tuned Fri Jan  4 18:22:13 2013
48x48x48x6	N4quda15TwistGamma5CudaI6float4EE	256	1	1	1	1	1	8193	12480	# 0.00 Gflop/s, 20.49 GB/s, tuned Fri Jan  4 18:22:13 2013
48x48x48x6	N4quda15TwistGamma5CudaI6float4EE	288	1	1	1	1	1	8193	12480	# 0.00 Gflop/s, 20.49 GB/s, tuned Fri Jan  4 18:22:13 2013
48x48x48x6	N4quda15TwistGamma5CudaI6float4EE	96	1	1	1	1	1	5462	12480	# 0.00 Gflop/s, 20.49 GB/s, tuned Fri Jan  4 18:22:13 2013
48x48x48x6	N4quda15TwistGamma5CudaI7double2EE	288	1	1	1	1	1	0	12480	# 0.00 Gflop/s, 20.49 GB/s, tuned Fri Jan  4 18:22:13 2013
48x48x48x6	N4quda15TwistGamma5CudaI7double2EE	320	1	1	1	1	1	8193	12480	# 0.00 Gflop/s, 20.49 GB/s, tuned Fri Jan  4 18:22:13 2013
48x48x48x6	N4quda15TwistGamma5CudaI7double2EE	384	1	1	1	1	1	4097	12480	# 0.00 Gflop/s, 20.49 GB/s, tuned Fri Jan  4 18:22:13 2013
48x48x48x6	N4quda15TwistGamma5CudaI7double2EE	448	1	1	1	1	1	2049	12480	# 0.00 Gflop/s, 20.49 GB/s, tuned Fri Jan  4 18:22:13 2013
48x48x48x6	N4quda16WilsonDslashCudaI6float4S1_EE	type=exterior_t,comm=0001,reconstruct=8	512	1	1	216	1	1	8193	# 1301.05 Gflop/s, 0.00 GB/s, tuned Fri Jan  4 19:32:16 2013
48x48x48x6	N4quda16WilsonDslashCudaI6float4S1_EE	type=interior,comm=0001,ghost=0001,reconstruct=8	64	1	1	5184	1	1	2731	# 171.08 Gflop/s, 0.00 GB/s, tuned Fri Jan  4 19:32:16 2013
48x48x48x6	N4quda16WilsonDslashCudaI7double2S1_EE	type=exterior_t,comm=0001,reconstruct=8	32	1	1	3456	1	1	2341	# 585.16 Gflop/s, 0.00 GB/s, tuned Fri Jan  4 19:31:25 2013
48x48x48x6	N4quda16WilsonDslashCudaI7double2S1_EE	type=exterior_t,comm=0001,reconstruct=8,Xpay	32	1	1	3456	1	1	2341	# 443.62 Gflop/s, 0.00 GB/s, tuned Fri Jan  4 19:31:16 2013
48x48x48x6	N4quda16WilsonDslashCudaI7double2S1_EE	type=interior,comm=0001,ghost=0001,reconstruct=8	32	1	1	10368	1	1	2049	# 36.67 Gflop/s, 0.00 GB/s, tuned Fri Jan  4 19:31:25 2013
48x48x48x6	N4quda16WilsonDslashCudaI7double2S1_EE	type=interior,comm=0001,ghost=0001,reconstruct=8,Xpay	32	1	1	10368	1	1	2049	# 33.76 Gflop/s, 0.00 GB/s, tuned Fri Jan  4 19:31:15 2013
48x48x48x6	N4quda17TwistedDslashCudaI6float4S1_EE	type=exterior_t,comm=0001,reconstruct=8	512	1	1	216	1	1	8193	# 1357.44 Gflop/s, 0.00 GB/s, tuned Fri Jan  4 19:32:15 2013
48x48x48x6	N4quda17TwistedDslashCudaI6float4S1_EE	type=exterior_t,comm=0001,reconstruct=8,Xpay	320	1	1	346	1	1	2731	# 1030.32 Gflop/s, 0.00 GB/s, tuned Fri Jan  4 19:32:15 2013
48x48x48x6	N4quda17TwistedDslashCudaI6float4S1_EE	type=interior,comm=0001,ghost=0001,reconstruct=8	64	1	1	5184	1	1	2731	# 179.08 Gflop/s, 0.00 GB/s, tuned Fri Jan  4 19:32:15 2013
48x48x48x6	N4quda17TwistedDslashCudaI6float4S1_EE	type=interior,comm=0001,ghost=0001,reconstruct=8,Xpay	64	1	1	5184	1	1	2731	# 166.53 Gflop/s, 0.00 GB/s, tuned Fri Jan  4 19:32:15 2013
48x48x48x6	N4quda17TwistedDslashCudaI7double2S1_EE	type=exterior_t,comm=0001,reconstruct=8	32	1	1	3456	1	1	2341	# 576.74 Gflop/s, 0.00 GB/s, tuned Fri Jan  4 19:31:47 2013
48x48x48x6	N4quda17TwistedDslashCudaI7double2S1_EE	type=exterior_t,comm=0001,reconstruct=8,Xpay	32	1	1	3456	1	1	2341	# 461.68 Gflop/s, 0.00 GB/s, tuned Fri Jan  4 19:31:49 2013
48x48x48x6	N4quda17TwistedDslashCudaI7double2S1_EE	type=interior,comm=0001,ghost=0001,reconstruct=8	224	1	1	1482	1	1	8193	# 35.51 Gflop/s, 0.00 GB/s, tuned Fri Jan  4 19:31:46 2013
48x48x48x6	N4quda17TwistedDslashCudaI7double2S1_EE	type=interior,comm=0001,ghost=0001,reconstruct=8,Xpay	32	1	1	10368	1	1	2049	# 35.65 Gflop/s, 0.00 GB/s, tuned Fri Jan  4 19:31:49 2013
524288	N4quda10PackSpinorIddLi4ELi3ENS_11FloatNOrderIdLi4ELi3ELi2EEENS_21SpaceSpinorColorOrderIdLi4ELi3EEENS_13PreserveBasisIddLi4ELi3EEEEE	out_stride=524288,in_stride=524288	32	1	1	16384	1	1	6336	# 0.00 Gflop/s, 46.63 GB/s, tuned Fri Jan  4 19:00:48 2013
524288	N4quda10PackSpinorIddLi4ELi3ENS_21SpaceSpinorColorOrderIdLi4ELi3EEENS_11FloatNOrderIdLi4ELi3ELi2EEENS_13PreserveBasisIddLi4ELi3EEEEE	out_stride=524288,in_stride=524288	32	1	1	16384	1	1	6336	# 0.00 Gflop/s, 21.43 GB/s, tuned Fri Jan  4 19:05:17 2013
5x10x10x20	N4quda11axpyCGNorm2I7double26float26float4EE	stride=10000,prec=4	96	1	1	95	1	1	1536	# 24.48 Gflop/s, 48.97 GB/s, tuned Fri Apr 12 16:35:58 2013
5x10x10x20	N4quda22HeavyQuarkResidualNormI7double37double2S2_EE	stride=10000,prec=8	96	1	1	83	1	1	2304	# 12.55 Gflop/s, 50.19 GB/s, tuned Fri Apr 12 16:36:01 2013
5x10x10x20	N4quda3DotId6float26float4EE	stride=10000,prec=4	96	1	1	63	1	1	768	# 9.45 Gflop/s, 37.78 GB/s, tuned Fri Apr 12 16:35:57 2013
5x10x10x20	N4quda3xpyI7double2S1_EE	stride=10000,prec=8	64	1	1	112	1	1	0	# 3.33 Gflop/s, 79.89 GB/s, tuned Fri Apr 12 16:36:00 2013
5x10x10x20	N4quda4axpyI6float26float4EE	stride=10000,prec=4	128	1	1	248	1	1	0	# 10.88 Gflop/s, 65.26 GB/s, tuned Fri Apr 12 16:35:59 2013
5x10x10x20	N4quda4xpayI6float26float4EE	stride=10000,prec=4	64	1	1	112	1	1	0	# 11.13 Gflop/s, 66.77 GB/s, tuned Fri Apr 12 16:35:56 2013
5x10x10x20	N4quda4xpayI7double2S1_EE	stride=10000,prec=8	960	1	1	126	1	1	0	# 6.95 Gflop/s, 83.41 GB/s, tuned Fri Apr 12 16:35:54 2013
5x10x10x20	N4quda5Norm2Id7double2S1_EE	stride=10000,prec=8	192	1	1	64	1	1	1536	# 9.81 Gflop/s, 39.24 GB/s, tuned Fri Apr 12 16:35:54 2013
5x10x10x20	N4quda8axpyZpbxI6float26float4EE	stride=10000,prec=4	896	1	1	113	1	1	0	# 30.35 Gflop/s, 75.87 GB/s, tuned Fri Apr 12 16:35:59 2013
5x10x10x20	N4quda8xmyNorm2Id7double2S1_EE	stride=10000,prec=8	64	1	1	110	1	1	512	# 8.61 Gflop/s, 68.89 GB/s, tuned Fri Apr 12 16:35:55 2013
5x10x10x20	copyKernel	stride=10000,out_prec=4,in_prec=8	384	1	1	48	1	1	0	# 0.00 Gflop/s, 68.39 GB/s, tuned Fri Apr 12 16:35:56 2013
5x10x10x20	copyKernel	stride=10000,out_prec=8,in_prec=4	352	1	1	145	1	1	0	# 0.00 Gflop/s, 65.26 GB/s, tuned Fri Apr 12 16:36:00 2013
65536	N4quda10PackSpinorIddLi4ELi3ENS_11FloatNOrderIdLi4ELi3ELi2EEENS_21SpaceSpinorColorOrderIdLi4ELi3EEENS_13PreserveBasisIddLi4ELi3EEEEE	out_stride=65536,in_stride=65536	32	1	1	2048	1	1	6336	# 0.00 Gflop/s, 43.37 GB/s, tuned Fri Jan  4 19:07:01 2013
65536	N4quda10PackSpinorIddLi4ELi3ENS_21SpaceSpinorColorOrderIdLi4ELi3EEENS_11FloatNOrderIdLi4ELi3ELi2EEENS_13PreserveBasisIddLi4ELi3EEEEE	out_stride=65536,in_stride=65536	64	1	1	1024	1	1	12480	# 0.00 Gflop/s, 20.82 GB/s, tuned Fri Jan  4 19:07:43 2013
82944	N4quda10PackSpinorIddLi4ELi3ENS_11FloatNOrderIdLi4ELi3ELi2EEENS_21SpaceSpinorColorOrderIdLi4ELi3EEENS_13PreserveBasisIddLi4ELi3EEEEE	out_stride=82944,in_stride=82944	64	1	1	1296	1	1	12480	# 0.00 Gflop/s, 44.72 GB/s, tuned Fri Jan  4 18:03:46 2013
82944	N4quda10PackSpinorIddLi4ELi3ENS_21SpaceSpinorColorOrderIdLi4ELi3EEENS_11FloatNOrderIdLi4ELi3ELi2EEENS_13PreserveBasisIddLi4ELi3EEEEE	out_stride=82944,in_stride=82944	64	1	1	1296	1	1	12480	# 0.00 Gflop/s, 21.06 GB/s, tuned Fri Jan  4 18:04:30 2013
8x16x16x16	N4quda11axpyCGNorm2I7double26float26float4EE	stride=32768,prec=4	64	1	1	111	1	1	1024	# 38.58 Gflop/s, 77.16 GB/s, tuned Fri Apr 12 17:15:40 2013
8x16x16x16	N4quda11axpyCGNorm2I7double2S1_S1_EE	stride=32768,prec=8	352	1	1	14	1	1	5632	# 22.63 Gflop/s, 90.51 GB/s, tuned Tue May 20 16:21:19 2014
8x16x16x16	N4quda22HeavyQuarkResidualNormI7double37double2S2_EE	stride=32768,prec=8	128	1	1	99	1	1	3072	# 18.85 Gflop/s, 75.40 GB/s, tuned Fri Apr 12 17:15:50 2013
8x16x16x16	N4quda3DotId6float26float4EE	stride=32768,prec=4	96	1	1	109	1	1	768	# 16.53 Gflop/s, 66.13 GB/s, tuned Fri Apr 12 17:15:38 2013
8x16x16x16	N4quda3DotId7double2S1_EE	stride=32768,prec=8	352	1	1	28	1	1	2816	# 10.05 Gflop/s, 80.43 GB/s, tuned Tue May 20 16:21:17 2014
8x16x16x16	N4quda3xpyI7double2S1_EE	stride=32768,prec=8	1024	1	1	154	1	1	0	# 3.91 Gflop/s, 93.82 GB/s, tuned Fri Apr 12 17:15:45 2013
8x16x16x16	N4quda4axpyI6float26float4EE	stride=32768,prec=4	1024	1	1	229	1	1	0	# 14.69 Gflop/s, 88.14 GB/s, tuned Fri Apr 12 17:15:42 2013
8x16x16x16	N4quda4axpyI7double2S1_EE	stride=32768,prec=8	1024	1	1	244	1	1	0	# 8.13 Gflop/s, 97.59 GB/s, tuned Tue May 20 16:21:24 2014
8x16x16x16	N4quda4xpayI6float26float4EE	stride=32768,prec=4	1024	1	1	195	1	1	0	# 14.87 Gflop/s, 89.21 GB/s, tuned Fri Apr 12 17:15:37 2013
8x16x16x16	N4quda4xpayI7double2S1_EE	stride=32768,prec=8	1024	1	1	255	1	1	0	# 8.01 Gflop/s, 96.16 GB/s, tuned Fri Apr 12 17:15:31 2013
8x16x16x16	N4quda5Norm2Id7double2S1_EE	stride=32768,prec=8	448	1	1	27	1	1	3584	# 16.96 Gflop/s, 67.84 GB/s, tuned Fri Apr 12 17:15:32 2013
8x16x16x16	N4quda8axpyZpbxI6float26float4EE	stride=32768,prec=4	32	1	1	91	1	1	0	# 36.65 Gflop/s, 91.63 GB/s, tuned Fri Apr 12 17:15:41 2013
8x16x16x16	N4quda8axpyZpbxI7double2S1_EE	stride=32768,prec=8	512	1	1	8	1	1	0	# 19.38 Gflop/s, 96.92 GB/s, tuned Tue May 20 16:21:22 2014
8x16x16x16	N4quda8xmyNorm2Id7double2S1_EE	stride=32768,prec=8	512	1	1	13	1	1	4096	# 11.18 Gflop/s, 89.41 GB/s, tuned Fri Apr 12 17:15:35 2013
8x16x16x16	copyKernel	stride=32768,out_prec=4,in_prec=8	480	1	1	95	1	1	0	# 0.00 Gflop/s, 84.96 GB/s, tuned Fri Apr 12 17:15:36 2013
8x16x16x16	copyKernel	stride=32768,out_prec=8,in_prec=4	576	1	1	139	1	1	0	# 0.00 Gflop/s, 82.70 GB/s, tuned Fri Apr 12 17:15:43 2013
8x16x16x32	N4quda11axpyCGNorm2I7double26float26float4EE	stride=65536,prec=4	352	1	1	13	1	1	5632	# 43.68 Gflop/s, 87.36 GB/s, tuned Fri Apr 12 17:34:43 2013
8x16x16x32	N4quda11axpyCGNorm2I7double2S1_S1_EE	stride=65536,prec=8	544	1	1	11	1	1	8704	# 23.89 Gflop/s, 95.56 GB/s, tuned Fri Apr 12 17:58:06 2013
8x16x16x32	N4quda22HeavyQuarkResidualNormI7double37double2S2_EE	stride=65536,prec=8	320	1	1	191	1	1	7680	# 21.25 Gflop/s, 85.00 GB/s, tuned Fri Apr 12 17:35:02 2013
8x16x16x32	N4quda3DotId6float26float4EE	stride=65536,prec=4	64	1	1	112	1	1	512	# 19.92 Gflop/s, 79.66 GB/s, tuned Fri Apr 12 17:34:41 2013
8x16x16x32	N4quda3DotId7double2S1_EE	stride=65536,prec=8	96	1	1	112	1	1	768	# 11.07 Gflop/s, 88.53 GB/s, tuned Fri Apr 12 17:58:02 2013
8x16x16x32	N4quda3xpyI7double2S1_EE	stride=65536,prec=8	832	1	1	11	1	1	0	# 4.07 Gflop/s, 97.76 GB/s, tuned Fri Apr 12 17:34:54 2013
8x16x16x32	N4quda4axpyI6float26float4EE	stride=65536,prec=4	1024	1	1	248	1	1	0	# 15.82 Gflop/s, 94.90 GB/s, tuned Fri Apr 12 17:34:48 2013
8x16x16x32	N4quda4axpyI7double2S1_EE	stride=65536,prec=8	416	1	1	11	1	1	0	# 8.15 Gflop/s, 97.81 GB/s, tuned Fri Apr 12 17:58:16 2013
8x16x16x32	N4quda4xpayI6float26float4EE	stride=65536,prec=4	1024	1	1	252	1	1	0	# 15.85 Gflop/s, 95.10 GB/s, tuned Fri Apr 12 17:34:39 2013
8x16x16x32	N4quda4xpayI7double2S1_EE	stride=65536,prec=8	832	1	1	11	1	1	0	# 8.19 Gflop/s, 98.24 GB/s, tuned Fri Apr 12 17:34:29 2013
8x16x16x32	N4quda5Norm2Id7double2S1_EE	stride=65536,prec=8	128	1	1	95	1	1	1024	# 20.28 Gflop/s, 81.11 GB/s, tuned Fri Apr 12 17:34:31 2013
8x16x16x32	N4quda8axpyZpbxI6float26float4EE	stride=65536,prec=4	320	1	1	8	1	1	0	# 38.26 Gflop/s, 95.65 GB/s, tuned Fri Apr 12 17:34:46 2013
8x16x16x32	N4quda8axpyZpbxI7double2S1_EE	stride=65536,prec=8	160	1	1	16	1	1	0	# 19.47 Gflop/s, 97.36 GB/s, tuned Fri Apr 12 17:58:13 2013
8x16x16x32	N4quda8xmyNorm2Id7double2S1_EE	stride=65536,prec=8	32	1	1	112	1	1	512	# 11.81 Gflop/s, 94.45 GB/s, tuned Fri Apr 12 17:34:35 2013
8x16x16x32	copyKernel	stride=65536,out_prec=4,in_prec=8	512	1	1	187	1	1	0	# 0.00 Gflop/s, 89.54 GB/s, tuned Fri Apr 12 17:34:37 2013
8x16x16x32	copyKernel	stride=65536,out_prec=8,in_prec=4	608	1	1	240	1	1	0	# 0.00 Gflop/s, 87.71 GB/s, tuned Fri Apr 12 17:34:50 2013
8x16x16x8	N4quda11axpyCGNorm2I7double26float26float4EE	stride=16384,prec=4	160	1	1	35	1	1	2560	# 31.37 Gflop/s, 62.75 GB/s, tuned Wed Aug  6 17:34:23 2014
8x16x16x8	N4quda22HeavyQuarkResidualNormI7double37double2S2_EE	stride=16384,prec=8	256	1	1	51	1	1	6144	# 15.90 Gflop/s, 63.59 GB/s, tuned Wed Aug  6 17:34:30 2014
8x16x16x8	N4quda3DotId6float26float4EE	stride=16384,prec=4	192	1	1	49	1	1	1536	# 12.73 Gflop/s, 50.93 GB/s, tuned Wed Aug  6 17:34:22 2014
8x16x16x8	N4quda3xpyI7double2S1_EE	stride=16384,prec=8	64	1	1	112	1	1	0	# 3.77 Gflop/s, 90.55 GB/s, tuned Wed Aug  6 17:34:26 2014
8x16x16x8	N4quda4axpyI6float26float4EE	stride=16384,prec=4	64	1	1	111	1	1	0	# 13.30 Gflop/s, 79.79 GB/s, tuned Wed Aug  6 17:34:25 2014
8x16x16x8	N4quda4xpayI6float26float4EE	stride=16384,prec=4	64	1	1	111	1	1	0	# 13.41 Gflop/s, 80.45 GB/s, tuned Wed Aug  6 17:34:21 2014
8x16x16x8	N4quda4xpayI7double2S1_EE	stride=16384,prec=8	1024	1	1	229	1	1	0	# 7.62 Gflop/s, 91.42 GB/s, tuned Wed Aug  6 17:34:18 2014
8x16x16x8	N4quda5Norm2Id7double2S1_EE	stride=16384,prec=8	192	1	1	61	1	1	1536	# 12.83 Gflop/s, 51.33 GB/s, tuned Wed Aug  6 17:34:18 2014
8x16x16x8	N4quda8axpyZpbxI6float26float4EE	stride=16384,prec=4	96	1	1	48	1	1	0	# 34.52 Gflop/s, 86.29 GB/s, tuned Wed Aug  6 17:34:24 2014
8x16x16x8	N4quda8xmyNorm2Id7double2S1_EE	stride=16384,prec=8	224	1	1	24	1	1	1792	# 10.03 Gflop/s, 80.25 GB/s, tuned Wed Aug  6 17:34:20 2014
8x16x16x8	copyKernel	stride=16384,out_prec=4,in_prec=8	352	1	1	12	1	1	0	# 0.00 Gflop/s, 77.81 GB/s, tuned Wed Aug  6 17:34:20 2014
8x16x16x8	copyKernel	stride=16384,out_prec=8,in_prec=4	544	1	1	69	1	1	0	# 0.00 Gflop/s, 76.64 GB/s, tuned Wed Aug  6 17:34:25 2014
8x16x8x16	N4quda11axpyCGNorm2I7double26float26float4EE	stride=16384,prec=4	224	1	1	42	1	1	3584	# 32.07 Gflop/s, 64.14 GB/s, tuned Sun Jun 28 20:35:39 2015
8x16x8x16	N4quda14PackFaceWilsonI6float4EE	dim=2,stride=16384,prec=4	320	1	1	13	1	1	8193	# 1.24 Gflop/s, 29.87 GB/s, tuned Sun Jun 28 20:35:36 2015
8x16x8x16	N4quda14PackFaceWilsonI7double2EE	dim=2,stride=16384,prec=8	64	1	1	64	1	1	0	# 1.00 Gflop/s, 48.06 GB/s, tuned Sun Jun 28 20:35:32 2015
8x16x8x16	N4quda22HeavyQuarkResidualNormI7double37double2S2_EE	stride=16384,prec=8	256	1	1	50	1	1	6144	# 16.28 Gflop/s, 65.12 GB/s, tuned Sun Jun 28 20:35:49 2015
8x16x8x16	N4quda3DotId6float26float4EE	stride=16384,prec=4	384	1	1	28	1	1	3072	# 12.96 Gflop/s, 51.85 GB/s, tuned Sun Jun 28 20:35:38 2015
8x16x8x16	N4quda3xpyI7double2S1_EE	stride=16384,prec=8	960	1	1	248	1	1	0	# 3.78 Gflop/s, 90.80 GB/s, tuned Sun Jun 28 20:35:42 2015
8x16x8x16	N4quda4axpyI6float26float4EE	stride=16384,prec=4	512	1	1	244	1	1	0	# 13.35 Gflop/s, 80.10 GB/s, tuned Sun Jun 28 20:35:41 2015
8x16x8x16	N4quda4xpayI6float26float4EE	stride=16384,prec=4	64	1	1	111	1	1	0	# 13.50 Gflop/s, 80.98 GB/s, tuned Sun Jun 28 20:35:37 2015
8x16x8x16	N4quda4xpayI7double2S1_EE	stride=16384,prec=8	1024	1	1	214	1	1	0	# 7.70 Gflop/s, 92.39 GB/s, tuned Sun Jun 28 20:35:34 2015
8x16x8x16	N4quda5Norm2Id7double2S1_EE	stride=16384,prec=8	288	1	1	42	1	1	2304	# 13.11 Gflop/s, 52.46 GB/s, tuned Sun Jun 28 20:35:34 2015
8x16x8x16	N4quda8axpyZpbxI6float26float4EE	stride=16384,prec=4	1024	1	1	126	1	1	0	# 34.82 Gflop/s, 87.06 GB/s, tuned Sun Jun 28 20:35:40 2015
8x16x8x16	N4quda8xmyNorm2Id7double2S1_EE	stride=16384,prec=8	480	1	1	14	1	1	3840	# 10.04 Gflop/s, 80.34 GB/s, tuned Sun Jun 28 20:35:36 2015
8x16x8x16	copyKernel	stride=16384,out_prec=4,in_prec=8	416	1	1	46	1	1	0	# 0.00 Gflop/s, 78.52 GB/s, tuned Sun Jun 28 20:35:36 2015
8x16x8x16	copyKernel	stride=16384,out_prec=8,in_prec=4	320	1	1	53	1	1	0	# 0.00 Gflop/s, 77.69 GB/s, tuned Sun Jun 28 20:35:41 2015
